product_id,sku,name,description,price,currency,category_id,status,created_at,updated_at
424,SKU1423,Sense Success,Item minute left party risk true rock.,249.74,USD,1,ARCHIVED,2025-07-30 13:27:20,2025-05-01 12:58:16
425,SKU1424,You They,Present past example push order mention.,33.49,USD,2,ACTIVE,2025-07-25 17:37:09,2025-02-20 20:59:16
426,SKU1425,How Leg,Machine Democrat this party city.,277.02,USD,10,INACTIVE,2025-05-20 23:17:35,2025-03-12 02:15:27
427,SKU1426,Everybody Think,Show fill list nothing race marriage.,223.56,USD,7,INACTIVE,2025-01-25 18:58:31,2025-08-06 19:07:20
428,SKU1427,Also Knowledge,Four those gun north agent loss.,444.41,USD,6,ARCHIVED,2025-03-10 15:08:52,2025-04-15 08:15:41
429,SKU1428,Price Admit,Oil decide job himself discussion at.,178.7,USD,6,INACTIVE,2025-03-13 13:09:12,2025-01-28 14:15:35
430,SKU1429,Hospital Western,Finally value campaign mother.,62.95,USD,7,ARCHIVED,2025-07-15 04:42:39,2025-05-18 20:04:15
431,SKU1430,Population Pay,Food final book personal guess maybe follow.,75.78,USD,10,ACTIVE,2025-07-14 06:40:05,2025-08-23 10:37:07
432,SKU1431,Member Phone,Notice wish him reflect action check.,381.95,USD,9,INACTIVE,2025-06-20 04:56:47,2025-07-11 14:36:15
433,SKU1432,Order Thing,Time rest argue join it none particularly full.,311.02,USD,2,ARCHIVED,2025-01-19 08:19:57,2025-04-06 13:22:32
434,SKU1433,Raise Left,It fine environment common party house past.,55.06,USD,7,INACTIVE,2025-06-27 11:15:11,2025-05-08 18:57:57
435,SKU1434,Answer Baby,Pm ago difference two left buy.,46.63,USD,10,INACTIVE,2025-03-26 23:22:23,2025-06-15 13:40:24
436,SKU1435,Building After,Skill company gun anyone hard factor by money.,351.98,USD,4,ACTIVE,2025-05-03 03:58:15,2025-03-06 10:15:18
437,SKU1436,Hotel Front,Nation everything bring success professor program no.,41.02,USD,5,ARCHIVED,2025-06-29 08:47:17,2025-06-08 01:29:57
438,SKU1437,Back She,Far evening party travel develop.,411.82,USD,1,ARCHIVED,2025-04-17 18:39:12,2025-05-13 09:18:04
439,SKU1438,Thought Will,West certain your assume their.,354.59,USD,7,ACTIVE,2025-06-01 16:56:25,2025-01-30 00:55:49
440,SKU1439,Care Probably,Wall my kid thank now.,45.27,USD,1,ACTIVE,2025-08-05 13:38:33,2025-03-24 11:13:37
441,SKU1440,Least Eat,Size present sound blue mouth add around.,46.99,USD,9,ARCHIVED,2025-02-21 22:16:35,2025-05-25 23:11:25
442,SKU1441,Now Few,Budget PM expert pick local.,493.39,USD,9,INACTIVE,2025-07-18 13:25:36,2025-04-08 18:09:23
443,SKU1442,Nearly Carry,Technology owner others camera.,190.26,USD,4,ACTIVE,2025-08-05 09:44:24,2025-05-10 01:28:42
444,SKU1443,Space Understand,Bit history south imagine enter.,188.47,USD,6,ACTIVE,2025-07-02 03:34:07,2025-03-15 18:37:12
445,SKU1444,Section Name,Blood sense like government try bed.,407.34,USD,7,INACTIVE,2025-06-02 01:19:33,2025-05-17 22:59:40
446,SKU1445,Whom Management,Dark indeed skin peace.,473.89,USD,2,ARCHIVED,2025-04-15 22:35:52,2025-07-28 00:50:43
447,SKU1446,Relationship Green,Surface approach none beyond anyone policy respond.,493.07,USD,6,INACTIVE,2025-06-01 19:43:10,2025-02-23 11:37:46
448,SKU1447,Black Price,Nature military not result finish son authority third.,377.92,USD,10,ACTIVE,2025-02-10 12:35:29,2025-05-26 13:29:29
449,SKU1448,List Third,Western American nation.,191.25,USD,6,INACTIVE,2025-05-02 20:11:39,2025-04-05 04:38:20
450,SKU1449,Customer Industry,Feel four fund.,46.33,USD,2,ARCHIVED,2025-06-22 09:52:26,2025-07-25 21:16:53
451,SKU1450,Guy Floor,Product although official.,389.69,USD,5,ACTIVE,2025-02-23 18:11:11,2025-03-15 12:00:13
452,SKU1451,Room Quite,Now air hand church.,281.41,USD,9,INACTIVE,2025-05-23 22:25:33,2025-03-28 15:44:41
453,SKU1452,Spring Wrong,Listen break day type myself civil look.,214.99,USD,5,ARCHIVED,2025-02-02 20:51:20,2025-06-12 00:36:53
454,SKU1453,Significant Culture,Billion account only girl try explain federal.,453.65,USD,7,ARCHIVED,2025-01-16 14:33:18,2025-05-02 17:27:25
455,SKU1454,Time Personal,Husband morning daughter trip.,60.04,USD,6,ARCHIVED,2025-05-01 00:27:05,2025-02-23 11:16:24
456,SKU1455,Discover State,Growth environment country night.,248.85,USD,7,ARCHIVED,2025-04-05 22:56:19,2025-05-30 11:56:25
457,SKU1456,Bed Certainly,Set wonder cut help material activity.,10.62,USD,5,ARCHIVED,2025-01-14 17:08:35,2025-06-05 21:22:27
458,SKU1457,Claim Wall,Society case indicate yourself probably save.,236.99,USD,9,ARCHIVED,2025-04-22 10:52:54,2025-02-11 01:23:38
459,SKU1458,Explain Word,Way outside difference lose study arrive.,32.87,USD,3,ACTIVE,2025-05-04 14:36:25,2025-08-25 18:03:08
460,SKU1459,Nothing Series,Way red shake on president whole.,63.81,USD,4,ARCHIVED,2025-06-14 22:44:58,2025-05-22 11:46:24
461,SKU1460,Information Mouth,Red get early.,63.18,USD,7,ARCHIVED,2025-01-08 13:40:11,2025-04-20 00:10:32
462,SKU1461,American Wonder,Because follow increase describe voice.,326.36,USD,7,ARCHIVED,2025-06-19 06:31:47,2025-03-27 14:33:05
463,SKU1462,Recent Discover,Four alone campaign western.,374.29,USD,3,INACTIVE,2025-06-09 13:25:15,2025-07-06 12:09:10
464,SKU1463,Moment Development,Girl recent whole present.,293.77,USD,10,ACTIVE,2025-05-13 02:47:59,2025-04-16 01:06:07
465,SKU1464,Appear Design,Raise claim safe school live benefit.,481.28,USD,10,ACTIVE,2025-06-05 12:43:05,2025-07-28 02:06:40
466,SKU1465,Explain Force,Personal outside right general window like grow.,190.56,USD,5,INACTIVE,2025-07-04 13:16:44,2025-06-14 01:11:19
467,SKU1466,Sit Stock,Reflect middle brother maybe animal the across.,146.43,USD,7,ARCHIVED,2025-07-02 07:37:35,2025-05-16 14:26:33
468,SKU1467,Put Father,Wind girl give I hope.,434.96,USD,9,INACTIVE,2025-06-11 08:09:07,2025-01-13 13:18:45
469,SKU1468,Financial Drop,Alone how direction off Republican view lead pass.,115.68,USD,1,INACTIVE,2025-05-05 11:49:24,2025-02-17 14:29:05
470,SKU1469,True Science,Year production himself suddenly cost someone strong.,481.8,USD,5,INACTIVE,2025-02-28 02:07:57,2025-01-17 15:57:33
471,SKU1470,Cold Them,Base article many maybe center.,11.02,USD,5,ACTIVE,2025-08-24 14:20:36,2025-04-18 12:44:44
472,SKU1471,Each Event,Radio call between health police office.,485.09,USD,4,ACTIVE,2025-03-25 08:31:20,2025-06-30 05:17:42
473,SKU1472,During Above,Throw feeling beautiful drug spring.,26.36,USD,7,ACTIVE,2025-06-15 05:17:31,2025-03-11 07:44:34
474,SKU1473,Life Process,Person tonight modern down.,446.12,USD,10,ARCHIVED,2025-08-28 01:33:34,2025-01-31 16:21:46
475,SKU1474,Sing Mother,Court cup business decide strategy investment.,266.21,USD,10,ARCHIVED,2025-09-06 07:31:46,2025-09-02 02:54:45
476,SKU1475,Still Style,So learn south sound quite add other.,496.52,USD,6,INACTIVE,2025-08-30 05:26:28,2025-03-21 02:09:55
477,SKU1476,Radio Claim,Finish let impact commercial though together deal best.,41.53,USD,8,ACTIVE,2025-04-02 11:07:14,2025-07-13 10:59:31
478,SKU1477,Well Security,Usually feel bank area.,279.16,USD,8,ACTIVE,2025-09-02 00:05:35,2025-02-25 20:22:00
479,SKU1478,Painting Result,Baby thus deep daughter.,484.8,USD,8,ARCHIVED,2025-03-04 13:33:54,2025-06-07 02:03:26
480,SKU1479,Effort Certain,Capital kid series Mrs budget surface.,263.93,USD,4,ARCHIVED,2025-07-25 05:09:56,2025-02-13 15:25:09
481,SKU1480,Mention Score,Way pretty open and star.,316.55,USD,9,ACTIVE,2025-02-07 04:47:41,2025-08-05 18:40:59
482,SKU1481,Into One,Language face people.,349.4,USD,8,ACTIVE,2025-07-09 14:25:12,2025-07-02 08:27:57
483,SKU1482,Fish Wear,Available growth suffer.,230.0,USD,3,ARCHIVED,2025-01-01 05:26:40,2025-05-30 11:26:41
484,SKU1483,Moment Guess,Window issue board indicate analysis.,315.64,USD,2,ARCHIVED,2025-05-27 07:18:09,2025-06-12 14:24:30
485,SKU1484,Population Cultural,Drop itself other realize collection than yourself.,294.24,USD,5,ACTIVE,2025-02-04 04:00:17,2025-07-30 22:02:45
486,SKU1485,Treatment Little,Cold goal ever career.,451.07,USD,9,INACTIVE,2025-01-11 09:09:30,2025-08-06 07:53:06
487,SKU1486,Well End,Street step certainly describe she role.,27.5,USD,10,INACTIVE,2025-07-12 19:06:41,2025-03-02 10:05:06
488,SKU1487,Road Company,Teach task notice.,144.08,USD,6,INACTIVE,2025-03-18 12:29:39,2025-01-04 12:24:37
489,SKU1488,Short Can,Pay seem official.,475.45,USD,2,INACTIVE,2025-08-28 00:05:21,2025-06-04 21:59:13
490,SKU1489,Market Role,Include author here bank ability technology.,445.68,USD,4,ACTIVE,2025-06-26 22:23:46,2025-06-29 19:18:57
491,SKU1490,Meet Head,Base college make economic.,230.55,USD,5,INACTIVE,2025-03-21 07:10:42,2025-02-14 03:47:42
492,SKU1491,Change She,Wife hear appear seem generation still response available.,311.97,USD,4,INACTIVE,2025-01-05 07:21:25,2025-06-25 02:14:18
493,SKU1492,Final Can,American history spend health coach.,142.3,USD,4,ARCHIVED,2025-05-09 14:38:09,2025-05-31 18:48:27
494,SKU1493,True White,Card show between finish.,98.12,USD,3,INACTIVE,2025-01-16 04:33:41,2025-02-19 08:51:24
495,SKU1494,Mind Debate,Drive never major reflect set management the.,234.53,USD,1,ARCHIVED,2025-01-01 07:49:09,2025-06-14 20:41:49
496,SKU1495,Crime Song,Type poor land front situation scene.,179.91,USD,1,ARCHIVED,2025-03-17 16:58:05,2025-04-27 23:39:24
497,SKU1496,Dream Suffer,Per media purpose expert station ahead sing spring.,293.91,USD,4,ACTIVE,2025-08-20 05:49:06,2025-01-31 11:49:47
498,SKU1497,Current They,People responsibility next enjoy follow about.,43.48,USD,8,ACTIVE,2025-08-16 13:52:27,2025-03-18 20:05:19
499,SKU1498,Successful Green,Rich stage cell hand.,487.33,USD,10,ACTIVE,2025-04-10 22:57:35,2025-08-21 21:49:57
500,SKU1499,Son Personal,Once nature material attack these.,493.17,USD,2,ACTIVE,2025-06-06 17:26:29,2025-02-28 07:14:25
501,SKU1500,Community Find,Physical cold new together.,350.59,USD,8,ARCHIVED,2025-04-04 22:56:53,2025-01-03 20:39:49
502,SKU1501,Civil See,Have assume east walk film accept.,270.37,USD,7,ACTIVE,2025-04-08 09:08:42,2025-01-24 15:25:11
503,SKU1502,Hair Picture,Value statement bad across.,158.22,USD,10,ARCHIVED,2025-02-04 11:58:36,2025-03-03 20:17:02
504,SKU1503,Far Really,Really hear expect.,407.83,USD,4,ACTIVE,2025-01-19 11:55:15,2025-06-07 00:34:59
505,SKU1504,Short Top,Change bring century agency boy management.,343.94,USD,7,INACTIVE,2025-08-19 21:46:26,2025-03-15 13:38:41
506,SKU1505,Expert Dream,Child option moment leg.,85.5,USD,8,INACTIVE,2025-07-28 11:08:27,2025-05-22 20:39:00
507,SKU1506,Before Move,Employee money company good.,455.91,USD,7,ARCHIVED,2025-08-27 12:24:58,2025-09-07 03:14:09
508,SKU1507,Myself Prepare,Market difference song anything next.,412.16,USD,4,INACTIVE,2025-05-01 13:38:17,2025-04-05 11:20:18
509,SKU1508,Control Yard,Once up arm particular town human.,475.15,USD,3,INACTIVE,2025-08-18 19:51:55,2025-08-31 19:44:29
510,SKU1509,Stage I,While act Democrat south.,364.23,USD,1,ARCHIVED,2025-08-25 00:01:29,2025-01-12 12:52:59
511,SKU1510,Loss Consider,Live trouble indeed contain music toward near.,308.64,USD,2,INACTIVE,2025-03-16 11:07:27,2025-01-22 13:11:46
512,SKU1511,Rise Pretty,System also question task break exactly guy.,212.03,USD,7,INACTIVE,2025-02-02 06:37:13,2025-03-07 12:54:43
513,SKU1512,Defense Best,Reveal owner property rise call investment build.,466.7,USD,4,INACTIVE,2025-05-15 07:19:47,2025-04-18 17:18:23
514,SKU1513,Past Bill,Sort science laugh strategy seat.,433.7,USD,3,ACTIVE,2025-09-05 12:07:47,2025-02-15 19:54:23
515,SKU1514,Morning Building,House peace land themselves someone.,27.38,USD,9,ARCHIVED,2025-06-19 03:58:18,2025-01-06 13:18:35
516,SKU1515,Find Industry,Beat rather over respond.,18.05,USD,8,ACTIVE,2025-06-12 08:14:07,2025-06-10 21:05:27
517,SKU1516,Brother Sort,Building set senior through officer player it PM.,191.35,USD,1,INACTIVE,2025-07-29 05:44:48,2025-04-21 18:29:09
518,SKU1517,Set Eye,Western prove open pick floor compare.,406.22,USD,9,INACTIVE,2025-08-19 07:13:08,2025-06-27 19:57:11
519,SKU1518,Hair Agency,National election several.,493.7,USD,4,ACTIVE,2025-02-13 08:22:56,2025-08-10 09:24:22
520,SKU1519,Glass Newspaper,Citizen your day agree.,79.46,USD,2,INACTIVE,2025-06-16 07:26:46,2025-04-25 10:37:25
521,SKU1520,Last Effort,Interview air everyone certain.,299.09,USD,8,ARCHIVED,2025-06-17 10:14:03,2025-02-18 04:01:19
522,SKU1521,Three Follow,Article knowledge quality so subject.,193.54,USD,3,ARCHIVED,2025-02-20 17:40:26,2025-06-09 09:50:09
523,SKU1522,With Product,Realize student teach cultural.,485.11,USD,8,ARCHIVED,2025-01-09 16:36:34,2025-01-25 14:14:29
524,SKU1523,Available International,Similar evening sound specific girl.,421.85,USD,9,INACTIVE,2025-08-02 05:27:13,2025-06-10 06:54:06
525,SKU1524,Suddenly Realize,Wind manage character continue agency anything score.,419.97,USD,9,ARCHIVED,2025-03-01 00:37:55,2025-02-14 15:02:57
526,SKU1525,Care Onto,Himself a fund land beautiful reality record.,237.0,USD,10,ARCHIVED,2025-04-12 00:29:25,2025-03-14 18:55:00
527,SKU1526,Exactly Happen,Wind mother or land almost effort short.,210.34,USD,6,INACTIVE,2025-01-03 07:16:08,2025-05-21 15:08:52
528,SKU1527,Organization Drive,Data daughter speech term television.,140.34,USD,8,ACTIVE,2025-05-19 11:16:48,2025-01-13 03:34:45
529,SKU1528,Hold Piece,Act continue prevent will.,32.91,USD,10,ACTIVE,2025-01-10 01:44:03,2025-01-22 13:02:04
530,SKU1529,Action Significant,Economic plant truth start.,433.04,USD,9,INACTIVE,2025-08-08 01:50:39,2025-07-04 06:50:16
531,SKU1530,Century Account,Through effort five know baby true gas home.,407.39,USD,7,ARCHIVED,2025-02-13 05:24:37,2025-03-26 11:29:41
532,SKU1531,Them Home,By market majority billion.,499.86,USD,9,ACTIVE,2025-02-22 08:44:37,2025-07-24 06:18:21
533,SKU1532,Call Charge,Perform these evening hold.,498.34,USD,8,ACTIVE,2025-03-31 06:48:09,2025-01-06 00:47:37
534,SKU1533,May Type,Every threat attack by hospital soon believe.,279.94,USD,3,ACTIVE,2025-04-05 02:35:14,2025-04-27 13:02:28
535,SKU1534,Structure She,Financial wide by.,385.65,USD,8,INACTIVE,2025-08-20 09:26:47,2025-07-31 02:26:48
536,SKU1535,Approach Part,Mother art sister mind part.,472.66,USD,8,ACTIVE,2025-02-23 13:38:05,2025-02-20 02:52:32
537,SKU1536,Generation Less,Factor fire low factor statement majority.,425.58,USD,5,ACTIVE,2025-02-02 19:24:12,2025-08-27 18:10:35
538,SKU1537,Nice Race,Tax provide water tree gas prepare.,127.44,USD,4,INACTIVE,2025-08-31 10:54:39,2025-06-26 10:04:50
539,SKU1538,Former Safe,Call someone but lay.,228.02,USD,5,INACTIVE,2025-04-13 20:35:14,2025-05-02 06:58:07
540,SKU1539,American Respond,Never rather simple poor with raise.,68.93,USD,9,INACTIVE,2025-06-18 13:32:20,2025-04-12 02:47:20
541,SKU1540,Themselves Theory,Tree approach land concern tax weight top.,477.26,USD,8,ACTIVE,2025-04-12 21:17:47,2025-08-14 21:18:53
542,SKU1541,Program Kind,Box next consumer must alone final build.,305.06,USD,4,ACTIVE,2025-08-07 01:12:43,2025-04-19 19:45:22
543,SKU1542,Imagine Almost,Seem mother also benefit population.,118.18,USD,5,INACTIVE,2025-01-13 23:36:35,2025-04-23 05:51:10
544,SKU1543,Stop Congress,Adult build she pass stop.,337.49,USD,8,ARCHIVED,2025-04-17 07:36:19,2025-05-09 09:28:44
545,SKU1544,Today Remember,Religious be indeed why consumer fight important politics.,310.97,USD,2,INACTIVE,2025-06-21 01:31:58,2025-07-12 18:11:12
546,SKU1545,Boy Base,Certainly serious me also rest full reach.,182.29,USD,5,ACTIVE,2025-02-13 12:36:54,2025-06-06 10:22:17
547,SKU1546,Of Radio,Unit enjoy act side though.,61.21,USD,4,ACTIVE,2025-02-05 22:11:59,2025-03-05 06:16:19
548,SKU1547,Politics Forward,Between include soldier threat many question.,337.43,USD,5,INACTIVE,2025-04-30 00:14:56,2025-05-10 08:48:27
549,SKU1548,Usually Expect,Face type listen wide.,262.55,USD,6,ARCHIVED,2025-06-13 18:51:31,2025-08-27 14:44:36
550,SKU1549,Media Sort,Message camera lay while.,387.3,USD,6,ARCHIVED,2025-05-11 12:25:25,2025-02-09 16:14:19
551,SKU1550,Sometimes Race,Finish staff man question again.,262.48,USD,9,ACTIVE,2025-05-31 01:36:38,2025-05-09 09:10:36
552,SKU1551,Determine Series,Society same choose same mother ability.,426.83,USD,2,ARCHIVED,2025-01-05 03:32:44,2025-02-11 16:04:07
553,SKU1552,Cost Much,Scene idea sister return.,278.19,USD,3,ARCHIVED,2025-04-03 03:30:09,2025-01-28 10:48:20
554,SKU1553,House Realize,Test near both what.,282.66,USD,3,ARCHIVED,2025-04-24 11:26:07,2025-07-23 00:05:45
555,SKU1554,Half Tough,Civil know we like local similar health more.,438.94,USD,4,INACTIVE,2025-06-21 06:54:03,2025-02-11 00:26:10
556,SKU1555,Political Employee,Blue thousand base then director medical rule.,204.72,USD,7,ACTIVE,2025-05-29 22:34:25,2025-01-08 22:46:27
557,SKU1556,Food Similar,Mother tree computer mind employee despite.,71.34,USD,3,INACTIVE,2025-03-19 11:00:23,2025-04-16 06:13:58
558,SKU1557,Theory Base,Paper art receive exactly push.,19.25,USD,4,ARCHIVED,2025-08-23 16:50:10,2025-07-19 07:33:08
559,SKU1558,Memory Also,Mrs dream trade north purpose by drug.,378.79,USD,2,ACTIVE,2025-07-09 20:54:39,2025-04-18 08:17:47
560,SKU1559,Change Break,Seem true adult surface through.,312.05,USD,7,INACTIVE,2025-03-17 12:29:45,2025-08-12 21:10:36
561,SKU1560,Or His,Culture Mr personal realize group phone dream notice.,353.52,USD,7,ACTIVE,2025-05-20 10:58:28,2025-01-17 16:46:30
562,SKU1561,Build Staff,Identify husband place may.,110.42,USD,6,INACTIVE,2025-03-14 13:16:31,2025-03-22 15:35:57
563,SKU1562,Hand Model,Fight pretty billion certainly require.,72.5,USD,9,ACTIVE,2025-09-06 01:02:44,2025-07-29 23:19:17
564,SKU1563,Even Head,Suddenly camera involve religious.,12.2,USD,8,INACTIVE,2025-03-30 10:26:57,2025-01-15 10:33:36
565,SKU1564,Who Certainly,Everybody military economy wide.,178.54,USD,7,ARCHIVED,2025-07-22 20:51:41,2025-04-30 11:21:36
566,SKU1565,Successful Though,Skill material believe.,297.01,USD,1,INACTIVE,2025-08-19 23:02:23,2025-02-24 06:06:02
567,SKU1566,Poor Machine,Rate direction project member because light.,199.16,USD,4,ARCHIVED,2025-04-19 02:34:45,2025-05-07 12:20:35
568,SKU1567,Watch Product,Room nearly chair condition.,221.55,USD,7,INACTIVE,2025-07-18 13:22:48,2025-06-05 19:38:37
569,SKU1568,Machine Color,My push their research them risk.,452.56,USD,7,ARCHIVED,2025-05-24 05:15:55,2025-03-18 11:17:08
570,SKU1569,Face Company,Meeting language start attention at most.,177.39,USD,10,ARCHIVED,2025-04-12 06:57:47,2025-06-14 23:45:13
571,SKU1570,Even Stand,Audience keep other she treatment what.,259.42,USD,1,INACTIVE,2025-07-10 08:31:52,2025-05-13 20:32:28
572,SKU1571,Performance Blood,Such especially class else feel.,392.91,USD,10,INACTIVE,2025-03-03 03:51:50,2025-08-16 15:12:07
573,SKU1572,Will Eat,Start like catch day black commercial standard rule.,201.29,USD,7,ACTIVE,2025-03-02 07:14:40,2025-05-07 00:12:54
574,SKU1573,Tough Oil,Low maybe may.,312.93,USD,8,INACTIVE,2025-06-25 09:13:45,2025-08-31 10:41:07
575,SKU1574,Season School,Degree may house from.,431.87,USD,1,ACTIVE,2025-08-08 00:43:20,2025-04-24 06:10:32
576,SKU1575,Why A,Body teach drive and box.,475.01,USD,6,INACTIVE,2025-08-08 19:44:11,2025-04-11 14:35:32
577,SKU1576,Run Well,Bank just generation.,77.8,USD,5,ACTIVE,2025-08-15 12:07:30,2025-07-14 18:07:22
578,SKU1577,Tell One,Rock reality family explain.,463.66,USD,7,ARCHIVED,2025-02-20 20:57:29,2025-06-23 11:52:59
579,SKU1578,Itself Arrive,Citizen interesting box entire perform.,248.6,USD,7,INACTIVE,2025-04-10 23:44:24,2025-07-17 03:13:50
580,SKU1579,Manage Road,Example simple send trade soon.,132.83,USD,9,ARCHIVED,2025-05-23 17:43:24,2025-06-15 00:14:35
581,SKU1580,Nice Control,Able people issue part much all.,232.27,USD,9,INACTIVE,2025-03-03 01:21:48,2025-08-09 23:24:18
582,SKU1581,Different Him,Affect growth suggest material best.,490.12,USD,10,ACTIVE,2025-04-03 06:22:21,2025-02-28 11:16:11
583,SKU1582,Social Over,Second school most hotel Republican treat.,248.85,USD,4,INACTIVE,2025-04-08 22:14:25,2025-04-17 12:24:50
584,SKU1583,First Consider,From partner someone know some.,167.73,USD,8,ACTIVE,2025-07-18 05:21:17,2025-08-13 20:41:13
585,SKU1584,Drug Wind,Data continue hand pull.,318.53,USD,4,ACTIVE,2025-03-01 05:34:37,2025-05-17 08:43:19
586,SKU1585,Husband Letter,About give too play.,123.87,USD,5,INACTIVE,2025-07-05 20:53:52,2025-07-26 19:00:51
587,SKU1586,Cultural His,Morning second loss check face modern team.,42.55,USD,7,ARCHIVED,2025-08-23 12:40:10,2025-02-03 09:49:07
588,SKU1587,High Nearly,These week season firm parent great door.,68.8,USD,8,INACTIVE,2025-03-25 21:34:43,2025-04-29 01:10:12
589,SKU1588,Environmental Have,Magazine here mission everyone list.,68.38,USD,1,ARCHIVED,2025-04-25 16:42:50,2025-01-18 16:19:06
590,SKU1589,Politics Value,Full since bad executive.,80.19,USD,7,ACTIVE,2025-01-21 18:17:39,2025-03-10 09:32:08
591,SKU1590,Myself Democratic,Energy fill example similar peace.,73.72,USD,6,INACTIVE,2025-07-31 13:48:37,2025-08-26 10:04:51
592,SKU1591,Shake Picture,Test analysis her stop worker policy candidate.,322.23,USD,7,INACTIVE,2025-02-07 17:34:55,2025-08-24 08:34:02
593,SKU1592,Trade Feeling,Economy agreement professional join.,95.03,USD,3,ARCHIVED,2025-01-23 13:41:07,2025-07-22 15:33:52
594,SKU1593,Mouth Discuss,People television purpose success forward give keep senior.,176.11,USD,8,INACTIVE,2025-01-13 15:16:32,2025-09-01 20:58:46
595,SKU1594,Performance Size,Argue environmental race officer deal sing late.,448.91,USD,3,ACTIVE,2025-05-12 11:31:11,2025-06-29 19:36:54
596,SKU1595,Page Eye,Push speech beautiful detail.,239.61,USD,10,INACTIVE,2025-05-15 11:16:58,2025-07-18 22:36:33
597,SKU1596,Site Actually,Bad close television what once safe professional less.,335.44,USD,9,ACTIVE,2025-08-16 11:06:25,2025-07-22 17:52:58
598,SKU1597,Alone Mouth,Final respond hand positive personal after.,90.3,USD,1,ACTIVE,2025-01-23 05:32:35,2025-08-27 14:49:03
599,SKU1598,Life Same,Term camera inside property become event other economic.,100.18,USD,7,ARCHIVED,2025-02-27 13:46:46,2025-06-20 08:32:28
600,SKU1599,Approach But,Safe they bank budget throughout small audience.,25.23,USD,10,ARCHIVED,2025-06-09 20:37:32,2025-06-02 00:52:43
601,SKU1600,Town Stage,Pull significant sense financial provide.,88.62,USD,10,ACTIVE,2025-03-29 07:09:16,2025-07-06 11:20:14
602,SKU1601,Executive When,Network small fine late either include court.,142.9,USD,1,ARCHIVED,2025-04-22 13:33:37,2025-08-09 02:26:53
603,SKU1602,Least Live,Risk what management give focus hotel training inside.,92.62,USD,2,ARCHIVED,2025-04-13 17:41:08,2025-02-06 23:14:35
604,SKU1603,Music Job,Cold seek idea learn compare.,48.91,USD,7,ACTIVE,2025-01-08 04:59:19,2025-01-05 20:14:00
605,SKU1604,Himself Score,Run author foot interesting mother year only.,64.71,USD,3,INACTIVE,2025-04-15 14:35:25,2025-05-29 19:38:06
606,SKU1605,Maintain Fact,Right interesting happy agree half.,233.09,USD,8,INACTIVE,2025-08-20 18:58:11,2025-04-18 11:37:53
607,SKU1606,Raise Spend,Note cause foot suggest economic whole grow.,107.14,USD,3,ARCHIVED,2025-09-06 22:50:17,2025-04-14 08:29:09
608,SKU1607,Stop Population,Lay every his administration claim same young.,185.31,USD,1,ARCHIVED,2025-06-03 01:41:43,2025-08-01 07:25:10
609,SKU1608,Glass Relationship,Natural brother never subject person medical well surface.,254.19,USD,5,ACTIVE,2025-01-30 16:20:52,2025-03-13 01:15:30
610,SKU1609,Expect Which,Similar safe defense western.,346.75,USD,7,ACTIVE,2025-08-03 10:14:21,2025-02-07 14:00:43
611,SKU1610,South Edge,Instead into participant through buy bit.,24.46,USD,6,ACTIVE,2025-08-04 20:54:47,2025-02-26 02:27:39
612,SKU1611,Coach Couple,Painting soon above call.,400.71,USD,4,ACTIVE,2025-08-08 11:48:09,2025-01-05 10:54:09
613,SKU1612,Enough Treat,Once home old.,315.81,USD,8,INACTIVE,2025-03-24 03:51:23,2025-08-29 07:25:30
614,SKU1613,Low Current,Table data security consumer several physical.,45.47,USD,6,ACTIVE,2025-04-07 20:25:15,2025-02-27 18:03:40
615,SKU1614,Visit Receive,Attention enough may indeed action like agent career.,437.42,USD,6,ACTIVE,2025-08-16 20:42:14,2025-02-18 10:17:41
616,SKU1615,Current Quality,Building rest some real nice.,460.83,USD,7,ARCHIVED,2025-07-08 19:43:25,2025-04-12 14:58:35
617,SKU1616,Owner No,Later campaign happy fast surface just.,35.23,USD,5,ACTIVE,2025-07-11 11:11:24,2025-08-03 01:29:30
618,SKU1617,Economy Once,Ask management outside the will bar.,142.05,USD,7,ARCHIVED,2025-03-29 14:59:53,2025-02-19 22:44:26
619,SKU1618,Congress Process,Book at cover moment across place take now.,404.07,USD,5,ACTIVE,2025-03-29 14:49:23,2025-07-14 13:21:53
620,SKU1619,Turn Such,Alone Congress history game reduce.,375.39,USD,2,ACTIVE,2025-04-04 11:10:26,2025-05-25 07:34:13
621,SKU1620,Degree Key,Pm tell coach next citizen effort purpose.,96.34,USD,8,ARCHIVED,2025-06-11 23:00:54,2025-04-04 06:11:55
622,SKU1621,Serve Stop,Head education day similar per.,108.63,USD,1,INACTIVE,2025-01-02 22:35:02,2025-05-02 21:27:32
623,SKU1622,Financial Hope,Hit company tell mother mission.,188.38,USD,9,INACTIVE,2025-07-13 01:31:19,2025-02-15 04:56:42
624,SKU1623,Learn Majority,Head out administration us.,244.84,USD,1,ARCHIVED,2025-05-11 03:07:47,2025-02-08 04:46:59
625,SKU1624,Develop Various,Ready key billion.,311.04,USD,6,ARCHIVED,2025-04-28 01:08:03,2025-01-12 00:27:35
626,SKU1625,Shake Ahead,Traditional term rest quickly project throw.,187.61,USD,4,INACTIVE,2025-08-12 11:06:49,2025-04-29 06:56:12
627,SKU1626,Maintain Onto,Reveal consumer lot phone media position however.,233.95,USD,2,ARCHIVED,2025-05-17 21:45:02,2025-07-24 06:56:19
628,SKU1627,Guy Factor,Force around final.,375.0,USD,1,ARCHIVED,2025-02-18 11:30:42,2025-08-11 02:45:28
629,SKU1628,Hundred Spend,Me west adult vote capital seven writer.,23.16,USD,1,ARCHIVED,2025-06-22 12:22:27,2025-05-09 05:56:45
630,SKU1629,Man Large,Room and always game model.,129.96,USD,4,ARCHIVED,2025-08-20 16:46:52,2025-03-17 03:57:51
631,SKU1630,Still Will,Money cover west.,358.11,USD,4,ARCHIVED,2025-06-24 15:57:17,2025-01-03 14:34:59
632,SKU1631,Position Poor,Staff organization painting.,448.13,USD,1,INACTIVE,2025-01-24 06:41:41,2025-05-16 22:28:48
633,SKU1632,Mean Receive,Sell through practice total vote.,258.28,USD,10,ARCHIVED,2025-08-28 11:27:51,2025-08-25 02:20:23
634,SKU1633,Wife War,Next today finally nature forget professor project.,268.4,USD,3,INACTIVE,2025-02-15 08:34:40,2025-01-08 15:29:42
