product_id,sku,name,description,price,currency,category_id,status,created_at,updated_at
1,SKU1000,Stuff Most,Something life then area.,190.4,USD,1,ARCHIVED,2025-07-08 13:03:41,2025-03-21 19:53:07
2,SKU1001,Recognize Ready,Story million thought wait stop up.,475.6,USD,9,INACTIVE,2025-04-02 11:04:15,2025-05-08 17:59:28
3,SKU1002,Daughter Very,Dream build key herself else everyone nor.,367.34,USD,4,ACTIVE,2025-06-22 21:57:11,2025-02-11 03:35:24
4,SKU1003,Note Word,Drive set break administration among manage way.,301.34,USD,9,INACTIVE,2025-01-14 09:59:33,2025-07-04 11:11:39
5,SKU1004,Factor Sit,He tree film today.,82.23,USD,7,ACTIVE,2025-01-03 08:12:22,2025-08-04 05:37:57
6,SKU1005,Every White,Purpose heart question clearly campaign crime case.,82.22,USD,4,INACTIVE,2025-05-03 21:52:53,2025-04-13 12:41:00
7,SKU1006,Star Run,Meet front certain in industry.,33.75,USD,8,ARCHIVED,2025-05-07 21:09:11,2025-08-09 16:49:59
8,SKU1007,Business Avoid,Forward world upon say year others.,433.76,USD,10,INACTIVE,2025-03-26 03:08:46,2025-04-30 05:02:43
9,SKU1008,Trial East,Pressure often future few indeed arm.,302.55,USD,5,ARCHIVED,2025-06-23 23:38:27,2025-04-29 02:28:55
10,SKU1009,Short World,Successful significant physical bad.,355.5,USD,1,INACTIVE,2025-05-18 08:36:06,2025-05-02 18:45:44
11,SKU1010,Rise Beautiful,Reduce leg section employee she.,15.19,USD,3,INACTIVE,2025-08-30 20:15:38,2025-02-21 03:34:07
12,SKU1011,Article Great,Ahead on represent.,485.11,USD,7,ARCHIVED,2025-08-27 00:11:58,2025-07-08 20:18:39
13,SKU1012,Second Oil,Everybody city operation white city fine final tough.,417.06,USD,6,ARCHIVED,2025-04-10 04:33:38,2025-01-24 05:19:26
14,SKU1013,Build Reality,Former north series great far work.,110.11,USD,5,ACTIVE,2025-08-19 10:10:30,2025-05-22 15:55:00
15,SKU1014,Me Term,Effect back stock the environmental.,95.0,USD,3,INACTIVE,2025-01-27 07:59:04,2025-05-22 08:47:05
16,SKU1015,Bank Seven,Offer charge sport heart pressure reveal.,95.79,USD,4,ACTIVE,2025-04-02 23:12:21,2025-07-14 12:41:26
17,SKU1016,Possible Magazine,Light indeed coach speak.,155.6,USD,6,ACTIVE,2025-02-12 17:44:44,2025-04-01 14:50:40
18,SKU1017,Wrong Impact,Picture wife party skill.,264.75,USD,2,ARCHIVED,2025-02-04 23:39:25,2025-02-18 05:41:24
19,SKU1018,Major Involve,Indeed entire idea also radio strong.,218.81,USD,2,ARCHIVED,2025-01-25 01:56:52,2025-07-27 00:59:31
20,SKU1019,Item Wear,Meeting model strong during modern artist.,149.16,USD,7,INACTIVE,2025-07-27 23:50:28,2025-07-15 11:12:07
21,SKU1020,Mean Article,Probably fast certain treatment none into low he.,307.87,USD,2,ACTIVE,2025-06-11 08:40:48,2025-01-03 05:40:25
22,SKU1021,Car Since,Vote woman east themselves reach blue.,74.05,USD,6,INACTIVE,2025-04-20 18:52:50,2025-02-13 18:23:10
23,SKU1022,General Push,Parent watch beyond.,149.61,USD,6,ACTIVE,2025-07-14 23:46:16,2025-07-13 13:50:04
24,SKU1023,Ability Call,Watch politics report whatever music.,186.35,USD,10,ARCHIVED,2025-04-22 15:47:43,2025-03-31 01:17:41
25,SKU1024,Hot Then,State popular continue key.,230.75,USD,5,INACTIVE,2025-01-02 04:39:14,2025-06-20 05:03:32
26,SKU1025,Structure Plan,Soldier hot how people.,393.66,USD,1,ACTIVE,2025-01-07 06:10:57,2025-08-16 15:45:52
27,SKU1026,Attorney Each,Visit life senior leader.,103.84,USD,8,ARCHIVED,2025-04-15 06:04:43,2025-06-01 00:15:00
28,SKU1027,Character Throw,Lay say arrive you.,259.55,USD,9,ACTIVE,2025-07-25 11:08:39,2025-03-29 18:49:03
29,SKU1028,Lose Pay,Military police us step audience get ahead.,298.25,USD,2,INACTIVE,2025-06-29 23:46:02,2025-03-07 18:35:10
30,SKU1029,Interest Loss,Pressure effect industry foreign effort.,27.99,USD,7,ARCHIVED,2025-09-03 19:39:29,2025-02-26 12:54:15
31,SKU1030,Dog Hard,Coach detail thank man term.,305.73,USD,2,ACTIVE,2025-01-13 05:48:46,2025-06-28 19:44:12
32,SKU1031,Once Trial,Drop building offer.,89.41,USD,9,ACTIVE,2025-05-25 21:32:55,2025-03-13 02:22:26
33,SKU1032,Service Accept,Southern network affect agency mother different project.,37.2,USD,5,INACTIVE,2025-06-17 18:36:47,2025-02-14 19:32:16
34,SKU1033,Recently Drug,Society any back student property beyond.,474.7,USD,10,INACTIVE,2025-07-12 04:55:40,2025-07-24 22:57:41
35,SKU1034,Family Tend,Town our detail just.,482.99,USD,6,INACTIVE,2025-06-12 02:40:45,2025-08-13 07:41:07
36,SKU1035,Onto Whether,Low hospital admit out myself.,405.16,USD,10,ARCHIVED,2025-04-27 11:30:42,2025-04-26 11:56:36
37,SKU1036,Room Because,Edge feel represent wife picture politics already.,155.78,USD,4,ARCHIVED,2025-03-06 09:38:59,2025-08-26 21:55:41
38,SKU1037,Leg Blood,Science stage arm parent those left.,53.35,USD,2,INACTIVE,2025-07-30 17:02:54,2025-05-19 11:18:18
39,SKU1038,Within Institution,Radio member film answer until.,343.7,USD,1,ARCHIVED,2025-05-16 12:59:16,2025-09-02 23:30:50
40,SKU1039,Would Former,Play green attorney throughout.,222.88,USD,4,ACTIVE,2025-07-16 02:03:13,2025-01-08 18:48:25
41,SKU1040,Seek Much,Ground mother activity together.,65.41,USD,5,INACTIVE,2025-02-04 07:56:00,2025-03-26 06:00:14
42,SKU1041,Become Bed,Tax notice note government cover various.,250.11,USD,2,ARCHIVED,2025-08-07 08:41:49,2025-04-02 12:59:23
43,SKU1042,Personal Yeah,Miss base necessary individual.,22.02,USD,4,ARCHIVED,2025-08-18 12:23:46,2025-04-11 21:23:14
44,SKU1043,Trouble Simply,Past onto security shake thing.,455.11,USD,2,INACTIVE,2025-08-11 21:58:31,2025-06-06 12:01:29
45,SKU1044,Question Fish,Force into yeah miss.,133.1,USD,7,INACTIVE,2025-07-07 02:51:50,2025-08-19 18:06:41
46,SKU1045,Great Alone,Democratic trip value sometimes.,332.95,USD,5,ARCHIVED,2025-07-04 20:37:15,2025-06-01 17:44:58
47,SKU1046,Almost Indicate,Watch mind Republican available tree suddenly yourself sit.,159.3,USD,8,ARCHIVED,2025-06-18 07:21:36,2025-01-13 06:54:41
48,SKU1047,Few Poor,Media well worker simple control seem before of.,262.43,USD,6,INACTIVE,2025-02-12 21:32:34,2025-03-27 19:46:16
49,SKU1048,Mean Approach,Us cup quite choose worry line relate perhaps.,275.62,USD,3,ARCHIVED,2025-06-29 12:09:49,2025-04-20 05:12:29
50,SKU1049,Collection Citizen,Rather try operation after lose.,96.5,USD,6,ACTIVE,2025-02-09 14:01:18,2025-01-15 20:27:20
51,SKU1050,Standard Various,Standard event serve field.,484.94,USD,6,ARCHIVED,2025-06-26 03:19:17,2025-07-07 01:55:13
52,SKU1051,Light Sea,Network year minute size girl her.,388.69,USD,4,ACTIVE,2025-03-22 03:20:52,2025-09-04 04:51:39
53,SKU1052,Carry Allow,Especially fund himself matter attention.,470.05,USD,5,ACTIVE,2025-04-15 18:06:28,2025-04-30 21:39:03
54,SKU1053,Save Fish,Officer whole as sure place attention scientist.,447.94,USD,2,ARCHIVED,2025-03-25 20:39:11,2025-09-01 00:38:37
55,SKU1054,Determine Somebody,Must key surface me capital treatment.,300.96,USD,10,ARCHIVED,2025-07-21 13:10:40,2025-01-02 00:37:37
56,SKU1055,Can Image,Political recently pressure require eight.,461.33,USD,3,INACTIVE,2025-04-25 19:09:37,2025-03-09 23:23:53
57,SKU1056,Benefit Method,Direction particular vote back.,48.8,USD,9,ACTIVE,2025-03-20 12:27:33,2025-02-09 02:23:31
58,SKU1057,What Yes,Wind attack executive organization thousand of democratic.,102.01,USD,4,ARCHIVED,2025-05-11 13:30:47,2025-04-07 11:20:00
59,SKU1058,Form Way,Hotel surface food major responsibility color note side.,27.39,USD,3,ACTIVE,2025-07-17 08:57:33,2025-03-30 12:48:41
60,SKU1059,Paper Information,Including realize interesting wear check team.,166.04,USD,8,INACTIVE,2025-07-08 02:55:25,2025-04-07 20:32:25
61,SKU1060,Turn Learn,Exist between among answer successful election.,197.4,USD,7,ACTIVE,2025-03-24 10:06:42,2025-02-14 07:30:23
62,SKU1061,Final Ever,Benefit game impact recognize involve one ask child.,139.32,USD,5,ARCHIVED,2025-08-22 08:39:12,2025-03-30 17:36:40
63,SKU1062,See Bring,Friend significant research hour gas local rest.,415.23,USD,9,ARCHIVED,2025-03-09 21:09:07,2025-01-31 01:01:08
64,SKU1063,Continue Laugh,Need certain together.,181.59,USD,4,ACTIVE,2025-05-01 01:23:11,2025-01-09 21:10:49
65,SKU1064,Best Foreign,Consider nearly under stay.,144.06,USD,6,INACTIVE,2025-01-07 12:08:32,2025-05-21 09:08:25
66,SKU1065,Democrat Question,Program involve benefit.,273.63,USD,1,ACTIVE,2025-05-20 19:31:49,2025-09-02 04:39:06
67,SKU1066,Bar Expert,Box condition than wife firm law.,74.76,USD,4,ARCHIVED,2025-05-25 20:14:33,2025-02-24 17:14:43
68,SKU1067,Reduce Public,Personal husband institution TV.,402.09,USD,1,INACTIVE,2025-06-24 21:49:12,2025-08-07 07:02:36
69,SKU1068,Hope Consumer,Subject those any want inside democratic.,41.9,USD,6,ACTIVE,2025-08-22 21:45:49,2025-06-11 21:00:49
70,SKU1069,Knowledge Decade,Other help four certain college.,493.51,USD,7,ACTIVE,2025-02-20 00:41:33,2025-06-30 08:11:29
71,SKU1070,Marriage Woman,Remember more dark lot.,387.26,USD,5,INACTIVE,2025-01-31 07:20:44,2025-07-16 00:59:11
72,SKU1071,Next Book,Make tend protect sing situation.,103.36,USD,2,ACTIVE,2025-04-20 04:47:23,2025-01-25 18:11:35
73,SKU1072,Simple Article,Between grow election alone TV ask network.,7.73,USD,4,INACTIVE,2025-02-05 23:29:03,2025-06-25 03:08:19
74,SKU1073,Make Close,To cell his cell rock season.,408.65,USD,10,INACTIVE,2025-01-22 07:58:31,2025-02-28 21:09:57
75,SKU1074,Drive Unit,Already fly behind mission beat ball no.,354.89,USD,6,INACTIVE,2025-07-20 11:37:41,2025-02-08 07:51:47
76,SKU1075,Ten Successful,Summer professor watch husband.,365.86,USD,4,INACTIVE,2025-02-02 09:43:48,2025-02-24 15:37:35
77,SKU1076,Turn Young,Southern like win program nearly hit.,386.78,USD,8,ACTIVE,2025-06-27 03:49:34,2025-05-21 15:00:49
78,SKU1077,Through However,Personal look box just improve.,41.65,USD,7,ACTIVE,2025-05-30 19:45:30,2025-03-23 16:55:51
79,SKU1078,Candidate Condition,He program watch whatever make.,182.44,USD,8,ARCHIVED,2025-05-17 16:30:13,2025-03-10 01:26:36
80,SKU1079,Significant Able,Leave including table lawyer me reality.,62.36,USD,3,INACTIVE,2025-01-02 16:18:32,2025-06-29 01:18:21
81,SKU1080,Ground Send,Season page form according.,432.24,USD,5,ARCHIVED,2025-05-26 04:54:17,2025-03-08 23:54:18
82,SKU1081,Collection Specific,Listen each surface charge every close.,313.53,USD,3,ARCHIVED,2025-03-29 17:56:35,2025-05-17 18:45:13
83,SKU1082,Activity Push,Finally risk since mean only.,168.79,USD,4,ACTIVE,2025-07-08 11:38:46,2025-04-04 21:06:17
84,SKU1083,Anyone Could,Major card black nation event action address.,36.46,USD,9,ACTIVE,2025-07-22 15:03:43,2025-08-17 23:43:35
85,SKU1084,Make Left,Give black and protect.,158.94,USD,9,ACTIVE,2025-06-21 12:24:24,2025-08-09 13:21:28
86,SKU1085,Understand Well,Role military civil each trade force participant.,165.97,USD,5,ACTIVE,2025-01-20 21:55:42,2025-04-07 07:21:39
87,SKU1086,Give Summer,Down president some play against free capital back.,366.16,USD,10,ARCHIVED,2025-03-29 22:49:44,2025-08-21 14:32:55
88,SKU1087,Argue Open,Drive nor wide down green long learn.,320.59,USD,7,INACTIVE,2025-02-12 08:27:23,2025-06-16 22:32:23
89,SKU1088,South Necessary,Behavior energy yes growth.,444.17,USD,10,ARCHIVED,2025-01-20 04:42:45,2025-04-09 06:46:01
90,SKU1089,We Green,Foot affect black.,238.75,USD,7,ARCHIVED,2025-05-22 01:28:03,2025-03-29 19:48:40
91,SKU1090,Tonight Turn,Contain physical wonder remain.,64.2,USD,6,ACTIVE,2025-07-13 00:34:58,2025-05-10 10:28:46
92,SKU1091,Necessary Media,Scene night hand always choice.,358.06,USD,4,INACTIVE,2025-04-01 20:42:01,2025-06-12 03:44:55
93,SKU1092,Sign Service,Well structure nature matter this.,381.59,USD,3,ARCHIVED,2025-07-12 05:47:24,2025-08-15 22:49:12
94,SKU1093,In Teach,Pattern open need she hundred so more.,282.83,USD,9,ACTIVE,2025-05-26 06:18:08,2025-03-08 01:39:14
95,SKU1094,Various Option,Clearly figure pretty a.,386.63,USD,8,ACTIVE,2025-02-01 18:24:14,2025-01-12 21:18:54
96,SKU1095,Old Story,Somebody page speech drug control here range.,249.43,USD,2,INACTIVE,2025-08-16 20:06:21,2025-06-24 13:50:14
97,SKU1096,Relationship Media,Audience itself property describe us.,263.75,USD,1,ARCHIVED,2025-03-11 15:00:54,2025-05-06 13:58:42
98,SKU1097,Company Thousand,Follow leg save.,216.63,USD,2,INACTIVE,2025-02-02 18:08:54,2025-03-12 17:59:02
99,SKU1098,Us From,Per become son process director.,17.58,USD,3,INACTIVE,2025-03-14 16:30:16,2025-06-28 19:00:19
100,SKU1099,Blue To,Challenge election Democrat share red already.,58.41,USD,3,INACTIVE,2025-06-02 11:16:01,2025-08-15 20:08:29
101,SKU1100,Day Quality,Style all family case.,20.56,USD,7,ARCHIVED,2025-08-25 19:07:55,2025-04-24 18:59:49
102,SKU1101,Necessary Rise,Before as water stay sing few movement.,320.02,USD,10,ACTIVE,2025-07-15 06:54:35,2025-08-23 18:24:19
103,SKU1102,Bad Customer,Movement policy worry put training movie position.,160.61,USD,2,INACTIVE,2025-06-24 22:07:52,2025-01-18 11:04:43
104,SKU1103,Test Citizen,Occur around citizen let.,256.74,USD,7,INACTIVE,2025-02-08 18:25:57,2025-05-03 23:26:21
105,SKU1104,Write Table,Great check value home thought card.,454.25,USD,7,ARCHIVED,2025-05-26 00:27:18,2025-04-30 14:52:44
106,SKU1105,Professional Cut,International whose south church win recognize.,128.4,USD,10,ARCHIVED,2025-07-15 12:28:02,2025-05-30 13:43:36
107,SKU1106,Instead Reduce,Answer already husband challenge argue could.,208.14,USD,8,ACTIVE,2025-01-15 17:15:23,2025-06-04 08:14:44
108,SKU1107,Throw Explain,Listen type mean magazine could allow.,379.0,USD,9,ACTIVE,2025-05-13 21:15:08,2025-02-26 19:32:57
109,SKU1108,Scientist Technology,Major cell score.,118.26,USD,5,INACTIVE,2025-07-15 20:41:51,2025-06-25 09:45:08
110,SKU1109,Relate President,Once discussion brother worker.,43.11,USD,9,INACTIVE,2025-02-26 22:25:30,2025-05-08 18:29:48
111,SKU1110,Answer We,Yard bring personal arrive pull.,148.43,USD,1,ARCHIVED,2025-05-20 22:17:26,2025-07-31 08:29:39
112,SKU1111,Church Might,Suffer require threat above many try identify.,84.8,USD,2,INACTIVE,2025-07-18 04:51:42,2025-07-06 21:03:16
113,SKU1112,That Then,Suffer method president series condition reflect right.,465.2,USD,9,ARCHIVED,2025-05-31 09:08:34,2025-06-06 17:04:07
114,SKU1113,Big Operation,Actually agent pick ask develop.,405.02,USD,5,INACTIVE,2025-09-01 09:13:41,2025-01-19 18:07:08
115,SKU1114,Up Probably,Water assume own important.,318.53,USD,6,ARCHIVED,2025-05-17 07:37:59,2025-08-19 21:16:12
116,SKU1115,History Make,Age protect scientist financial fly.,436.37,USD,2,INACTIVE,2025-06-02 12:13:23,2025-02-12 06:36:29
117,SKU1116,Them Protect,Crime recent without energy staff bit.,402.82,USD,5,INACTIVE,2025-08-05 00:21:03,2025-07-25 22:15:11
118,SKU1117,Popular North,Control only base anyone.,97.35,USD,7,INACTIVE,2025-02-27 00:04:54,2025-03-13 07:12:33
119,SKU1118,Without Check,Success job card race price.,446.82,USD,3,ACTIVE,2025-07-27 00:37:30,2025-05-18 22:26:08
120,SKU1119,Determine Provide,Care save next Mrs read subject store.,271.97,USD,8,INACTIVE,2025-07-02 01:25:31,2025-05-13 13:34:27
121,SKU1120,Edge Other,Meeting particular prevent there gas.,404.68,USD,1,INACTIVE,2025-03-08 06:20:30,2025-02-09 08:44:52
122,SKU1121,Mention Agreement,Others sing make soldier piece we poor big.,448.57,USD,5,ACTIVE,2025-06-09 19:57:27,2025-05-27 18:29:36
123,SKU1122,Design Eat,Step fill three cut church person.,162.41,USD,9,ACTIVE,2025-06-14 16:46:41,2025-08-26 03:06:16
124,SKU1123,Forget Place,Figure policy general.,59.48,USD,3,INACTIVE,2025-05-28 23:36:39,2025-02-18 18:40:56
125,SKU1124,Population Oil,Less matter lay.,117.83,USD,9,ARCHIVED,2025-08-28 04:26:12,2025-01-11 01:58:06
126,SKU1125,Purpose Serve,Which voice let heavy method.,216.42,USD,2,INACTIVE,2025-03-13 02:51:15,2025-07-30 09:07:18
127,SKU1126,Century Let,Nation his side then attorney.,409.92,USD,5,ARCHIVED,2025-07-11 20:46:38,2025-02-11 00:23:47
128,SKU1127,Prevent Onto,Despite be music catch whom.,431.06,USD,9,INACTIVE,2025-02-17 22:40:41,2025-04-28 08:43:44
129,SKU1128,Year Democrat,People particularly need student on firm floor.,8.44,USD,10,ARCHIVED,2025-04-09 19:38:04,2025-07-02 13:52:06
130,SKU1129,Level Say,View allow house collection dream many say.,257.82,USD,4,INACTIVE,2025-07-13 18:36:00,2025-08-23 03:18:16
131,SKU1130,Around Upon,Social once plant test.,211.62,USD,3,ACTIVE,2025-02-28 02:34:27,2025-05-30 07:30:30
132,SKU1131,Baby Knowledge,Good list pretty seven whole great.,114.94,USD,6,ARCHIVED,2025-02-18 04:56:15,2025-06-16 12:58:17
133,SKU1132,Less Series,Eye way movie beyond law.,64.33,USD,3,INACTIVE,2025-01-12 11:27:20,2025-01-12 14:16:08
134,SKU1133,Thought Staff,Music dream there wife heavy.,172.12,USD,9,INACTIVE,2025-01-03 12:23:27,2025-03-07 01:32:25
135,SKU1134,Relationship Begin,Use heavy Mr push cut.,471.74,USD,9,ACTIVE,2025-06-03 18:29:38,2025-08-05 06:37:21
136,SKU1135,Rock Let,Short citizen use sign school like along.,164.99,USD,1,ARCHIVED,2025-06-13 04:59:50,2025-06-17 21:37:40
137,SKU1136,Receive Entire,Health middle federal soldier.,261.8,USD,10,ARCHIVED,2025-04-13 08:31:18,2025-09-05 00:18:04
138,SKU1137,Energy Pretty,Detail value local hair impact reach.,352.99,USD,6,ARCHIVED,2025-07-10 20:43:04,2025-01-05 18:44:14
139,SKU1138,Side Allow,White toward guy how leave time expect.,185.0,USD,8,ACTIVE,2025-05-18 01:51:02,2025-04-28 01:37:41
140,SKU1139,Plant Talk,Give likely body.,486.03,USD,1,ARCHIVED,2025-03-08 13:06:41,2025-07-24 12:54:21
141,SKU1140,Program Begin,Teacher way guess.,481.41,USD,2,ARCHIVED,2025-01-13 21:58:58,2025-03-18 06:44:33
142,SKU1141,Car Pm,Make wide operation start.,129.63,USD,6,INACTIVE,2025-01-13 01:17:40,2025-09-04 19:06:25
143,SKU1142,Place Decide,Sign network present theory employee performance water last.,251.14,USD,5,INACTIVE,2025-06-07 11:09:25,2025-06-21 16:18:26
144,SKU1143,Because Movement,Sign move partner pressure make language play own.,153.93,USD,4,ACTIVE,2025-08-28 04:27:24,2025-07-28 02:02:11
145,SKU1144,Suddenly Behavior,Foot partner beyond ready really economy body financial.,146.0,USD,1,ARCHIVED,2025-08-05 15:54:18,2025-03-04 10:57:36
146,SKU1145,Moment Throw,Stand subject who wish.,23.26,USD,4,INACTIVE,2025-08-25 05:25:14,2025-03-01 00:37:07
147,SKU1146,Again True,Seem see piece drop later.,306.73,USD,10,ACTIVE,2025-07-23 15:22:42,2025-01-27 21:20:33
148,SKU1147,Industry Show,Very woman key within bank poor discuss.,253.83,USD,2,ARCHIVED,2025-01-24 13:22:15,2025-07-11 02:13:25
149,SKU1148,Laugh Owner,Heart reflect pay glass two.,30.48,USD,2,ACTIVE,2025-01-10 23:05:45,2025-08-24 03:35:37
150,SKU1149,Whatever Night,Letter how case down interview treat.,142.93,USD,8,ARCHIVED,2025-02-12 04:54:15,2025-04-26 15:50:05
151,SKU1150,Though Responsibility,So business expect purpose western PM surface.,454.59,USD,2,INACTIVE,2025-06-28 07:21:48,2025-05-23 03:30:11
152,SKU1151,True Wide,Production structure hair voice factor five follow.,123.58,USD,9,ARCHIVED,2025-05-16 10:12:52,2025-07-21 19:54:47
153,SKU1152,Will Message,Ago character girl least.,76.72,USD,3,ARCHIVED,2025-01-05 22:28:07,2025-04-20 03:58:06
154,SKU1153,Model Information,Join ten enjoy admit.,247.28,USD,3,ARCHIVED,2025-02-19 13:22:41,2025-02-04 07:22:40
155,SKU1154,Hard Describe,Hope however impact two name pull.,492.9,USD,8,ARCHIVED,2025-03-03 04:18:22,2025-04-04 07:47:30
156,SKU1155,Us Past,Day professional generation never list.,124.82,USD,9,ACTIVE,2025-06-28 11:01:50,2025-07-13 01:07:31
157,SKU1156,Rock Senior,Scene how know however American college reduce add.,337.71,USD,3,ARCHIVED,2025-07-04 20:39:01,2025-08-07 13:20:18
158,SKU1157,Against Note,Foot receive sign free bill family practice.,382.0,USD,5,ACTIVE,2025-01-16 16:28:16,2025-05-29 14:10:44
159,SKU1158,Citizen These,Admit poor executive.,122.63,USD,9,ARCHIVED,2025-02-10 04:15:15,2025-04-26 04:27:50
160,SKU1159,Pass Gun,Out you enter somebody author learn police name.,365.47,USD,10,ARCHIVED,2025-02-21 07:52:42,2025-02-06 19:12:11
161,SKU1160,Improve Property,Professional maintain with try song visit what.,187.05,USD,7,ACTIVE,2025-03-16 19:05:55,2025-03-25 01:48:45
162,SKU1161,Operation Show,Report avoid much.,317.99,USD,4,INACTIVE,2025-09-03 21:39:23,2025-02-09 06:13:44
163,SKU1162,Blue Leave,Condition population place despite sister show.,318.6,USD,9,INACTIVE,2025-02-25 13:46:52,2025-01-20 19:19:41
164,SKU1163,Nice Particular,Job after country ability at party step.,270.21,USD,4,ACTIVE,2025-02-25 11:37:34,2025-05-01 18:46:33
165,SKU1164,Central Religious,Letter include discuss entire century other scene grow.,49.69,USD,5,ARCHIVED,2025-07-25 07:16:11,2025-08-13 08:49:45
166,SKU1165,Indicate Others,Team right direction history.,418.47,USD,7,INACTIVE,2025-07-13 02:22:41,2025-03-16 02:50:34
167,SKU1166,Fish Position,Forward fire forget change hot much.,163.79,USD,6,ARCHIVED,2025-03-04 00:52:11,2025-01-17 18:29:17
168,SKU1167,I Medical,Message outside them eight be arm quite.,97.33,USD,8,ACTIVE,2025-09-04 16:32:00,2025-02-15 18:51:28
169,SKU1168,Professor Partner,Beat happen system write may store back it.,25.18,USD,9,ACTIVE,2025-08-22 18:52:04,2025-05-10 07:37:04
170,SKU1169,As Player,Body often project.,297.49,USD,8,INACTIVE,2025-04-12 13:09:06,2025-05-20 18:59:01
171,SKU1170,Third Laugh,Few certain police phone issue.,340.39,USD,2,INACTIVE,2025-04-22 14:55:57,2025-01-29 19:39:19
172,SKU1171,Peace Follow,Theory rise water.,13.21,USD,4,ARCHIVED,2025-03-07 16:30:32,2025-07-05 08:59:05
173,SKU1172,Reason Military,Dog sometimes level.,258.49,USD,4,INACTIVE,2025-07-12 15:22:28,2025-03-13 17:49:05
174,SKU1173,Whether Safe,Drop kid contain there behavior condition.,117.12,USD,2,ACTIVE,2025-07-03 20:15:23,2025-01-30 07:36:13
175,SKU1174,Pay Very,Unit product exist future leader daughter.,324.36,USD,6,ACTIVE,2025-02-06 15:47:59,2025-06-06 07:09:44
176,SKU1175,Thousand Participant,Record return action detail attack.,91.31,USD,1,ACTIVE,2025-02-21 13:24:49,2025-07-17 20:35:26
177,SKU1176,Already If,Executive who phone.,347.01,USD,10,ARCHIVED,2025-08-16 18:41:36,2025-05-08 21:34:17
178,SKU1177,Truth Natural,Now such must worker.,196.43,USD,9,INACTIVE,2025-02-17 01:23:10,2025-05-10 01:40:57
179,SKU1178,American This,Nature race talk.,468.68,USD,4,ARCHIVED,2025-05-26 16:38:04,2025-03-05 11:01:52
180,SKU1179,Blue Deal,Too memory list Mr short scientist practice.,73.07,USD,10,ARCHIVED,2025-06-13 12:47:21,2025-03-01 04:09:02
181,SKU1180,National Public,Including ago meeting enough.,173.83,USD,4,INACTIVE,2025-03-24 19:40:32,2025-08-09 06:40:09
182,SKU1181,Identify Some,Both party product blue hundred father reality.,61.17,USD,1,ACTIVE,2025-08-06 20:14:43,2025-02-02 11:53:17
183,SKU1182,Suffer Share,Group stay also address indicate.,462.72,USD,2,INACTIVE,2025-08-10 00:05:34,2025-01-06 05:18:24
184,SKU1183,Task Yet,Mother leave really bar safe.,439.28,USD,1,INACTIVE,2025-07-19 13:11:58,2025-03-10 21:01:13
185,SKU1184,Daughter Everyone,Significant nothing yes everyone.,132.68,USD,4,INACTIVE,2025-01-27 02:08:19,2025-05-14 11:18:06
186,SKU1185,Way Become,Pick finish next recognize usually sea blue.,331.69,USD,2,ARCHIVED,2025-07-05 21:45:07,2025-08-06 10:34:42
187,SKU1186,Them Help,Beyond citizen sometimes fund accept kind capital.,409.52,USD,1,INACTIVE,2025-05-09 03:10:41,2025-04-23 02:56:48
188,SKU1187,Official Contain,Similar me fall each realize leg of use.,279.82,USD,6,ACTIVE,2025-05-26 08:28:06,2025-06-29 15:37:44
189,SKU1188,Left Scene,Able prove approach ago international.,267.18,USD,2,INACTIVE,2025-09-02 02:31:08,2025-03-20 18:52:22
190,SKU1189,Father Morning,Son need water fact.,124.72,USD,9,ACTIVE,2025-04-09 20:25:34,2025-01-12 23:35:48
191,SKU1190,Door Change,As prepare factor recent response available.,51.09,USD,4,ACTIVE,2025-04-28 12:15:59,2025-01-14 23:38:02
192,SKU1191,Claim Local,Think history role magazine bed.,449.12,USD,5,ACTIVE,2025-03-03 02:11:38,2025-08-15 09:36:19
193,SKU1192,By Full,Dark drop decide general traditional doctor final.,450.71,USD,8,ARCHIVED,2025-05-06 09:33:13,2025-07-07 11:39:44
194,SKU1193,Born Son,Beyond everybody third why.,318.39,USD,4,ARCHIVED,2025-07-02 17:46:02,2025-05-12 12:53:20
195,SKU1194,This Keep,Feel indicate pull those hair store common management.,172.82,USD,9,ARCHIVED,2025-06-15 12:27:20,2025-03-12 06:24:27
196,SKU1195,Research She,We himself line nation marriage.,177.86,USD,3,INACTIVE,2025-03-03 01:01:01,2025-03-20 20:39:56
197,SKU1196,Discussion Child,Like great hand body born draw.,364.35,USD,10,ARCHIVED,2025-05-11 00:37:03,2025-09-05 20:07:19
198,SKU1197,Sit Series,Until lawyer room particular town final.,449.07,USD,10,INACTIVE,2025-07-11 14:50:02,2025-09-03 08:19:50
199,SKU1198,Body Summer,Throughout those card heart scientist.,444.11,USD,8,ACTIVE,2025-01-26 08:13:19,2025-03-19 02:24:32
200,SKU1199,Wonder Someone,Rock figure leader after back.,391.04,USD,4,INACTIVE,2025-04-20 13:03:26,2025-03-01 07:40:25
201,SKU1200,Health Actually,Traditional marriage go town.,322.81,USD,8,ACTIVE,2025-03-03 11:19:28,2025-05-24 13:28:30
202,SKU1201,Discuss Industry,Get billion herself investment history it.,46.65,USD,7,INACTIVE,2025-05-20 03:50:12,2025-08-03 17:17:05
203,SKU1202,Study Media,Recently never modern onto cut old prepare radio.,85.01,USD,4,ARCHIVED,2025-05-03 05:39:29,2025-07-24 05:46:16
204,SKU1203,Speak Indicate,Moment discover economic fire improve.,449.78,USD,2,ACTIVE,2025-02-03 06:37:11,2025-06-29 21:58:21
205,SKU1204,Shake Many,Hold among ask race summer president road.,305.18,USD,2,INACTIVE,2025-06-16 18:06:42,2025-01-29 01:39:01
206,SKU1205,List Adult,Nature seek tend machine soon.,9.55,USD,7,INACTIVE,2025-06-14 07:22:02,2025-04-05 09:38:05
207,SKU1206,Defense Give,Their they on spend opportunity.,55.23,USD,6,ARCHIVED,2025-02-13 13:01:34,2025-06-05 18:52:25
208,SKU1207,Think Left,Modern character between yeah pull.,333.43,USD,7,ARCHIVED,2025-05-03 01:12:15,2025-01-02 16:33:24
209,SKU1208,Road Body,Single vote teach drive.,7.51,USD,7,ARCHIVED,2025-08-19 08:51:36,2025-07-17 06:22:50
210,SKU1209,Life Move,Money fill quickly glass responsibility.,84.6,USD,8,INACTIVE,2025-02-09 06:38:48,2025-02-20 23:11:26
211,SKU1210,Scientist Behavior,Despite read thus agency whole right think.,276.62,USD,1,ARCHIVED,2025-02-14 09:22:06,2025-04-24 00:14:14
212,SKU1211,Base Responsibility,Perform owner hot hard remember.,347.49,USD,2,INACTIVE,2025-04-30 03:22:15,2025-07-10 09:29:43
