product_id,sku,name,description,price,currency,category_id,status,created_at,updated_at
213,SKU1212,War Interesting,Style entire place kitchen bag suddenly.,327.72,USD,1,ARCHIVED,2025-07-20 23:41:47,2025-05-08 22:28:32
214,SKU1213,Environment Worker,Man Mr general nothing age pattern.,116.01,USD,7,INACTIVE,2025-08-16 20:19:04,2025-01-21 15:45:46
215,SKU1214,Never Ability,Create fly many trial.,357.53,USD,6,ACTIVE,2025-08-01 08:44:15,2025-02-04 08:35:59
216,SKU1215,You Live,Since deep image democratic blue someone.,122.44,USD,2,ARCHIVED,2025-01-04 07:01:30,2025-02-15 16:49:26
217,SKU1216,Half Store,My like car education.,166.07,USD,4,ACTIVE,2025-04-02 11:38:33,2025-01-20 17:56:12
218,SKU1217,Name Heavy,Individual natural know guy everything require feel.,374.51,USD,4,INACTIVE,2025-06-05 03:31:33,2025-06-10 15:39:53
219,SKU1218,Someone Control,Dark year scientist college plan always teach anyone.,326.57,USD,4,ACTIVE,2025-01-31 14:36:39,2025-03-20 14:54:02
220,SKU1219,Relate Head,Cost particular give court there minute meeting.,425.37,USD,9,ARCHIVED,2025-07-24 07:29:07,2025-03-05 09:46:12
221,SKU1220,Shake Child,Note eat society seat allow.,330.52,USD,8,ARCHIVED,2025-08-11 18:02:32,2025-07-04 07:28:07
222,SKU1221,National By,Short grow art follow total set.,286.31,USD,3,INACTIVE,2025-02-07 08:53:51,2025-06-22 09:57:06
223,SKU1222,Out Job,Commercial trade rather project heavy sister investment.,51.37,USD,7,ARCHIVED,2025-04-05 14:40:50,2025-06-28 15:38:30
224,SKU1223,Win Message,Any college phone different.,187.02,USD,3,ACTIVE,2025-06-07 03:18:09,2025-06-20 05:26:15
225,SKU1224,Drop Necessary,Central base available southern particular pull recognize forget.,136.28,USD,5,ARCHIVED,2025-05-10 17:13:06,2025-06-06 02:15:26
226,SKU1225,General Peace,Miss important painting add who.,125.77,USD,8,ACTIVE,2025-07-09 06:00:07,2025-08-24 10:39:40
227,SKU1226,Dark Whole,Data sell skill.,486.64,USD,4,ARCHIVED,2025-05-03 14:46:01,2025-04-21 18:12:38
228,SKU1227,Fall Case,Yard half marriage push audience crime.,199.58,USD,2,INACTIVE,2025-07-17 10:16:59,2025-06-20 21:44:04
229,SKU1228,Enter Size,Go system customer out once stand contain.,446.56,USD,8,ARCHIVED,2025-07-01 19:13:32,2025-06-22 18:08:34
230,SKU1229,General Party,History play property town something factor president several.,317.41,USD,9,INACTIVE,2025-06-28 11:15:44,2025-07-10 21:33:24
231,SKU1230,Ready Produce,By see service trial too military model southern.,398.43,USD,2,ARCHIVED,2025-08-15 13:13:43,2025-07-04 19:34:37
232,SKU1231,Form Safe,But quite product third.,253.81,USD,1,INACTIVE,2025-03-18 15:38:50,2025-07-26 05:29:45
233,SKU1232,Scene Various,Each rather high figure.,290.57,USD,9,ACTIVE,2025-01-17 02:20:35,2025-01-15 03:47:16
234,SKU1233,Third Long,Manager save east people nice respond trouble north.,248.8,USD,1,ACTIVE,2025-07-05 09:08:20,2025-07-01 02:45:26
235,SKU1234,Political Week,Require eye fact real.,101.65,USD,2,ACTIVE,2025-02-22 05:44:13,2025-06-28 23:31:40
236,SKU1235,More Society,Job brother yard day simply surface.,362.61,USD,4,ACTIVE,2025-04-05 15:49:46,2025-07-29 06:21:33
237,SKU1236,Hard History,Public scientist new whom yard.,143.98,USD,3,INACTIVE,2025-07-20 06:51:42,2025-08-21 13:18:00
238,SKU1237,History Unit,North of type.,17.04,USD,7,INACTIVE,2025-01-03 16:34:36,2025-03-27 10:27:54
239,SKU1238,During Management,Role pretty clear available race specific member.,324.51,USD,8,ACTIVE,2025-06-15 03:41:59,2025-08-29 14:50:55
240,SKU1239,Might Expert,Floor happen realize him before another law.,92.67,USD,8,ACTIVE,2025-02-20 06:53:59,2025-02-22 07:37:27
241,SKU1240,Exist Particularly,When stock cause.,470.53,USD,4,ACTIVE,2025-04-18 02:59:20,2025-01-31 10:33:58
242,SKU1241,Skill Much,Move Democrat drive help protect.,477.19,USD,7,ARCHIVED,2025-06-14 09:37:32,2025-02-10 09:08:58
243,SKU1242,Wish Bank,Later start enter institution seven range.,457.86,USD,1,ACTIVE,2025-08-11 08:41:40,2025-01-29 13:00:35
244,SKU1243,Bank Control,Moment fish guess foot near visit.,188.23,USD,3,INACTIVE,2025-07-05 09:55:47,2025-06-25 01:56:58
245,SKU1244,List Stock,Manager structure program law which under professor.,12.65,USD,7,INACTIVE,2025-03-08 04:45:44,2025-05-04 18:25:52
246,SKU1245,Factor Wait,Thank consider us candidate structure.,464.52,USD,1,INACTIVE,2025-03-01 22:23:42,2025-07-11 00:09:59
247,SKU1246,Fill Store,Win letter item approach save parent eat.,216.95,USD,7,ARCHIVED,2025-03-14 06:13:45,2025-06-11 00:21:32
248,SKU1247,Foot News,Scene us race drive.,483.49,USD,5,ARCHIVED,2025-03-10 23:08:18,2025-03-11 05:56:43
249,SKU1248,Hundred Each,Provide religious later nearly campaign.,481.99,USD,8,ARCHIVED,2025-03-22 19:23:18,2025-01-16 03:16:19
250,SKU1249,Local Couple,Left staff center this be address issue.,427.24,USD,5,ARCHIVED,2025-02-22 02:39:41,2025-07-29 14:24:07
251,SKU1250,Beat Several,Compare indeed person walk management sign.,150.75,USD,7,INACTIVE,2025-08-27 15:58:40,2025-05-15 21:40:51
252,SKU1251,Relationship Hotel,Relate several south.,195.62,USD,9,ARCHIVED,2025-04-15 12:53:21,2025-03-25 21:31:20
253,SKU1252,Nation Age,Feeling challenge heavy.,426.31,USD,8,ARCHIVED,2025-03-20 07:56:44,2025-04-18 11:47:10
254,SKU1253,Memory Stage,Couple age home item right talk.,161.88,USD,3,ARCHIVED,2025-06-26 08:41:37,2025-06-19 22:39:47
255,SKU1254,Really Young,Option hair hope though.,88.9,USD,4,ACTIVE,2025-01-11 02:17:12,2025-06-04 16:16:11
256,SKU1255,Condition Real,And gun artist leg.,280.62,USD,5,INACTIVE,2025-06-12 02:58:02,2025-08-20 07:24:21
257,SKU1256,Level Network,Success white up difference.,468.4,USD,4,ARCHIVED,2025-01-23 21:33:45,2025-05-02 23:38:01
258,SKU1257,Agree Pattern,Attorney success deal he.,349.53,USD,1,ACTIVE,2025-05-03 03:02:44,2025-02-23 20:14:22
259,SKU1258,Tonight Allow,Challenge wife a modern staff relationship.,287.18,USD,10,INACTIVE,2025-06-16 18:51:31,2025-05-07 05:28:25
260,SKU1259,Half Continue,Seek imagine speak lawyer cost cover.,53.1,USD,9,ARCHIVED,2025-01-18 05:04:42,2025-05-25 01:32:33
261,SKU1260,Easy That,Education father by future.,309.43,USD,1,INACTIVE,2025-09-04 18:31:09,2025-01-19 12:20:06
262,SKU1261,School Receive,Political when trouble law.,495.08,USD,6,INACTIVE,2025-06-08 08:19:34,2025-07-19 06:10:53
263,SKU1262,Including Protect,Couple protect little.,74.34,USD,1,ACTIVE,2025-03-16 15:06:31,2025-01-29 16:40:46
264,SKU1263,Republican Speech,Opportunity who theory technology like.,261.57,USD,1,ARCHIVED,2025-03-26 19:14:20,2025-03-06 11:17:35
265,SKU1264,Day Process,At doctor ability thing then.,439.3,USD,10,INACTIVE,2025-08-09 04:56:57,2025-01-13 17:51:49
266,SKU1265,Happy Page,Edge cost organization.,371.68,USD,8,ACTIVE,2025-08-29 12:57:07,2025-07-12 05:41:08
267,SKU1266,Perhaps Office,Respond identify kid relationship dark thank.,350.02,USD,9,INACTIVE,2025-05-05 08:28:36,2025-02-17 10:30:36
268,SKU1267,Within Research,Detail property relate.,352.73,USD,9,INACTIVE,2025-02-08 10:29:31,2025-07-07 01:36:27
269,SKU1268,Wall Can,Early create sense.,182.95,USD,3,ACTIVE,2025-06-11 10:30:41,2025-05-06 12:33:49
270,SKU1269,Network Room,Decision language yard trouble five same most.,150.33,USD,1,INACTIVE,2025-06-22 18:03:02,2025-03-24 03:37:28
271,SKU1270,Under Black,Important son ago toward report discuss.,405.63,USD,9,ACTIVE,2025-01-09 14:19:08,2025-05-13 12:10:49
272,SKU1271,Play Respond,Garden attention away operation than.,406.01,USD,2,ARCHIVED,2025-08-25 17:26:34,2025-06-13 03:21:04
273,SKU1272,Remember Begin,Spend others miss.,434.2,USD,3,INACTIVE,2025-08-27 19:27:02,2025-02-28 14:59:26
274,SKU1273,Politics Challenge,Social receive season knowledge.,457.05,USD,2,ARCHIVED,2025-05-20 03:37:02,2025-07-24 07:33:47
275,SKU1274,Until Society,At thought determine.,258.11,USD,10,ARCHIVED,2025-06-24 19:33:13,2025-05-23 11:13:43
276,SKU1275,Size Answer,Technology themselves when half stop describe be.,253.25,USD,2,INACTIVE,2025-02-08 07:13:24,2025-06-28 23:36:59
277,SKU1276,Available Base,National century serve contain carry sea.,400.16,USD,4,ACTIVE,2025-07-01 22:35:53,2025-06-20 11:59:35
278,SKU1277,Challenge Mention,Reason traditional use they word cut.,326.73,USD,7,INACTIVE,2025-01-22 14:17:05,2025-04-06 22:55:19
279,SKU1278,Through Bag,Blue draw city doctor girl.,352.47,USD,2,INACTIVE,2025-04-22 10:53:20,2025-05-18 12:47:14
280,SKU1279,Southern Drive,Range worker service.,398.92,USD,10,ACTIVE,2025-08-17 03:47:39,2025-01-07 02:21:39
281,SKU1280,Rate Wear,Magazine hit break bed.,445.55,USD,4,ACTIVE,2025-02-28 07:28:31,2025-07-17 08:55:45
282,SKU1281,Two Hospital,Policy finally see policy show.,172.31,USD,10,INACTIVE,2025-04-19 06:38:24,2025-04-13 08:37:08
283,SKU1282,Data Indicate,Owner feeling region catch ahead.,190.91,USD,10,ACTIVE,2025-03-26 15:05:11,2025-03-12 04:40:23
284,SKU1283,Country Event,Read indicate bank laugh politics.,51.52,USD,1,ARCHIVED,2025-05-23 11:51:52,2025-02-06 21:20:03
285,SKU1284,Source Place,Skin Republican or fight herself worker.,291.25,USD,10,ACTIVE,2025-03-05 06:06:17,2025-02-06 14:37:21
286,SKU1285,Sport Check,Decision discussion we next in record blue.,22.79,USD,2,ARCHIVED,2025-01-23 18:07:43,2025-07-01 03:14:33
287,SKU1286,Cut Skill,Them about agreement nice.,235.47,USD,7,ARCHIVED,2025-02-26 18:57:30,2025-01-22 10:05:24
288,SKU1287,Stay Kitchen,Region name about purpose total song data.,273.61,USD,10,ARCHIVED,2025-03-20 17:18:10,2025-03-30 08:19:45
289,SKU1288,Why Own,Team fall technology us join.,146.84,USD,10,ACTIVE,2025-06-10 15:09:50,2025-06-07 21:47:31
290,SKU1289,Remain Start,Physical middle clear special six wonder not minute.,297.46,USD,9,ACTIVE,2025-08-12 09:36:31,2025-04-28 08:38:56
291,SKU1290,Music Give,Stage camera spring future buy.,20.1,USD,6,INACTIVE,2025-09-02 20:31:30,2025-06-10 02:31:46
292,SKU1291,Machine Tax,Another name could on.,23.49,USD,5,ACTIVE,2025-03-05 10:39:41,2025-01-15 12:06:51
293,SKU1292,Sort Tree,Chance wide anything according seem because bit.,412.19,USD,4,ACTIVE,2025-08-13 03:58:23,2025-07-27 09:05:41
294,SKU1293,Sing Where,Low defense money half deep.,183.29,USD,6,ARCHIVED,2025-04-15 21:18:12,2025-07-15 02:37:11
295,SKU1294,Bank Cover,Week officer difference today building half.,67.89,USD,4,ACTIVE,2025-01-10 15:42:20,2025-07-29 03:00:47
296,SKU1295,Body Else,Fast player idea personal environment.,263.51,USD,5,ACTIVE,2025-05-05 16:19:36,2025-06-14 13:26:37
297,SKU1296,Man Mouth,Market collection born fill bill.,386.15,USD,7,ARCHIVED,2025-07-03 21:29:29,2025-08-23 18:16:26
298,SKU1297,Responsibility They,Ready still become into.,111.83,USD,3,ACTIVE,2025-04-30 16:06:56,2025-05-25 22:09:12
299,SKU1298,Easy Country,Although drive member maybe resource worker PM hotel.,313.33,USD,5,ARCHIVED,2025-07-10 14:16:23,2025-08-16 16:01:33
300,SKU1299,Machine Almost,Analysis statement history drive describe trade.,47.25,USD,8,ACTIVE,2025-02-11 03:00:32,2025-02-25 21:48:16
301,SKU1300,Business Leave,Participant establish no call serve once resource.,30.58,USD,6,ACTIVE,2025-05-29 23:21:43,2025-04-06 16:02:07
302,SKU1301,Who Physical,Congress rate design build might.,268.02,USD,2,INACTIVE,2025-01-28 05:07:33,2025-03-05 05:28:44
303,SKU1302,Thus Ahead,Same audience federal service bad quality.,272.61,USD,1,ACTIVE,2025-02-12 16:27:58,2025-06-17 07:21:16
304,SKU1303,Fight Sense,Significant help manage to collection design.,320.53,USD,8,ARCHIVED,2025-03-31 19:47:03,2025-03-27 18:36:30
305,SKU1304,You Expect,Read bit east plan state time catch.,364.42,USD,10,ACTIVE,2025-07-20 01:00:08,2025-02-27 18:15:52
306,SKU1305,Guess Conference,Soldier employee him there large throughout wonder.,488.05,USD,10,INACTIVE,2025-07-18 02:41:09,2025-01-10 03:18:42
307,SKU1306,Respond Heart,Someone paper instead page morning.,260.57,USD,2,ACTIVE,2025-05-02 22:13:18,2025-06-08 20:21:56
308,SKU1307,Because Several,Account half word positive me campaign require.,164.86,USD,2,ACTIVE,2025-06-04 12:35:15,2025-02-09 14:54:33
309,SKU1308,Our This,My them she foot.,398.62,USD,9,ARCHIVED,2025-04-06 23:39:24,2025-07-16 14:52:45
310,SKU1309,Sound Artist,Sign through participant main professor Republican control.,139.06,USD,4,INACTIVE,2025-03-31 14:58:21,2025-01-30 09:08:32
311,SKU1310,Style Break,Cost customer art art population degree.,222.29,USD,9,ACTIVE,2025-08-29 21:54:30,2025-04-20 23:56:24
312,SKU1311,Anyone Head,Magazine parent involve color traditional cause.,43.84,USD,5,ACTIVE,2025-03-04 07:59:39,2025-04-08 19:43:39
313,SKU1312,Than Teacher,Discover full respond former they hope.,17.55,USD,3,ARCHIVED,2025-01-13 12:39:53,2025-03-24 01:58:49
314,SKU1313,Identify Expert,Writer sit professor.,481.51,USD,6,ACTIVE,2025-06-23 21:51:42,2025-07-12 06:24:48
315,SKU1314,Possible Speech,Fine ten opportunity information true describe.,418.81,USD,2,ACTIVE,2025-07-29 15:50:18,2025-03-29 01:21:43
316,SKU1315,Special Dream,Relate at election region provide despite little.,349.51,USD,4,ACTIVE,2025-01-26 06:19:16,2025-02-03 11:17:49
317,SKU1316,Third Ready,Actually sing vote heart door.,207.43,USD,6,INACTIVE,2025-08-12 20:17:05,2025-04-19 07:04:18
318,SKU1317,Draw Off,Worry inside quickly arrive.,90.78,USD,5,ACTIVE,2025-02-20 19:13:35,2025-03-10 13:21:37
319,SKU1318,Best Return,Sing us institution.,82.44,USD,3,ARCHIVED,2025-04-13 14:40:24,2025-03-18 09:04:48
320,SKU1319,Professor Fine,General purpose size my.,128.87,USD,8,INACTIVE,2025-07-09 05:49:25,2025-07-29 15:43:26
321,SKU1320,Authority What,Glass own though simply determine such.,276.87,USD,9,ACTIVE,2025-08-07 05:22:19,2025-01-20 05:04:29
322,SKU1321,Left Year,Determine guy pressure move talk cut tell.,358.72,USD,5,ACTIVE,2025-04-25 01:10:54,2025-09-02 14:13:20
323,SKU1322,Nature Side,None area major thing mind up.,331.8,USD,10,INACTIVE,2025-09-07 05:03:04,2025-03-17 15:23:44
324,SKU1323,Authority Send,Chair stuff charge thought official.,143.57,USD,9,ACTIVE,2025-07-12 05:43:35,2025-07-17 22:32:13
325,SKU1324,Wish Million,On wish drug.,477.66,USD,1,ACTIVE,2025-03-14 02:00:27,2025-03-11 12:49:56
326,SKU1325,Want Interest,Detail water doctor sell eat traditional above write.,370.26,USD,9,ARCHIVED,2025-06-21 17:58:18,2025-03-08 18:18:08
327,SKU1326,Use Realize,Without keep fish out hope particularly.,279.41,USD,5,INACTIVE,2025-07-12 06:12:08,2025-07-27 09:59:56
328,SKU1327,Wide Serious,Play leave real if.,307.8,USD,2,ARCHIVED,2025-05-01 00:06:48,2025-03-25 14:09:55
329,SKU1328,Bed Measure,Hit also believe clearly discussion.,212.7,USD,3,ACTIVE,2025-07-08 06:05:20,2025-04-13 12:54:55
330,SKU1329,Eight Contain,Manage item real want.,127.63,USD,5,ARCHIVED,2025-04-13 16:32:58,2025-05-26 03:22:09
331,SKU1330,Only Occur,That ok management check.,181.21,USD,2,ACTIVE,2025-02-25 15:00:10,2025-04-24 11:08:10
332,SKU1331,Language Low,Forward point simply sing.,380.13,USD,2,INACTIVE,2025-08-18 04:58:08,2025-08-08 21:23:54
333,SKU1332,Speak Interview,Seek police interview store.,12.12,USD,9,INACTIVE,2025-05-03 03:43:12,2025-02-07 12:20:07
334,SKU1333,Report Into,Stand with society major inside before.,62.46,USD,3,INACTIVE,2025-07-22 02:26:45,2025-01-07 09:54:55
335,SKU1334,Later None,Piece set tonight the involve station.,27.77,USD,5,ARCHIVED,2025-05-22 14:22:48,2025-01-15 18:44:08
336,SKU1335,Reality Summer,Tough throughout me already sort into.,25.16,USD,5,ARCHIVED,2025-03-28 14:37:13,2025-06-17 14:02:28
337,SKU1336,Girl Stock,Hair even laugh myself later development.,428.45,USD,10,ACTIVE,2025-08-23 01:51:44,2025-03-17 21:20:05
338,SKU1337,Stand Themselves,Player they management recognize.,353.31,USD,4,INACTIVE,2025-01-25 12:11:53,2025-02-26 12:03:14
339,SKU1338,Smile A,Occur outside personal woman.,239.72,USD,6,ARCHIVED,2025-08-11 19:55:23,2025-06-13 13:57:57
340,SKU1339,Cost Can,World institution less military price day three season.,53.43,USD,4,ACTIVE,2025-03-10 14:45:10,2025-05-16 00:42:26
341,SKU1340,Program Public,Process right process care reflect green ball.,248.35,USD,5,ARCHIVED,2025-03-30 02:36:42,2025-05-12 01:40:36
342,SKU1341,Room Start,Friend control ability reveal return dark.,239.37,USD,9,ACTIVE,2025-05-02 07:10:01,2025-03-28 16:12:19
343,SKU1342,College Drive,Article understand south experience strategy firm.,90.73,USD,8,ARCHIVED,2025-08-26 00:21:49,2025-06-23 03:05:33
344,SKU1343,Anyone By,For event career cost watch.,219.76,USD,5,ARCHIVED,2025-08-30 11:48:13,2025-07-16 09:47:39
345,SKU1344,Police End,Security challenge hospital whole agent worry cold white.,202.26,USD,1,ARCHIVED,2025-08-25 11:00:00,2025-04-14 08:07:11
346,SKU1345,Wide Single,Hot national time team management bit.,309.85,USD,2,INACTIVE,2025-06-14 23:01:20,2025-07-12 07:57:15
347,SKU1346,Chair President,Blood watch sort few fire boy including.,319.37,USD,7,INACTIVE,2025-01-17 20:39:32,2025-07-11 12:26:57
348,SKU1347,Every Will,Way drive product real in hotel option.,27.43,USD,5,ARCHIVED,2025-01-28 17:02:50,2025-01-09 04:50:12
349,SKU1348,Million Air,Above front free military.,190.43,USD,1,ACTIVE,2025-08-09 19:04:15,2025-01-18 09:47:11
350,SKU1349,Reveal Long,Tonight certain sort he room but tax thus.,314.8,USD,1,ACTIVE,2025-08-25 08:42:28,2025-03-21 21:28:35
351,SKU1350,Nor Several,Exactly half share figure mother action.,254.05,USD,6,INACTIVE,2025-02-02 09:56:46,2025-02-10 00:16:12
352,SKU1351,Them Manager,Leave claim often sit.,428.96,USD,3,INACTIVE,2025-03-26 07:49:57,2025-07-24 17:47:59
353,SKU1352,Member Wall,Ago record break support food business.,331.05,USD,5,INACTIVE,2025-04-27 18:17:29,2025-03-20 06:34:17
354,SKU1353,More Manage,Because move bring series activity back prove movement.,85.65,USD,3,ARCHIVED,2025-01-16 17:10:33,2025-06-30 12:13:00
355,SKU1354,East Term,Offer small soon power kind well choose light.,39.93,USD,8,ACTIVE,2025-07-27 13:36:54,2025-08-12 08:27:29
356,SKU1355,May Night,Sea can build perform.,323.0,USD,9,INACTIVE,2025-08-29 15:55:58,2025-02-06 17:04:29
357,SKU1356,Institution Something,Either trouble nation child production easy stop.,18.12,USD,7,ARCHIVED,2025-01-07 08:08:37,2025-01-12 01:33:24
358,SKU1357,Send Television,Down challenge moment thought.,294.96,USD,9,INACTIVE,2025-04-27 02:59:43,2025-02-08 07:41:36
359,SKU1358,Book Teacher,Behavior painting few interesting Democrat.,470.41,USD,1,ACTIVE,2025-07-24 11:33:23,2025-09-05 15:45:59
360,SKU1359,Argue Weight,Girl here vote response machine.,289.86,USD,2,ACTIVE,2025-05-16 11:33:55,2025-03-16 11:23:57
361,SKU1360,Or Which,Industry tree do might receive age note.,197.14,USD,2,INACTIVE,2025-08-04 12:03:47,2025-05-06 19:00:22
362,SKU1361,Matter Decision,Pass strong wonder pattern once respond opportunity artist.,323.43,USD,3,ARCHIVED,2025-08-08 11:47:04,2025-07-03 16:23:46
363,SKU1362,Check Per,Before finish work family.,231.84,USD,9,ACTIVE,2025-06-11 23:32:58,2025-03-27 04:46:33
364,SKU1363,With Clear,Power in would might actually.,275.08,USD,1,ACTIVE,2025-05-11 11:05:44,2025-06-29 07:14:41
365,SKU1364,Gas Rest,Rich picture me our authority party garden.,471.03,USD,6,ACTIVE,2025-03-11 18:37:27,2025-01-02 13:26:03
366,SKU1365,Able Prepare,Way work property itself.,196.12,USD,10,INACTIVE,2025-03-09 11:19:46,2025-05-07 02:23:36
367,SKU1366,House Her,Somebody court throw rule third.,480.79,USD,9,ARCHIVED,2025-06-06 16:47:26,2025-09-04 18:16:48
368,SKU1367,Best Will,Police learn task actually.,453.15,USD,3,ARCHIVED,2025-05-27 20:32:23,2025-01-19 10:13:13
369,SKU1368,Save Cause,Pm indicate teach energy.,101.92,USD,7,ARCHIVED,2025-07-17 00:37:21,2025-04-21 10:11:41
370,SKU1369,Area Then,People center professional finish onto.,39.33,USD,3,ARCHIVED,2025-04-22 07:21:28,2025-04-28 09:15:00
371,SKU1370,We Note,East society participant chance.,54.89,USD,1,ARCHIVED,2025-08-15 02:25:19,2025-08-14 17:30:37
372,SKU1371,Tell Baby,Accept respond capital throw growth laugh sit.,14.02,USD,5,INACTIVE,2025-06-25 21:01:33,2025-07-28 08:14:01
373,SKU1372,In Real,Ask store benefit across.,51.75,USD,6,INACTIVE,2025-01-28 04:48:56,2025-05-27 01:52:34
374,SKU1373,House Identify,Appear think figure economic.,343.09,USD,1,ARCHIVED,2025-06-09 01:01:14,2025-03-02 21:40:09
375,SKU1374,Various General,On Democrat late gas ask already.,40.24,USD,6,ARCHIVED,2025-01-21 03:04:52,2025-02-05 13:19:43
376,SKU1375,Include He,Whole structure thank audience as.,162.89,USD,4,INACTIVE,2025-04-21 01:08:56,2025-03-10 09:26:52
377,SKU1376,Carry None,Base teach father debate much tree.,423.21,USD,4,INACTIVE,2025-09-01 16:27:25,2025-02-16 21:00:26
378,SKU1377,Cold Again,Defense century firm once shoulder consumer serve.,16.52,USD,2,ARCHIVED,2025-09-06 09:04:51,2025-03-05 05:53:45
379,SKU1378,Someone Just,As language road perform usually against.,408.16,USD,6,ARCHIVED,2025-02-13 18:12:55,2025-02-16 05:24:26
380,SKU1379,Late Case,Participant commercial dog set.,144.52,USD,9,INACTIVE,2025-03-24 20:33:48,2025-08-16 04:39:13
381,SKU1380,Computer City,Major carry usually clearly mother game carry.,63.49,USD,7,ACTIVE,2025-03-28 16:13:27,2025-01-04 01:23:59
382,SKU1381,Field Build,Other adult girl address.,349.88,USD,10,ARCHIVED,2025-04-16 21:10:36,2025-01-30 14:53:07
383,SKU1382,A Read,Financial economy society should.,316.33,USD,3,ACTIVE,2025-02-13 16:42:22,2025-02-17 14:03:17
384,SKU1383,Wait Around,Senior memory hope administration body.,439.35,USD,4,ARCHIVED,2025-08-30 16:57:21,2025-01-18 20:16:31
385,SKU1384,Article Protect,Relate what agree.,368.86,USD,3,ARCHIVED,2025-06-14 02:58:32,2025-05-12 16:57:39
386,SKU1385,Class Ask,Still PM question significant.,402.72,USD,3,ARCHIVED,2025-08-06 08:57:33,2025-07-13 09:04:49
387,SKU1386,Approach Player,Opportunity personal produce speech education measure.,144.61,USD,7,ARCHIVED,2025-02-15 09:16:30,2025-02-28 12:39:29
388,SKU1387,Media Year,Like great law yet.,92.83,USD,1,ACTIVE,2025-03-29 11:16:30,2025-06-08 19:07:27
389,SKU1388,Give Television,Person also save paper energy.,376.55,USD,3,INACTIVE,2025-05-05 05:29:21,2025-02-11 03:35:49
390,SKU1389,Budget Simple,Figure real major authority.,404.38,USD,6,INACTIVE,2025-02-07 16:11:43,2025-08-20 12:17:08
391,SKU1390,Foot Help,Offer child civil away sister phone himself.,495.3,USD,7,ACTIVE,2025-04-25 14:01:28,2025-07-01 01:14:10
392,SKU1391,Resource Others,Provide measure at professor campaign government third.,209.25,USD,4,INACTIVE,2025-06-07 04:39:33,2025-04-29 19:43:10
393,SKU1392,Central Different,Happy where eye want cell central present meeting.,189.15,USD,5,INACTIVE,2025-04-01 15:22:48,2025-05-21 04:39:19
394,SKU1393,Arrive Collection,Discuss cost deal experience tough.,389.32,USD,3,INACTIVE,2025-02-03 18:39:15,2025-05-30 07:10:16
395,SKU1394,Feeling Red,Effect do speak.,173.7,USD,2,INACTIVE,2025-02-03 03:18:44,2025-04-22 23:40:48
396,SKU1395,Picture Mr,Point away design man while.,465.72,USD,7,INACTIVE,2025-08-19 00:13:32,2025-06-22 18:18:55
397,SKU1396,Develop Nature,Fund very technology free plant campaign.,429.91,USD,1,ARCHIVED,2025-04-23 13:23:56,2025-04-19 13:20:09
398,SKU1397,Policy Development,Material toward lawyer number imagine general spend rise.,217.35,USD,8,ACTIVE,2025-02-02 02:33:38,2025-05-01 19:09:32
399,SKU1398,Program Story,Ahead prepare more mission figure leg sound.,376.68,USD,4,INACTIVE,2025-06-12 13:44:28,2025-01-31 23:55:16
400,SKU1399,Tv Itself,Doctor interesting experience.,378.5,USD,4,INACTIVE,2025-01-08 15:32:11,2025-04-18 10:54:15
401,SKU1400,Present Memory,Region go foreign child source.,56.05,USD,8,INACTIVE,2025-08-20 17:27:02,2025-05-07 10:32:55
402,SKU1401,Eat Especially,They third last hospital least.,451.76,USD,6,ARCHIVED,2025-04-02 11:08:26,2025-07-21 22:44:13
403,SKU1402,Across Election,Walk it individual indeed.,255.1,USD,5,INACTIVE,2025-01-16 09:20:33,2025-02-07 18:22:07
404,SKU1403,The Audience,Beat mind operation side stay.,414.1,USD,4,INACTIVE,2025-03-01 13:04:06,2025-06-20 12:26:13
405,SKU1404,Lead Including,Pretty case simple indicate eye product finish.,163.42,USD,4,ACTIVE,2025-02-27 21:53:07,2025-02-25 21:41:16
406,SKU1405,Listen Mr,Born gas picture just sport value agent.,448.28,USD,1,ARCHIVED,2025-01-13 03:10:23,2025-03-23 21:19:24
407,SKU1406,Call But,Full what soldier activity in another sure.,197.65,USD,4,INACTIVE,2025-06-18 18:19:37,2025-08-01 14:39:31
408,SKU1407,Safe Wear,To tonight listen meet rest stand.,10.36,USD,7,ACTIVE,2025-01-12 06:58:43,2025-04-21 21:07:28
409,SKU1408,North National,Brother available indeed also without suffer professor reach.,453.16,USD,6,ACTIVE,2025-09-02 06:01:51,2025-03-10 19:36:57
410,SKU1409,Various Agreement,Base section fill help someone.,50.19,USD,5,ACTIVE,2025-02-24 06:45:26,2025-08-02 22:51:05
411,SKU1410,Line Table,Candidate lawyer born project.,163.06,USD,2,ACTIVE,2025-01-23 22:41:14,2025-02-27 22:36:25
412,SKU1411,Enter Would,Create under student rock owner ago.,475.28,USD,5,INACTIVE,2025-04-19 03:45:55,2025-06-23 21:19:08
413,SKU1412,Represent Chair,Recognize certainly back game.,475.55,USD,6,ACTIVE,2025-05-09 05:10:00,2025-07-02 11:18:56
414,SKU1413,Campaign Man,Dog bill claim sell almost.,288.85,USD,9,ARCHIVED,2025-03-14 07:47:20,2025-07-08 19:15:47
415,SKU1414,Since Parent,Former give fear enough everyone prove person outside.,317.76,USD,7,ARCHIVED,2025-06-17 23:58:14,2025-05-18 05:25:31
416,SKU1415,Big Order,Paper rich my represent health organization try.,226.98,USD,9,INACTIVE,2025-04-21 20:17:38,2025-02-17 12:33:03
417,SKU1416,Door Ask,Clear sport community door explain edge.,150.14,USD,6,ACTIVE,2025-02-07 23:53:09,2025-05-24 12:51:04
418,SKU1417,Run Candidate,Too reflect onto ago low.,167.69,USD,1,ARCHIVED,2025-06-06 16:57:58,2025-08-19 05:48:08
419,SKU1418,Machine American,Summer purpose house happy free them summer.,337.9,USD,2,ACTIVE,2025-03-07 12:53:50,2025-03-01 04:27:10
420,SKU1419,Discuss Series,Activity popular current direction scientist listen about.,377.43,USD,5,ARCHIVED,2025-08-17 01:49:50,2025-02-14 02:34:02
421,SKU1420,Likely Back,Important information either worry.,396.83,USD,3,ARCHIVED,2025-04-20 01:58:24,2025-08-22 00:32:14
422,SKU1421,Short Whose,Laugh bag serious.,395.86,USD,10,ARCHIVED,2025-03-06 03:17:34,2025-02-21 23:54:37
423,SKU1422,Push Candidate,Now real purpose system.,50.15,USD,5,INACTIVE,2025-08-07 20:13:29,2025-07-19 18:42:49
