product_id,sku,name,description,price,currency,category_id,status,created_at,updated_at
635,SKU1634,Significant Agency,Government get easy time whether base seek.,58.05,USD,4,ACTIVE,2025-04-24 09:00:01,2025-04-16 16:59:25
636,SKU1635,Change Size,Week police believe save federal yourself.,226.47,USD,3,INACTIVE,2025-07-16 00:55:01,2025-01-20 04:02:39
637,SKU1636,Water Program,Probably she wish child majority arrive.,268.65,USD,8,ACTIVE,2025-08-27 14:02:10,2025-04-19 10:46:29
638,SKU1637,Than Plant,Laugh base style before expect blood his.,125.02,USD,2,INACTIVE,2025-04-21 04:17:35,2025-04-22 22:57:45
639,SKU1638,Watch Gas,Which join strong machine play nature to.,138.28,USD,10,INACTIVE,2025-06-06 14:11:54,2025-05-07 00:45:44
640,SKU1639,Look Sense,Single hour eye point put toward.,191.76,USD,4,ARCHIVED,2025-06-20 11:32:59,2025-07-30 03:27:47
641,SKU1640,Though Book,Close them final carry film.,14.94,USD,8,INACTIVE,2025-03-11 12:30:27,2025-02-22 07:05:44
642,SKU1641,Rather Entire,Lay goal run even party.,164.43,USD,5,INACTIVE,2025-06-02 02:04:28,2025-04-30 04:08:58
643,SKU1642,Against End,Treat cost nothing little.,109.67,USD,6,ARCHIVED,2025-05-11 23:09:28,2025-05-05 03:49:10
644,SKU1643,How Surface,Often these day everyone.,167.11,USD,3,ACTIVE,2025-02-01 03:43:08,2025-07-20 17:21:02
645,SKU1644,Bill Door,Tonight dinner citizen challenge.,64.28,USD,10,INACTIVE,2025-02-09 08:12:12,2025-07-25 17:47:09
646,SKU1645,Piece Task,Summer his since show prevent administration.,445.81,USD,10,ARCHIVED,2025-06-24 11:50:55,2025-04-09 11:03:43
647,SKU1646,Wish Catch,Guy leave almost voice friend.,298.83,USD,2,ACTIVE,2025-08-05 12:10:59,2025-08-27 00:24:49
648,SKU1647,Position Rate,Sure card thank he I many.,341.16,USD,3,INACTIVE,2025-06-22 01:42:14,2025-05-04 14:01:13
649,SKU1648,Today Lose,Realize forget measure to on anyone.,395.64,USD,5,INACTIVE,2025-01-23 11:21:57,2025-05-06 12:20:47
650,SKU1649,Water Seven,Will always budget beautiful.,251.73,USD,2,INACTIVE,2025-04-07 10:08:07,2025-06-11 19:30:47
651,SKU1650,Treatment Again,Claim age analysis once sell.,48.03,USD,10,ACTIVE,2025-03-23 06:05:38,2025-04-01 09:39:03
652,SKU1651,Win Media,Agree tree citizen fear.,270.87,USD,1,ACTIVE,2025-01-12 17:46:26,2025-08-25 05:41:19
653,SKU1652,Information Theory,Ask line only.,295.49,USD,5,INACTIVE,2025-02-02 18:16:45,2025-07-06 01:54:10
654,SKU1653,Too Color,Where often government service.,373.99,USD,10,INACTIVE,2025-04-17 11:10:24,2025-03-13 08:16:20
655,SKU1654,Pressure Seat,Have wall real edge.,218.67,USD,7,ACTIVE,2025-02-15 01:52:08,2025-05-01 08:40:19
656,SKU1655,Particularly Compare,Single down these through last stay response.,68.15,USD,7,ARCHIVED,2025-08-24 00:37:08,2025-03-16 23:31:49
657,SKU1656,Leave Available,Church employee happy statement from.,145.47,USD,4,ACTIVE,2025-03-07 11:39:11,2025-04-08 18:22:00
658,SKU1657,Whose Measure,Up former must produce.,184.73,USD,2,ARCHIVED,2025-02-18 20:00:10,2025-08-25 03:42:07
659,SKU1658,Protect Out,Official argue item customer speak.,324.73,USD,10,ARCHIVED,2025-08-25 06:56:29,2025-01-05 08:39:47
660,SKU1659,Child Word,Our human under career project response tax machine.,287.54,USD,4,ARCHIVED,2025-07-30 15:23:51,2025-08-06 14:34:52
661,SKU1660,Rich His,Individual piece week member.,181.27,USD,2,INACTIVE,2025-05-31 08:12:43,2025-04-14 04:57:14
662,SKU1661,Appear Quality,Business forget dinner.,493.33,USD,5,INACTIVE,2025-01-06 21:54:12,2025-01-25 01:34:35
663,SKU1662,Success Agency,Inside floor interesting sign.,304.86,USD,10,ARCHIVED,2025-08-02 05:32:18,2025-07-13 08:21:21
664,SKU1663,Movement Election,Possible condition carry nice admit watch.,122.43,USD,2,ARCHIVED,2025-06-11 10:13:23,2025-05-02 18:46:52
665,SKU1664,Force Hit,Move threat mouth rate if pay.,55.38,USD,10,ARCHIVED,2025-01-17 13:18:45,2025-07-10 15:31:59
666,SKU1665,Own Would,Rock run surface before news.,80.67,USD,1,ACTIVE,2025-07-04 22:35:21,2025-05-18 21:54:04
667,SKU1666,Mention Treat,Street together effort mission name have yes.,126.75,USD,6,INACTIVE,2025-06-09 03:32:00,2025-08-04 19:16:50
668,SKU1667,As Executive,Political value around born move theory speech.,84.54,USD,9,ARCHIVED,2025-07-27 05:51:12,2025-03-27 16:49:24
669,SKU1668,Skill Image,Easy social along without citizen new.,97.35,USD,7,ARCHIVED,2025-05-01 00:31:10,2025-08-02 03:21:28
670,SKU1669,Evening Girl,Seek room serious pass give.,146.12,USD,6,ACTIVE,2025-01-15 04:42:46,2025-03-13 08:16:20
671,SKU1670,Material Involve,Mention crime current hit down drug natural those.,90.82,USD,2,INACTIVE,2025-01-29 05:13:32,2025-06-13 03:38:51
672,SKU1671,Family Heart,Break view public eight audience off close still.,448.9,USD,9,ARCHIVED,2025-04-15 03:36:31,2025-08-21 19:34:24
673,SKU1672,Mind First,Campaign pattern positive project though half.,44.72,USD,6,INACTIVE,2025-04-20 12:22:16,2025-09-05 13:19:06
674,SKU1673,Everything Baby,His deep thousand structure best can.,264.63,USD,1,ARCHIVED,2025-01-12 06:10:04,2025-07-10 17:11:31
675,SKU1674,Teach Run,Support data along effect.,208.15,USD,7,ACTIVE,2025-04-30 17:53:28,2025-04-06 06:11:12
676,SKU1675,Blood Task,Step collection ready time safe rich.,491.28,USD,8,ACTIVE,2025-07-13 12:34:09,2025-05-01 06:14:06
677,SKU1676,Check Add,Speak member would according local view.,60.46,USD,2,INACTIVE,2025-05-01 11:48:33,2025-07-06 20:27:41
678,SKU1677,Add Learn,Among recent development character travel.,201.94,USD,7,ACTIVE,2025-03-03 09:42:00,2025-03-01 08:33:53
679,SKU1678,Figure The,Wind cold environmental least ground away.,484.89,USD,6,INACTIVE,2025-01-14 17:47:39,2025-03-05 00:54:33
680,SKU1679,Note Study,Check message side let memory stock professor add.,433.43,USD,8,ARCHIVED,2025-04-21 09:31:14,2025-04-08 01:57:30
681,SKU1680,Consider Mind,Administration forget deep put arm return newspaper.,409.45,USD,3,ACTIVE,2025-03-30 18:08:19,2025-04-22 02:46:11
682,SKU1681,Those Billion,Memory case no experience.,132.66,USD,7,ARCHIVED,2025-04-26 23:11:38,2025-06-23 23:19:33
683,SKU1682,Only Shake,Fine discussion evidence stage involve remain.,89.59,USD,3,ARCHIVED,2025-06-12 20:00:18,2025-07-14 17:33:34
684,SKU1683,Fund Green,Yes control amount may determine care those.,335.98,USD,9,ACTIVE,2025-08-23 19:24:29,2025-01-20 07:08:57
685,SKU1684,Energy Away,Include manage reflect position nor expect week.,465.04,USD,5,ACTIVE,2025-06-08 02:47:35,2025-05-11 16:35:33
686,SKU1685,Safe Whole,Past artist government debate store join data.,280.6,USD,10,ACTIVE,2025-02-12 15:26:25,2025-05-25 07:01:52
687,SKU1686,Light Artist,Job represent teach sit.,287.95,USD,9,ARCHIVED,2025-06-09 00:32:08,2025-05-03 06:21:47
688,SKU1687,Level Draw,Purpose day mother.,143.59,USD,8,INACTIVE,2025-01-20 17:38:37,2025-08-09 08:37:55
689,SKU1688,Camera Look,Space big low tough place.,385.9,USD,8,INACTIVE,2025-07-05 01:42:20,2025-05-09 16:03:46
690,SKU1689,White Nor,Experience daughter four million once over per.,97.59,USD,7,ARCHIVED,2025-02-28 12:00:43,2025-03-13 15:08:23
691,SKU1690,Interview Central,Yourself various career remain data box.,165.22,USD,10,ARCHIVED,2025-02-01 17:26:59,2025-08-16 09:44:16
692,SKU1691,Subject Sport,Rise sister brother network bag.,215.59,USD,5,ARCHIVED,2025-01-08 02:35:06,2025-08-10 07:55:16
693,SKU1692,Personal Tend,Can learn science race ability husband.,256.27,USD,6,ACTIVE,2025-08-20 21:12:36,2025-05-02 20:34:29
694,SKU1693,Past Sister,Happy station rise win piece maybe because.,124.99,USD,4,INACTIVE,2025-01-30 06:39:06,2025-06-15 17:17:49
695,SKU1694,Late Within,Meet morning born suddenly kind property.,61.84,USD,2,INACTIVE,2025-06-20 04:29:24,2025-07-30 07:00:34
696,SKU1695,Radio By,Tax computer pull necessary so.,307.26,USD,5,INACTIVE,2025-03-12 15:33:03,2025-05-06 03:29:08
697,SKU1696,Dream Agree,Quality cultural million approach science health.,147.87,USD,8,INACTIVE,2025-08-28 08:22:16,2025-02-26 10:29:16
698,SKU1697,Beautiful Anything,Husband far activity air marriage.,292.71,USD,4,INACTIVE,2025-06-03 21:31:31,2025-04-04 21:06:22
699,SKU1698,Relationship Including,Treatment hundred tonight.,81.41,USD,8,INACTIVE,2025-08-26 15:01:39,2025-02-21 04:59:58
700,SKU1699,Pretty From,Network to can around box.,243.16,USD,10,ARCHIVED,2025-05-16 00:01:41,2025-06-27 19:03:53
701,SKU1700,Upon Either,Speak benefit month not be this happen office.,268.63,USD,10,ARCHIVED,2025-03-07 16:18:14,2025-03-02 15:19:54
702,SKU1701,Grow Democratic,Finally series big meeting look ground work task.,30.65,USD,7,ACTIVE,2025-07-07 11:38:26,2025-06-19 09:12:28
703,SKU1702,Assume Receive,Join garden wide husband.,171.62,USD,6,ARCHIVED,2025-08-15 18:49:56,2025-08-04 07:23:49
704,SKU1703,Important Off,Bit behavior understand.,71.54,USD,1,ARCHIVED,2025-04-25 12:12:57,2025-02-19 05:38:26
705,SKU1704,Concern Easy,Might talk attention alone.,36.37,USD,8,INACTIVE,2025-04-29 16:28:59,2025-04-04 10:29:47
706,SKU1705,Tell Media,Bag team dinner present.,495.03,USD,6,ACTIVE,2025-07-01 02:17:45,2025-06-12 06:08:51
707,SKU1706,Leave Paper,Special protect candidate four everyone course too.,164.57,USD,3,INACTIVE,2025-02-20 17:11:31,2025-02-21 02:15:28
708,SKU1707,Air Listen,Year full administration now toward reflect.,405.89,USD,8,ACTIVE,2025-05-21 01:52:09,2025-06-14 10:03:12
709,SKU1708,Agreement Material,Indicate answer pass develop past game rule.,131.05,USD,4,ARCHIVED,2025-03-23 10:23:58,2025-06-22 20:11:46
710,SKU1709,Let Figure,Beat image goal operation item what very.,342.34,USD,6,ARCHIVED,2025-09-06 19:48:09,2025-01-02 16:43:36
711,SKU1710,News Successful,Soldier member lead.,381.31,USD,5,INACTIVE,2025-09-03 04:00:32,2025-07-18 01:37:47
712,SKU1711,Until System,News quickly actually Republican true herself of wonder.,299.84,USD,6,INACTIVE,2025-08-18 22:30:52,2025-05-22 14:18:10
713,SKU1712,He Budget,Stand local skill space assume answer.,238.43,USD,5,INACTIVE,2025-01-08 20:15:11,2025-07-29 21:28:06
714,SKU1713,Break Modern,Actually one develop rather usually.,208.86,USD,10,ARCHIVED,2025-06-23 03:27:33,2025-08-21 13:25:02
715,SKU1714,Bar Although,Most cover memory building discussion relate identify.,177.69,USD,5,ARCHIVED,2025-04-04 17:29:55,2025-06-28 13:28:54
716,SKU1715,Cover Buy,Race nothing stuff cup.,465.12,USD,9,ARCHIVED,2025-04-23 03:44:32,2025-03-30 11:38:39
717,SKU1716,Try Within,Remember stuff expert or scene send.,416.16,USD,1,ACTIVE,2025-01-26 20:10:12,2025-03-15 05:39:43
718,SKU1717,Bank Other,Tough federal machine.,482.69,USD,9,INACTIVE,2025-03-16 01:55:43,2025-07-28 01:11:40
719,SKU1718,Development Growth,Identify yard hot east much focus however.,66.53,USD,4,ACTIVE,2025-06-03 23:05:19,2025-07-22 19:43:11
720,SKU1719,Ahead Help,He painting security some name.,366.78,USD,2,ARCHIVED,2025-07-21 11:06:27,2025-07-24 00:58:44
721,SKU1720,Bag Myself,Life though hot mother determine production reveal either.,469.48,USD,4,ARCHIVED,2025-01-22 03:35:53,2025-07-07 06:07:47
722,SKU1721,Speech Watch,Approach result standard police ask.,94.71,USD,7,ACTIVE,2025-05-03 09:56:19,2025-06-10 21:15:36
723,SKU1722,Tell Eight,Position stand chance science.,37.92,USD,8,INACTIVE,2025-01-15 05:24:32,2025-04-18 16:35:08
724,SKU1723,Former Treatment,Book exist reach second hand.,371.85,USD,9,INACTIVE,2025-03-13 17:09:54,2025-01-30 23:07:47
725,SKU1724,Wall Night,Benefit artist protect perform thank program piece.,289.36,USD,4,ARCHIVED,2025-04-08 17:50:30,2025-02-06 07:01:34
726,SKU1725,Throughout Use,Newspaper brother serve red item indicate family.,421.71,USD,8,ARCHIVED,2025-08-15 19:32:47,2025-05-27 08:04:54
727,SKU1726,One Owner,Look book fight yard.,74.19,USD,8,ARCHIVED,2025-06-15 00:52:09,2025-05-11 21:57:34
728,SKU1727,Develop Keep,Item former visit despite sea wait.,398.66,USD,8,INACTIVE,2025-03-12 06:44:43,2025-05-14 02:20:02
729,SKU1728,Husband Condition,Several by approach walk.,104.81,USD,1,ACTIVE,2025-05-29 01:35:59,2025-02-17 12:15:09
730,SKU1729,Space Purpose,West debate drive responsibility.,86.01,USD,2,ARCHIVED,2025-07-29 14:56:39,2025-02-06 04:26:09
731,SKU1730,Image Recent,Popular region civil give defense again.,86.31,USD,5,ARCHIVED,2025-02-11 11:39:26,2025-07-14 11:24:31
732,SKU1731,Provide Have,Care whom face former somebody seem service.,408.21,USD,4,ACTIVE,2025-04-25 22:24:41,2025-01-22 08:44:01
733,SKU1732,Community Effect,Ten become left exist term light threat.,334.27,USD,7,INACTIVE,2025-02-18 03:40:51,2025-05-03 01:13:59
734,SKU1733,Service Half,Station wish than daughter.,263.92,USD,4,ARCHIVED,2025-04-19 02:10:46,2025-07-25 16:08:32
735,SKU1734,Authority Always,Democrat north knowledge pretty billion.,182.62,USD,5,INACTIVE,2025-08-07 04:42:48,2025-06-23 16:40:14
736,SKU1735,Identify Thought,Fire drop black name go opportunity.,439.21,USD,10,ARCHIVED,2025-09-01 06:39:35,2025-05-22 14:52:54
737,SKU1736,Large Material,Early office month everything week name site produce.,199.26,USD,6,INACTIVE,2025-08-28 16:16:40,2025-02-28 05:04:43
738,SKU1737,Personal Control,Space production force authority floor beat occur.,409.22,USD,8,ACTIVE,2025-03-23 13:32:59,2025-08-22 22:05:55
739,SKU1738,Night Writer,Foreign professor long least animal.,222.37,USD,9,ARCHIVED,2025-07-28 20:25:25,2025-01-31 05:12:38
740,SKU1739,Agree Surface,Republican billion describe left ever rich trip.,191.59,USD,9,ARCHIVED,2025-07-21 23:34:41,2025-06-18 23:04:28
741,SKU1740,Region Billion,Financial tend conference lead front cut.,234.03,USD,6,ARCHIVED,2025-01-06 00:10:47,2025-02-28 23:20:00
742,SKU1741,Record Sometimes,Bag hand do consider inside accept.,154.18,USD,7,ARCHIVED,2025-03-02 09:47:38,2025-01-26 05:27:53
743,SKU1742,Member Though,Maybe best offer ten.,375.07,USD,9,ARCHIVED,2025-08-16 20:18:37,2025-04-05 16:45:10
744,SKU1743,Stand Free,Approach culture leg.,253.85,USD,6,ACTIVE,2025-06-17 15:57:39,2025-04-03 16:31:20
745,SKU1744,Same Crime,Speech message about society.,119.95,USD,6,ARCHIVED,2025-03-30 11:02:37,2025-06-25 04:52:50
746,SKU1745,Debate Yet,At career next serve bag life.,450.29,USD,8,ARCHIVED,2025-08-17 17:57:31,2025-07-07 09:12:24
747,SKU1746,Make Design,Live grow fight hit newspaper.,195.03,USD,5,INACTIVE,2025-06-19 15:45:13,2025-03-03 00:18:46
748,SKU1747,Team Rest,Important audience manager traditional herself.,274.06,USD,5,ARCHIVED,2025-02-03 20:55:25,2025-09-02 02:44:39
749,SKU1748,Onto Plan,Red fact social.,453.7,USD,5,INACTIVE,2025-03-21 06:51:15,2025-03-03 01:43:07
750,SKU1749,History Yard,Above return certainly off loss student meeting.,314.0,USD,4,ACTIVE,2025-05-20 03:19:23,2025-07-05 14:57:48
751,SKU1750,Person Local,Image science herself save speech fight war.,62.86,USD,2,INACTIVE,2025-02-21 05:59:58,2025-03-21 20:00:03
752,SKU1751,Usually Under,Career appear where sister training receive.,470.22,USD,4,INACTIVE,2025-05-22 07:00:13,2025-04-25 22:31:34
753,SKU1752,Father Dinner,Account television theory.,315.72,USD,6,ACTIVE,2025-08-28 09:26:59,2025-06-21 15:41:48
754,SKU1753,Economy Since,Remember certain change large section painting car character.,170.78,USD,2,ACTIVE,2025-07-23 19:02:54,2025-03-20 06:50:29
755,SKU1754,Foreign Memory,Car tree degree item effort table success quickly.,73.94,USD,9,INACTIVE,2025-04-04 05:39:35,2025-08-10 18:44:34
756,SKU1755,Threat Also,Section money north beautiful yard.,398.04,USD,3,INACTIVE,2025-06-20 06:47:35,2025-09-01 09:23:11
757,SKU1756,Discussion Only,Available sing improve still other.,311.94,USD,4,ACTIVE,2025-03-08 05:50:53,2025-05-15 14:19:46
758,SKU1757,Door Anyone,Pattern discover school item picture.,269.06,USD,4,ACTIVE,2025-02-18 02:59:05,2025-01-16 08:18:13
759,SKU1758,Process Certainly,Dark during subject understand step clear charge indeed.,447.48,USD,8,ACTIVE,2025-03-08 19:18:35,2025-05-21 00:44:53
760,SKU1759,Action Western,Girl yeah challenge make walk.,395.36,USD,5,ACTIVE,2025-07-31 08:32:16,2025-04-24 10:44:04
761,SKU1760,Plan Country,Close own national.,80.08,USD,10,ACTIVE,2025-01-04 06:49:08,2025-06-15 02:59:59
762,SKU1761,Art Middle,Life check rich trip somebody large team.,159.3,USD,9,INACTIVE,2025-05-18 08:28:36,2025-08-01 05:49:12
763,SKU1762,Enough Cut,Free positive wall ready into.,128.0,USD,10,ACTIVE,2025-03-14 16:42:40,2025-07-26 09:02:04
764,SKU1763,Guess Green,Move traditional training wait.,373.25,USD,5,ARCHIVED,2025-06-28 21:19:12,2025-02-18 19:18:12
765,SKU1764,Action Surface,Some shoulder Democrat yourself gun.,21.6,USD,2,ARCHIVED,2025-04-15 07:16:57,2025-02-13 17:17:59
766,SKU1765,Daughter South,Health yes moment sea must.,287.1,USD,4,ARCHIVED,2025-03-26 03:34:33,2025-08-19 15:42:56
767,SKU1766,Range Able,Break point focus discover charge.,382.42,USD,5,ARCHIVED,2025-07-13 12:45:18,2025-07-17 13:58:48
768,SKU1767,Movement Memory,Wait forward both.,439.0,USD,4,ACTIVE,2025-04-19 14:44:20,2025-03-29 00:49:38
769,SKU1768,Party Behind,Might station modern situation fast low.,174.33,USD,6,ARCHIVED,2025-07-09 02:30:42,2025-02-06 22:02:46
770,SKU1769,Art Thought,Law join reduce everyone them one.,411.52,USD,3,INACTIVE,2025-02-10 19:38:24,2025-08-01 01:49:12
771,SKU1770,Whole Court,May case machine strong become action.,59.76,USD,5,ARCHIVED,2025-04-19 07:59:01,2025-01-11 18:19:46
772,SKU1771,Friend Soon,Edge claim whom different real final.,423.99,USD,1,ACTIVE,2025-06-11 12:53:12,2025-03-28 07:25:41
773,SKU1772,Method Street,Religious save reduce television choice southern.,68.11,USD,9,ARCHIVED,2025-06-11 00:03:32,2025-04-23 06:52:25
774,SKU1773,Today Improve,Quality yes various pick.,201.66,USD,3,INACTIVE,2025-05-31 16:17:02,2025-03-08 15:39:39
775,SKU1774,Wide Over,Side away eye lot news.,399.66,USD,5,ACTIVE,2025-03-12 20:22:23,2025-07-22 00:37:51
776,SKU1775,Company Time,Do board talk.,79.21,USD,1,ACTIVE,2025-04-19 22:13:32,2025-01-19 19:21:32
777,SKU1776,There Certainly,Break compare trouble PM film little.,118.48,USD,1,ACTIVE,2025-07-07 15:22:40,2025-06-13 19:01:37
778,SKU1777,General Tonight,College program price become us.,362.52,USD,9,ARCHIVED,2025-03-01 09:05:08,2025-04-20 12:34:10
779,SKU1778,Much President,Street brother mission successful ground part.,361.42,USD,5,ARCHIVED,2025-03-28 08:56:08,2025-04-24 01:15:35
780,SKU1779,Challenge Cut,Participant music likely employee.,322.37,USD,3,ACTIVE,2025-04-18 02:58:39,2025-02-11 19:23:46
781,SKU1780,Behind Apply,So per behind.,348.5,USD,8,ARCHIVED,2025-03-16 02:42:40,2025-07-27 03:38:41
782,SKU1781,Democratic Get,Effort away couple place fight she worry cup.,273.65,USD,2,INACTIVE,2025-07-29 15:09:15,2025-02-23 21:57:10
783,SKU1782,Also Spend,Agent movement yourself four fine article.,129.64,USD,1,ACTIVE,2025-05-04 02:53:05,2025-04-13 17:20:41
784,SKU1783,Too Budget,Already ok pass race.,176.12,USD,10,INACTIVE,2025-08-20 18:44:56,2025-01-15 08:44:05
785,SKU1784,Environmental Moment,Agreement gun those glass.,94.89,USD,5,INACTIVE,2025-04-14 19:19:30,2025-03-06 03:40:07
786,SKU1785,Include Draw,Father situation foreign herself ago maybe.,454.68,USD,8,ARCHIVED,2025-07-25 02:56:59,2025-03-28 03:24:07
787,SKU1786,Offer Real,Table reduce court security forward wrong service door.,293.78,USD,8,ARCHIVED,2025-08-03 22:53:36,2025-01-30 21:40:59
788,SKU1787,Old Child,Shoulder respond state guess senior office consumer.,203.42,USD,8,ACTIVE,2025-08-29 06:05:38,2025-07-23 14:20:27
789,SKU1788,International At,Traditional exist local interview safe with if degree.,233.69,USD,6,INACTIVE,2025-07-17 10:47:59,2025-01-07 16:38:15
790,SKU1789,Clearly Particularly,Reason feel think never travel.,473.91,USD,3,ARCHIVED,2025-07-12 18:58:05,2025-06-26 18:33:13
791,SKU1790,Past Pass,Sport pattern late his.,80.91,USD,1,INACTIVE,2025-08-04 07:44:11,2025-08-21 05:09:34
792,SKU1791,Team Radio,Win represent spring dark traditional camera approach.,295.18,USD,5,ARCHIVED,2025-01-10 18:38:56,2025-05-12 23:08:57
793,SKU1792,Head Social,Three challenge billion.,255.41,USD,8,INACTIVE,2025-04-02 10:43:04,2025-03-28 19:30:29
794,SKU1793,Common Arm,Bag between second summer.,307.67,USD,2,ACTIVE,2025-01-02 06:27:45,2025-03-05 12:11:42
795,SKU1794,Attack During,Forward throughout left just green.,13.96,USD,2,ARCHIVED,2025-01-03 08:45:49,2025-09-06 05:41:33
796,SKU1795,Six Send,Pick product occur yard than control.,436.7,USD,7,ACTIVE,2025-08-05 12:38:10,2025-05-02 00:44:16
797,SKU1796,Grow Kind,Control can including room decade.,466.4,USD,8,INACTIVE,2025-02-19 03:51:54,2025-07-17 13:20:53
798,SKU1797,Claim Mission,Education drug I prepare base old.,284.74,USD,2,INACTIVE,2025-06-09 09:12:59,2025-05-04 13:53:58
799,SKU1798,Tonight Consumer,Evidence late even generation.,349.84,USD,10,ACTIVE,2025-03-18 13:16:25,2025-05-16 05:12:00
800,SKU1799,Hour Boy,Party Mrs example apply fast if somebody.,461.64,USD,1,INACTIVE,2025-05-20 12:52:56,2025-04-03 09:06:09
801,SKU1800,Long Choice,Despite carry identify generation top.,355.08,USD,3,ARCHIVED,2025-06-07 04:05:28,2025-07-19 05:50:39
802,SKU1801,Eye Special,Successful him society tend exist sea.,80.51,USD,3,ARCHIVED,2025-09-03 14:36:51,2025-02-23 23:35:15
803,SKU1802,Guy Poor,Sell discuss kitchen wall cover seem.,290.26,USD,10,INACTIVE,2025-07-03 15:28:05,2025-08-08 14:03:53
804,SKU1803,Game Budget,Kitchen course material listen memory.,305.32,USD,5,INACTIVE,2025-05-20 21:07:13,2025-05-25 21:05:15
805,SKU1804,Election Line,Avoid worry boy if ever reach.,214.94,USD,2,INACTIVE,2025-07-02 05:24:09,2025-08-21 23:35:27
806,SKU1805,Itself A,Usually reveal whether walk forget bank model.,369.54,USD,4,INACTIVE,2025-06-14 11:24:11,2025-05-15 01:38:22
807,SKU1806,Factor Force,Better sit likely item realize foreign any.,467.51,USD,2,ARCHIVED,2025-02-27 23:20:29,2025-03-22 08:28:31
808,SKU1807,Onto Home,Plant anyone thank audience college really throw.,463.16,USD,9,ARCHIVED,2025-06-18 09:42:06,2025-05-29 12:31:26
809,SKU1808,Every Letter,Father take country rather.,228.17,USD,7,INACTIVE,2025-08-22 23:40:04,2025-05-06 11:30:41
810,SKU1809,Floor Political,Bank especially sister break.,61.05,USD,10,ACTIVE,2025-04-03 21:15:59,2025-03-14 21:40:28
811,SKU1810,That All,Tree try other fall month arrive born save.,492.5,USD,10,ACTIVE,2025-05-10 07:35:00,2025-05-09 12:14:34
812,SKU1811,Few Certainly,Hard many tree floor now job serve act.,420.25,USD,10,ARCHIVED,2025-04-22 14:43:08,2025-08-17 12:36:57
813,SKU1812,Or Stop,Conference level institution staff event executive.,66.71,USD,4,ACTIVE,2025-06-11 16:54:19,2025-01-25 21:15:53
814,SKU1813,Responsibility Easy,Soldier foreign according.,460.82,USD,9,INACTIVE,2025-09-03 06:33:08,2025-08-03 18:58:10
815,SKU1814,Change Land,Style meet send last.,435.6,USD,7,ACTIVE,2025-02-19 02:46:36,2025-07-05 22:18:57
816,SKU1815,Use Through,Customer set consumer true consumer million without.,261.82,USD,8,ARCHIVED,2025-07-26 18:15:16,2025-07-09 12:12:43
817,SKU1816,Thousand Firm,Theory resource culture detail when pull push.,297.68,USD,8,INACTIVE,2025-08-01 01:56:23,2025-07-21 02:36:11
818,SKU1817,Remember Interest,Rest on debate.,202.51,USD,5,INACTIVE,2025-08-16 22:49:28,2025-03-02 01:07:59
819,SKU1818,Study Reason,Must set while modern.,32.11,USD,10,ARCHIVED,2025-04-17 23:29:49,2025-02-14 17:14:52
820,SKU1819,While Risk,Guess movie structure employee east.,170.92,USD,7,ACTIVE,2025-07-16 08:24:21,2025-05-31 12:04:32
821,SKU1820,Fund Answer,Benefit share team above.,402.41,USD,5,ARCHIVED,2025-01-15 07:34:40,2025-09-04 06:17:25
822,SKU1821,Defense Different,Traditional particularly common cover rate hope.,7.29,USD,10,ARCHIVED,2025-08-04 10:18:16,2025-05-13 12:15:47
823,SKU1822,Expect Bill,Shoulder live nature item small activity newspaper.,170.08,USD,10,ACTIVE,2025-08-10 02:22:26,2025-07-23 21:00:01
824,SKU1823,Research Star,Cover page huge feeling special allow detail.,202.09,USD,1,INACTIVE,2025-04-26 18:53:47,2025-02-25 20:48:31
825,SKU1824,Difficult Walk,Feel pass character PM company.,271.01,USD,10,ACTIVE,2025-07-28 01:54:20,2025-07-01 14:10:06
826,SKU1825,Feeling Father,Firm area same candidate amount buy.,460.33,USD,2,ACTIVE,2025-08-08 13:34:59,2025-01-31 18:15:03
827,SKU1826,Seat Avoid,Hotel inside sort job white give little.,176.44,USD,4,INACTIVE,2025-03-07 23:24:36,2025-03-28 08:11:17
828,SKU1827,Everything Need,Specific news the hospital.,176.74,USD,4,INACTIVE,2025-04-04 22:40:03,2025-05-30 22:59:04
829,SKU1828,American Quickly,Affect against million interview.,370.06,USD,5,ARCHIVED,2025-02-06 21:33:52,2025-04-26 06:21:48
830,SKU1829,Among Weight,These plant white.,228.85,USD,2,ACTIVE,2025-07-11 04:35:33,2025-01-13 10:57:25
831,SKU1830,Building Us,Reduce land yeah suddenly over movement person.,116.18,USD,3,INACTIVE,2025-08-13 09:56:44,2025-07-24 03:45:50
832,SKU1831,Opportunity Reach,Between yard fine will nothing.,228.96,USD,4,ACTIVE,2025-04-30 22:38:06,2025-02-13 15:38:44
833,SKU1832,On Follow,Friend teach lose process direction adult base middle.,74.72,USD,3,ACTIVE,2025-07-14 06:03:35,2025-04-07 10:36:31
834,SKU1833,Improve Enter,Meeting fear past local two our car.,92.31,USD,9,INACTIVE,2025-07-16 16:28:09,2025-04-08 00:57:46
835,SKU1834,Data Away,Better become program reach win system.,251.69,USD,2,INACTIVE,2025-04-28 22:29:41,2025-04-25 03:43:28
836,SKU1835,Huge Feeling,Parent these worry it all scene pattern.,212.37,USD,3,ACTIVE,2025-07-06 14:01:08,2025-01-03 16:16:23
837,SKU1836,Detail Quality,Use check beyond sell up smile.,457.85,USD,1,INACTIVE,2025-06-07 11:07:38,2025-06-25 09:08:53
838,SKU1837,Word Sure,So cold run prove allow father agent.,184.38,USD,7,ACTIVE,2025-09-03 03:14:09,2025-04-04 06:16:50
839,SKU1838,Audience Office,Market minute decade military history.,292.39,USD,8,INACTIVE,2025-04-03 05:40:06,2025-07-17 01:01:51
840,SKU1839,Address Professional,For heart term community authority situation.,317.97,USD,10,ARCHIVED,2025-06-25 07:26:09,2025-07-23 04:54:53
841,SKU1840,Newspaper Enter,Main after fast care.,11.48,USD,8,INACTIVE,2025-05-29 18:40:45,2025-08-04 23:18:33
842,SKU1841,Claim Store,Sing push father.,333.45,USD,5,ACTIVE,2025-04-29 03:19:11,2025-02-15 07:17:57
843,SKU1842,Board Gun,History figure argue safe.,93.13,USD,1,INACTIVE,2025-02-22 14:13:34,2025-05-17 12:06:31
844,SKU1843,Treatment These,Place open view imagine fill.,480.73,USD,4,ACTIVE,2025-03-03 17:25:39,2025-01-06 18:55:04
