review_id,product_id,user_id,rating,comment,created_at
1,182,434,3,Nothing leg close.,2025-03-21 06:36:28
2,988,310,5,Usually spend push material care past popular.,2025-03-02 14:52:25
3,408,241,5,Sell power loss hundred.,2025-02-08 16:27:10
4,992,365,2,Usually enough movie officer important.,2025-02-22 17:17:35
5,327,333,2,Alone clear hospital effect.,2025-03-29 04:40:46
6,299,192,4,Ever seven own.,2025-06-17 12:40:12
7,753,95,3,Son should more affect must performance economic north.,2025-05-03 05:45:07
8,712,437,5,Cover east wrong challenge best.,2025-01-03 04:25:31
9,649,199,3,Suffer indeed suddenly.,2025-02-24 18:25:01
10,503,252,3,Poor trouble recently its note.,2025-05-25 03:02:30
11,991,243,3,Would little him former with piece visit.,2025-03-10 20:53:00
12,590,71,1,Also personal soon wide question customer word.,2025-09-01 17:06:06
13,801,84,5,Process last example manager question.,2025-01-09 02:37:40
14,249,99,5,Travel manage father church.,2025-03-24 16:46:49
15,334,116,2,Forward little American go perhaps senior.,2025-07-27 15:11:58
16,386,17,1,Lose perform her least.,2025-08-14 18:54:20
17,288,210,2,Live focus benefit price available.,2025-09-02 01:22:53
18,837,392,5,Food although pattern door state.,2025-05-12 12:51:28
19,805,497,5,Should seek seat eight.,2025-03-05 12:56:15
20,403,8,1,On speech table here.,2025-02-13 17:19:43
21,374,474,4,Shoulder edge interview.,2025-08-11 14:38:00
22,117,139,3,National reach relationship place just crime.,2025-01-23 07:29:54
23,955,487,2,Defense including main order rich.,2025-02-12 12:33:43
24,578,212,2,School necessary letter final let.,2025-07-28 11:40:48
25,205,114,2,Major us happy read.,2025-02-09 11:52:22
26,607,381,1,Heavy between teach start or field.,2025-03-13 01:14:00
27,559,344,3,Property cost finish fight station may surface.,2025-09-06 12:18:23
28,185,104,2,Yeah pressure near.,2025-03-14 10:40:58
29,699,388,4,Ability reason interest name rate it.,2025-08-11 04:41:10
30,787,105,4,Act view glass admit weight.,2025-03-22 13:25:28
31,564,34,5,East star about charge help.,2025-01-11 13:17:12
32,28,91,3,Matter return central myself serious.,2025-06-19 03:25:17
33,976,475,5,Deep radio tend news ready bar someone.,2025-01-11 02:42:21
34,745,489,5,Movement picture statement meeting.,2025-06-09 03:51:59
35,473,225,3,Thank skill many day out involve along.,2025-02-21 21:38:22
36,966,444,5,Choice although three.,2025-06-27 09:14:15
37,726,316,3,Moment fire out final into.,2025-03-10 22:14:36
38,215,251,4,Maintain Republican system argue.,2025-06-19 11:12:56
39,449,353,3,As different production such sometimes.,2025-02-14 15:38:23
40,817,167,2,Receive weight pass figure property hair water your.,2025-07-28 06:49:08
41,299,444,1,Whom challenge year town talk arrive under.,2025-01-25 22:49:27
42,852,235,4,When lay discussion base rest fall character.,2025-02-21 16:05:49
43,710,455,1,Like management difficult recently color himself brother beyond.,2025-03-06 13:27:23
44,71,127,4,Politics court step provide weight people moment enter.,2025-04-13 12:41:53
45,839,219,2,Measure look movement.,2025-08-21 17:54:34
46,869,208,1,Meeting reach too.,2025-07-27 17:46:23
47,815,398,2,Plan most seem then so because left.,2025-06-27 01:00:04
48,815,22,2,From across beat civil.,2025-08-25 17:01:35
49,419,312,4,Treat executive thought recent couple understand.,2025-05-20 19:04:56
50,690,377,5,Great candidate class join project air.,2025-06-15 08:25:34
51,512,423,2,Building structure guy down.,2025-03-11 12:22:58
52,143,195,2,Or should fear style believe bill consider.,2025-07-06 10:44:45
53,649,369,4,Pretty always computer ok analysis actually begin.,2025-05-01 21:20:37
54,311,161,3,Happen certain model general teacher visit leader.,2025-08-09 09:32:17
55,248,202,4,Win every party push check hot.,2025-02-23 22:57:25
56,259,314,2,Trial it force recent run.,2025-03-15 08:59:47
57,675,481,4,Someone sister administration ball note career exist there.,2025-01-31 23:50:37
58,158,381,2,Item particularly oil century.,2025-05-31 11:02:34
59,733,293,1,Moment PM war.,2025-06-17 16:23:43
60,434,305,3,Decision sort reason mention message media task action.,2025-03-22 01:48:14
61,809,275,1,Number none white machine mind idea most within.,2025-05-05 15:50:39
62,387,269,1,Source rock effect.,2025-06-07 10:00:42
63,76,329,3,Behavior likely hospital company without next term.,2025-06-15 16:33:22
64,460,449,1,Notice rather sea key gun country.,2025-07-19 02:21:06
65,613,361,5,Drive discuss thus gun during career.,2025-06-30 16:38:24
66,491,403,1,Behavior reveal occur likely leave.,2025-06-14 19:57:55
67,597,20,2,Respond reveal check history.,2025-07-08 01:07:44
68,411,267,3,Around series fast pretty.,2025-03-13 09:07:18
69,548,56,4,Write front any campaign too national financial.,2025-03-26 11:50:42
70,519,232,2,As stand baby hope enter.,2025-01-07 23:57:03
71,946,234,5,Foreign red while group husband serious.,2025-05-15 16:56:11
72,943,424,3,Wall low along some relate.,2025-06-26 06:43:01
73,891,450,1,Soldier central decide personal former affect involve.,2025-02-15 05:44:43
74,709,22,1,Police design individual above everyone.,2025-05-12 23:10:41
75,429,450,2,Student manage magazine night.,2025-04-20 15:25:15
76,557,126,2,All somebody between west.,2025-03-19 19:52:40
77,38,266,3,Rest suggest one school control wide.,2025-06-28 17:12:40
78,810,276,2,Source service mind its buy.,2025-04-05 10:50:20
79,992,203,2,Republican get Mr relate.,2025-06-17 11:31:45
80,369,377,3,Technology tree common guy somebody yard different.,2025-07-19 00:20:17
81,719,21,2,Why federal part forget.,2025-06-13 01:17:01
82,917,286,3,Better material fact their.,2025-04-19 16:52:31
83,832,199,5,Write use break especially.,2025-06-09 01:13:44
84,550,265,2,Either white others there marriage focus record.,2025-06-23 14:29:21
85,609,392,2,With citizen same especially structure simple.,2025-05-15 05:53:12
86,654,323,2,Give between center right every.,2025-02-27 16:24:26
87,937,493,1,Fear loss worry.,2025-07-09 06:00:02
88,88,26,2,Natural four too fact poor score keep.,2025-04-09 19:43:12
89,112,98,3,Region college condition my chair.,2025-05-09 09:30:21
90,788,150,1,Once better teach not.,2025-06-16 03:44:27
91,255,226,1,Feel rate effect also.,2025-02-13 00:38:21
92,674,204,2,Should theory already long.,2025-03-05 16:59:35
93,681,453,4,See mind upon improve billion final speech.,2025-02-02 01:40:35
94,364,156,1,Spring already Democrat final never fish.,2025-02-19 10:26:43
95,171,397,3,Include traditional light ground floor station.,2025-03-29 19:14:56
96,663,424,2,Study positive white catch where audience feeling.,2025-03-04 01:56:35
97,628,147,3,Would learn score smile.,2025-03-10 16:02:49
98,46,237,4,Build within manage choice television offer.,2025-03-03 09:15:17
99,577,86,2,Stop program social more fund race.,2025-05-20 18:00:11
100,661,217,3,Poor share light.,2025-04-11 01:10:05
101,694,151,3,Wrong work use fund.,2025-04-28 17:57:06
102,663,314,2,Wide item image member.,2025-05-26 20:46:00
103,410,471,5,And each me reduce inside one.,2025-01-02 21:41:26
104,991,28,5,Hard discover far within relate throughout condition.,2025-05-05 02:01:22
105,771,354,4,Crime scientist traditional speak.,2025-05-24 20:46:46
106,340,265,1,Article interesting reveal director about local.,2025-04-10 19:05:32
107,989,463,1,Ahead read beat good laugh impact recently.,2025-03-29 06:08:59
108,816,73,2,Inside sign life smile particularly.,2025-03-12 12:57:13
109,441,238,2,Media author determine might work marriage rise moment.,2025-08-23 21:51:44
110,109,425,2,Him lead loss fear discover hand.,2025-02-25 10:39:32
111,11,331,2,Authority two far list term at.,2025-04-18 00:36:52
112,101,232,5,Above most true attention exactly language itself now.,2025-06-21 09:13:54
113,265,47,4,Box provide pressure ask cup morning green.,2025-04-17 20:02:12
114,228,370,3,Design left visit treatment pass.,2025-01-23 01:17:42
115,523,257,3,Forward focus area head cup mother dream.,2025-03-21 09:01:36
116,765,58,5,Situation up call he thousand.,2025-06-07 19:09:04
117,532,93,4,Hair down beat majority manage point.,2025-07-25 17:52:12
118,572,399,2,Anyone morning throughout make coach finish.,2025-03-06 13:31:21
119,595,300,1,Energy response now research mother agency college.,2025-03-14 11:13:05
120,705,481,5,Most strong control southern certainly.,2025-08-09 05:20:16
121,590,458,5,Expert summer until decade.,2025-03-30 04:33:35
122,227,357,2,Economy water single western fast newspaper.,2025-04-07 20:47:10
123,457,280,5,Mind remain man offer bed boy or.,2025-02-28 16:45:16
124,384,70,3,Dream ago my do into go beyond.,2025-01-17 23:40:23
125,401,202,2,Total word public many resource contain chance.,2025-04-04 04:53:18
126,475,212,3,Book mind page this bill part six.,2025-03-02 22:49:07
127,791,166,2,Discussion send add exactly.,2025-08-18 07:02:22
128,696,231,1,Class around to help mission issue thus.,2025-08-30 22:48:22
129,603,13,3,Huge a teach daughter part street tree.,2025-06-27 13:34:24
130,708,92,2,Yeah with will movement them practice Republican.,2025-01-13 23:26:09
131,513,233,5,You hand though weight international child tell.,2025-06-04 12:08:21
132,155,303,5,Walk around stop one next seem threat.,2025-08-07 13:49:32
133,354,460,4,Fear add begin thus attorney.,2025-03-24 09:07:59
134,26,365,2,Treat wonder discuss must science almost.,2025-08-10 10:58:08
135,495,459,1,Something though magazine medical see fast heavy.,2025-07-22 09:25:24
136,108,104,4,Entire wear style government reality doctor.,2025-08-09 06:49:09
137,303,452,5,Cup Mr so risk.,2025-01-02 20:11:21
138,426,233,1,Yet its enter share.,2025-02-20 17:07:09
139,943,47,2,Shake scientist that reason.,2025-01-02 02:13:45
140,985,129,5,Myself rock commercial huge try dinner total scientist.,2025-03-17 16:27:38
141,88,166,4,Window than blood focus rest.,2025-07-10 00:21:38
142,119,355,5,See to officer building training past I.,2025-04-03 03:27:12
143,852,333,3,Food morning practice interest national campaign.,2025-01-22 14:11:26
144,964,465,4,Whether if as.,2025-07-26 22:14:32
145,748,365,5,Number dream involve event nice.,2025-08-28 13:44:08
146,146,408,4,Control like cup fine else education culture.,2025-06-22 18:49:33
147,357,84,2,Often time explain on deal.,2025-01-26 11:09:08
148,320,368,3,See hard agree way senior.,2025-08-23 09:20:24
149,352,376,3,Act however about modern mind.,2025-02-19 18:24:46
150,467,64,5,Suffer difficult religious paper.,2025-05-16 08:12:39
151,804,47,4,Quality collection exist on fall.,2025-07-24 08:32:04
152,212,59,4,Baby cause quickly quite particular security.,2025-01-02 03:28:24
153,534,362,4,Agency church consider.,2025-05-02 19:34:17
154,495,231,3,Only weight wide authority attack including month.,2025-09-04 20:51:54
155,357,325,5,Far seven because claim political.,2025-05-17 06:48:25
156,488,186,4,Real win ahead through machine hard shoulder job.,2025-01-03 03:26:37
157,100,44,5,Possible image near could matter customer know.,2025-02-05 05:56:32
158,449,269,1,Save institution number occur practice.,2025-07-26 16:02:44
159,740,363,2,Experience success candidate down pick play.,2025-01-16 21:40:00
160,714,197,2,Tree general statement treatment wonder good technology.,2025-03-21 13:53:11
161,464,373,2,Way find them student prepare.,2025-04-13 09:14:31
162,327,406,4,Whether I interview.,2025-06-21 03:13:10
163,69,500,2,Moment situation beyond mean really bed option.,2025-01-24 16:46:33
164,308,262,4,Tend herself record public.,2025-05-03 20:23:17
165,46,314,2,Course everyone collection finish month.,2025-06-09 15:02:54
166,830,487,3,Five tough field teach natural.,2025-07-31 09:41:30
167,728,82,4,Position check begin world success star computer.,2025-03-16 22:49:49
168,118,194,4,Mission science point.,2025-01-29 00:25:53
169,24,282,5,Car they computer green while.,2025-06-27 20:43:03
170,870,195,2,Yet service born pass.,2025-07-29 03:20:53
171,352,23,3,Our truth page either.,2025-01-28 02:14:51
172,664,394,3,Throw get now data enter fish decide resource.,2025-02-22 13:57:34
173,112,88,5,Evening resource be.,2025-08-23 18:10:28
174,694,468,1,Night customer common down collection wait attention.,2025-03-18 11:38:06
175,820,172,2,Position four body result foot.,2025-04-10 05:39:59
176,169,290,1,Them site assume watch.,2025-07-14 16:57:42
177,953,447,3,Apply put practice hospital enjoy house.,2025-07-07 17:09:11
178,759,338,4,Music structure down meet idea.,2025-03-26 07:44:25
179,250,442,5,Actually lot ten decade chance contain computer.,2025-04-27 14:22:50
180,529,77,3,As sense teacher natural.,2025-02-17 22:47:12
181,179,84,2,Style actually quite information hour growth far wonder.,2025-01-21 05:45:54
182,566,445,5,Why career peace material.,2025-04-16 07:05:36
183,164,75,1,Lot writer effort military them Mrs.,2025-03-07 07:58:03
184,339,92,4,Stuff large all available.,2025-07-11 11:30:31
185,574,394,5,Music Congress man position.,2025-06-26 12:29:10
186,437,365,5,We suggest mission turn anyone paper.,2025-05-07 20:20:08
187,982,27,3,Character we from let real.,2025-08-07 00:48:35
188,474,215,4,Ahead agree beat pay.,2025-07-11 23:30:43
189,238,158,4,At herself bring share student call.,2025-02-25 07:35:38
190,817,159,4,Though blood trouble hotel can go.,2025-05-03 22:15:20
191,415,374,4,Travel admit only woman.,2025-05-18 06:01:35
192,645,394,4,Such true challenge let at after generation.,2025-08-28 15:49:23
193,189,493,3,Through however sea avoid.,2025-04-29 02:25:30
194,191,229,4,Sure morning behind take head.,2025-09-04 21:02:47
195,656,148,3,Center research after box nothing.,2025-05-25 02:40:07
196,674,321,3,Kitchen wall meet church local might animal.,2025-04-12 04:03:52
197,443,93,4,Happen rule partner investment she past now magazine.,2025-08-21 12:31:41
198,406,61,1,Wear direction message grow trip.,2025-04-23 23:57:30
199,30,461,2,And discuss it.,2025-02-28 20:14:52
200,756,68,4,Share eye writer thing choice follow.,2025-07-09 08:22:13
201,629,492,2,Member eat result mission analysis current save light.,2025-01-23 02:49:26
202,905,104,3,Probably entire least trouble which.,2025-07-26 10:25:25
203,203,2,1,Where kitchen after say.,2025-06-16 09:32:47
204,461,319,3,Concern office moment father.,2025-02-19 08:04:48
205,607,392,1,Bill better such board forget view attorney.,2025-02-15 07:04:26
206,440,130,3,Able still upon care get paper stop.,2025-01-11 00:20:48
207,399,7,5,Group season you blood.,2025-09-07 07:34:34
208,5,235,5,Operation statement affect radio material since strategy thought.,2025-01-27 21:23:24
209,722,255,5,Lawyer mind book.,2025-02-18 14:06:19
210,220,438,1,Season policy keep over.,2025-08-07 19:21:24
211,211,256,3,Politics ready drop firm represent free.,2025-04-13 05:41:18
212,286,279,2,Professional energy partner television full but this.,2025-04-22 07:29:50
213,771,414,1,Office citizen company sense.,2025-04-05 10:52:02
214,721,3,1,Together performance must.,2025-05-28 01:30:52
215,829,312,1,Finish price wonder.,2025-08-01 06:40:58
216,816,452,3,Get factor anything reveal live how manager.,2025-05-27 14:01:44
217,65,253,1,Physical study real however.,2025-07-19 01:20:04
218,592,122,5,Development check including list maybe ago.,2025-02-17 23:37:28
219,105,112,2,Commercial painting civil.,2025-04-15 22:39:32
220,819,302,3,Current for hair.,2025-02-08 08:20:15
221,893,338,2,Industry she office feeling else to today.,2025-07-28 11:48:39
222,550,244,3,Throw force agree Congress information.,2025-06-10 16:26:04
223,192,233,3,Leg determine teacher staff something.,2025-02-22 00:43:32
224,375,210,3,Whatever tax any teacher too figure.,2025-02-15 16:14:27
225,334,227,3,Ok spend hot use four some century.,2025-08-18 19:53:57
226,202,41,2,Republican wall season upon agree.,2025-08-16 15:50:00
227,469,308,5,Country whose ask phone.,2025-05-19 13:12:15
228,117,308,2,Help finish do final share season forget.,2025-02-10 02:14:17
229,269,4,5,Ready body although evening end.,2025-06-16 04:05:32
230,687,126,3,Sound car forward outside when building city wish.,2025-04-18 08:33:09
231,884,452,1,Outside when avoid food list shoulder address house.,2025-07-07 08:04:23
232,502,281,3,Event between behind send rule.,2025-04-02 08:24:52
233,541,143,3,Wife believe human.,2025-01-25 16:57:47
234,990,318,3,Street response research recognize game would hold.,2025-01-03 19:10:15
235,655,322,4,Sense suddenly somebody order.,2025-05-03 14:12:39
236,321,286,4,Discuss memory likely which day this research address.,2025-02-06 16:07:56
237,612,420,5,Hundred left cup there task war any page.,2025-07-17 15:52:46
238,398,423,1,Available project what watch I collection news.,2025-03-05 16:22:46
239,626,107,4,Whatever or admit east.,2025-01-26 15:11:28
240,402,26,5,Moment truth no get foreign.,2025-03-28 06:11:19
241,602,95,2,Fish else hundred.,2025-01-04 09:26:31
242,117,76,4,Floor life indicate source know will ready.,2025-06-22 14:47:25
243,357,29,2,Sound ahead main sister similar.,2025-06-23 22:22:00
244,361,335,2,Effort inside approach which whether improve word economy.,2025-02-09 20:41:45
245,866,179,2,Hot degree issue available.,2025-08-23 10:11:11
246,469,19,4,Range point hold offer shoulder without apply.,2025-06-03 07:07:00
247,633,75,2,At with good stock.,2025-02-06 11:29:55
248,177,438,5,Tough question support treat this.,2025-07-17 10:34:19
249,834,17,5,Health him try owner language key.,2025-03-09 06:08:45
250,690,342,5,Whole spring involve number sound sport.,2025-05-06 23:09:30
251,723,296,4,Agent serious campaign year.,2025-03-06 11:42:41
252,820,430,4,As ahead choose still media movie tend themselves.,2025-08-18 00:01:32
253,305,309,3,Its his catch whole public author study.,2025-08-09 05:12:51
254,941,153,1,Until whom class in present.,2025-05-23 10:21:14
255,630,170,3,Skin close plan past require to step.,2025-07-16 11:40:50
256,605,472,2,Teacher article especially town always day night.,2025-02-18 09:09:38
257,87,45,4,Hard also though red knowledge song reality.,2025-08-06 01:53:27
258,689,26,4,Will chance admit road whatever growth.,2025-05-26 10:59:46
259,138,56,2,Available new senior college despite kind.,2025-08-10 22:10:03
260,321,214,4,Late billion open policy player Mrs.,2025-04-07 23:49:18
261,121,92,4,Light coach itself drop hundred.,2025-01-18 19:43:26
262,245,83,5,Sound face energy care.,2025-06-15 15:38:57
263,313,345,1,Write effect weight oil military way.,2025-04-11 06:54:59
264,120,146,3,Chair authority certain including anyone old.,2025-06-14 08:40:29
265,188,313,2,Modern born none up year bring PM.,2025-04-21 06:23:01
266,383,339,5,Fish fear north attention look yeah.,2025-02-09 17:52:38
267,711,355,2,Tend my gun six reduce.,2025-03-09 11:33:17
268,145,359,3,Improve near pressure value mind.,2025-07-28 20:09:21
269,524,305,1,Might anyone receive enough view strategy.,2025-08-22 15:18:26
270,398,294,4,Modern worry certainly born quickly.,2025-08-25 02:36:23
271,429,404,3,Door specific shoulder window cost daughter according.,2025-04-06 22:04:16
272,611,288,3,Add pass explain likely successful study industry.,2025-07-11 14:47:29
273,142,91,2,Yet culture buy.,2025-04-18 05:59:33
274,589,495,4,Little range soldier adult kitchen final.,2025-08-31 17:53:04
275,393,234,4,Space show town the.,2025-06-09 02:05:07
276,434,384,4,Size vote democratic join information.,2025-08-01 02:14:09
277,191,297,5,Indicate something several near.,2025-01-13 00:41:55
278,499,185,3,Population factor up order of during newspaper.,2025-04-14 17:39:31
279,651,477,3,Fine painting family PM rather interesting manager crime.,2025-02-08 21:08:50
280,551,19,5,Property detail bill fly.,2025-07-30 05:02:34
281,711,48,1,Matter worry capital impact thought standard.,2025-08-11 05:31:08
282,942,394,5,Data big reveal full.,2025-06-29 07:58:49
283,661,154,1,Step begin dog fish raise thousand help.,2025-05-09 02:09:28
284,954,166,2,Anyone through wide mouth account magazine simple hundred.,2025-02-21 10:36:46
285,178,189,2,Last those well necessary bar official behavior.,2025-08-04 16:47:01
286,569,460,3,Life back plant story heavy TV data.,2025-08-17 01:47:37
287,171,195,5,Interview image doctor staff go throw hair face.,2025-08-31 10:34:02
288,502,420,5,Energy try whose cup.,2025-03-24 12:44:55
289,296,35,5,Fight then risk various tax all sister.,2025-04-29 20:19:51
290,144,389,5,Actually security Mrs color the build future.,2025-03-04 06:06:50
291,192,219,4,Detail thousand why others.,2025-07-03 02:06:47
292,323,432,4,Role turn popular push.,2025-06-30 18:04:36
293,863,282,2,Method detail yourself form Congress.,2025-08-02 18:28:48
294,462,34,4,Represent right though agree feeling almost.,2025-08-04 16:57:12
295,635,150,1,Staff would participant there anything.,2025-05-14 17:20:51
296,55,242,5,Road catch factor show watch bill activity.,2025-06-27 09:29:43
297,887,69,4,Able leg control push ask lawyer.,2025-08-26 00:26:30
298,368,63,2,Spend seem tough affect study watch.,2025-09-03 16:52:20
299,975,356,4,Meeting home national individual plan least onto art.,2025-02-06 18:30:00
300,10,441,1,But research hour decision case he fast.,2025-03-17 14:52:52
301,497,141,3,Travel oil read difference movement.,2025-07-15 05:58:39
302,140,169,5,Space keep college together sell from necessary.,2025-08-21 01:54:44
303,200,270,4,Along state when well cultural that always people.,2025-01-25 13:26:13
304,835,212,3,Professional hit sing perhaps stock prevent.,2025-03-21 04:13:20
305,394,269,1,Including physical per page police among.,2025-06-09 16:29:17
306,987,108,2,Crime know deal democratic himself.,2025-06-05 18:31:23
307,576,357,1,So not determine order.,2025-03-15 18:40:46
308,518,108,5,Last capital threat stand market professor shoulder quite.,2025-07-25 21:11:08
309,669,314,2,Follow bill knowledge brother enough old.,2025-08-09 10:48:28
310,507,30,1,Focus behind many she.,2025-08-01 01:19:50
311,419,56,5,Energy whom day result go girl mission near.,2025-06-17 09:50:52
312,702,293,4,Bag difficult sit own environment who.,2025-05-15 01:41:48
313,504,374,1,Trial game human major.,2025-01-27 19:37:41
314,426,323,2,More effect risk yes clearly soon fast.,2025-07-24 02:24:46
315,728,271,2,Prove hospital say.,2025-04-08 06:24:42
316,861,45,1,Number democratic week dark significant popular scientist.,2025-03-16 15:22:24
317,455,248,4,Focus most culture back several.,2025-05-20 07:25:17
318,501,371,3,Authority tree stock particular sell human.,2025-06-17 08:51:25
319,172,353,2,Someone write east.,2025-07-25 15:06:22
320,85,310,2,Benefit chair sport four statement each light thing.,2025-01-28 03:40:56
321,579,479,3,Type fight deep service financial.,2025-06-05 20:10:21
322,32,404,5,Blue hand continue major on car.,2025-02-15 05:51:55
323,815,362,1,Adult decide reality big site rise.,2025-08-26 15:01:10
324,780,148,4,Standard doctor bed loss program truth card.,2025-02-05 19:55:04
325,226,219,1,Partner campaign design.,2025-09-07 06:20:50
326,300,312,3,Pressure treatment become present address very ahead we.,2025-08-25 00:16:17
327,34,435,5,Receive focus car would find goal.,2025-05-29 08:30:50
328,282,163,1,Executive according result none whose city during.,2025-01-02 11:34:12
329,231,133,2,Part laugh research city inside place line perhaps.,2025-03-21 09:10:48
330,551,270,3,Important have become happen as anyone.,2025-08-21 07:58:32
331,296,295,4,Personal finish commercial give.,2025-08-03 09:28:52
332,173,320,4,Member particular score police nearly network him.,2025-05-20 19:40:06
333,800,182,2,East fly adult.,2025-07-06 02:11:40
334,469,475,1,Result what decade personal finish thought turn with.,2025-02-24 02:33:30
335,580,67,2,Man tough draw speech suffer answer.,2025-05-06 00:01:45
336,761,315,5,Away student oil member represent food something.,2025-08-12 10:03:39
337,792,289,4,Today law financial state.,2025-01-21 11:44:37
338,785,255,4,Conference trip say increase because edge effect.,2025-08-20 09:14:25
339,508,267,1,Manage politics little ability.,2025-08-31 19:10:41
340,563,374,4,Wrong road same particularly.,2025-01-05 21:07:28
341,524,324,2,Laugh rock television yes assume success.,2025-02-24 01:35:57
342,116,255,2,Visit buy partner coach pressure process well.,2025-08-20 20:15:19
343,587,253,2,Customer program range rather Republican point blood budget.,2025-01-18 02:34:21
344,117,414,3,Relate control attorney their decide draw.,2025-08-13 23:38:00
345,275,93,4,Game prove us candidate live work statement guy.,2025-07-16 16:10:06
346,794,453,4,Report free concern follow.,2025-08-22 09:05:54
347,557,313,2,Enter teach TV she wear authority.,2025-07-28 00:44:37
348,844,120,5,Pm speech bad.,2025-03-23 03:47:43
349,376,363,5,Mean happy put wind fact watch significant.,2025-01-03 07:58:14
350,556,149,3,Imagine list leave who help foot generation.,2025-04-21 04:28:41
351,843,100,5,Guess possible security very his.,2025-05-22 18:04:30
352,775,1,2,Although later enough available himself.,2025-03-17 08:16:10
353,43,61,5,Decide four explain budget approach only anyone.,2025-02-20 04:36:25
354,779,13,4,Area bank deep American body nature.,2025-08-19 09:20:02
355,737,239,3,Radio music young nothing large boy size account.,2025-03-25 13:46:08
356,452,321,2,Grow read daughter skin political choice.,2025-04-24 19:48:37
357,560,408,1,Myself answer voice daughter serious whether.,2025-02-04 05:16:18
358,224,61,2,Involve ground information budget first what.,2025-06-01 00:54:54
359,436,378,4,Training price light meeting theory once different.,2025-01-14 22:24:12
360,105,435,1,Reveal bank able affect home theory.,2025-02-21 06:42:50
361,754,107,4,Last local story surface provide seem.,2025-03-14 03:08:33
362,850,410,5,Floor evening market same.,2025-07-15 06:48:28
363,670,316,2,Him thousand now several really off west knowledge.,2025-04-28 11:14:54
364,770,213,5,Set somebody letter community.,2025-07-07 06:55:34
365,254,212,3,Particularly seven give tough.,2025-04-05 12:24:02
366,305,24,5,Hold inside start front service.,2025-05-26 11:31:55
