review_id,product_id,user_id,rating,comment,created_at
3624,110,219,3,Experience yes born by become Democrat have.,2025-01-27 05:11:49
3625,573,48,3,Send economy usually describe between mind.,2025-02-26 13:36:51
3626,75,21,1,Personal seem peace foreign cut onto.,2025-06-02 22:20:38
3627,516,263,1,Ground mouth own.,2025-03-02 03:25:20
3628,302,175,4,Beat study board audience member magazine continue.,2025-02-18 10:59:39
3629,349,499,4,Do community bring popular agree main political if.,2025-06-23 16:59:51
3630,970,238,5,Help attention science.,2025-07-14 11:51:28
3631,120,347,2,Now finish world wall.,2025-03-28 02:19:40
3632,823,115,5,Worker father sign nearly anything kind southern produce.,2025-03-22 19:44:17
3633,526,332,4,Poor cell large shoulder history sound product price.,2025-01-12 22:20:34
3634,980,352,2,Fast relate exist federal instead.,2025-02-21 10:24:46
3635,264,366,2,Particularly herself sport information side film rate rather.,2025-08-24 13:13:25
3636,898,80,4,Fly itself officer especially cup.,2025-07-10 06:47:09
3637,551,477,1,Issue list teacher address instead.,2025-06-28 06:04:11
3638,833,254,2,Popular game pull before.,2025-06-24 05:04:39
3639,813,270,1,Weight my nearly wrong actually will.,2025-06-23 18:48:21
3640,589,323,4,Feeling politics loss.,2025-09-06 17:53:29
3641,257,332,3,Wall ago until spring weight.,2025-08-05 02:38:40
3642,711,269,5,Suffer laugh card similar fund receive.,2025-07-31 21:08:22
3643,454,43,4,Add speak subject toward up end firm think.,2025-06-11 21:17:20
3644,990,149,1,Require north audience life.,2025-05-13 02:52:31
3645,387,240,2,Sister listen member finally head surface.,2025-05-20 20:27:09
3646,577,224,1,Skill discover six administration.,2025-06-12 01:32:05
3647,496,41,4,Not garden political bag animal situation fly record.,2025-05-01 08:32:51
3648,789,465,1,Test reflect writer relate day air organization.,2025-01-17 19:40:21
3649,250,411,2,Community usually garden player vote mind.,2025-05-09 07:32:08
3650,776,245,1,Student ability college nothing father concern.,2025-05-04 14:55:58
3651,348,154,2,Issue race evening effort western never alone career.,2025-08-11 01:28:15
3652,985,77,5,Arm town anyone economic bank course surface.,2025-06-21 10:19:35
3653,795,66,5,About report and agent pressure.,2025-03-14 11:03:52
3654,470,351,4,Close story direction box article central do.,2025-04-05 06:10:41
3655,698,463,4,Almost later ago personal game.,2025-04-18 18:43:54
3656,472,154,3,Trade threat meet least although able.,2025-07-07 09:00:33
3657,919,431,2,How here accept.,2025-05-25 04:18:42
3658,601,128,4,Discover cell she memory reduce.,2025-05-17 10:15:16
3659,883,268,5,Wall face offer respond think.,2025-01-04 05:06:45
3660,29,219,2,Mother risk finally parent pass safe traditional.,2025-02-08 03:53:42
3661,494,152,3,Year light glass goal.,2025-06-09 13:09:08
3662,120,292,1,Sure happen player degree somebody loss hospital.,2025-01-09 06:45:11
3663,265,25,3,President travel state occur fact begin.,2025-02-11 02:12:19
3664,70,283,3,Moment near region onto old then attention.,2025-02-22 20:13:37
3665,392,40,5,Never statement north story bill strong thank.,2025-04-17 13:36:44
3666,649,470,5,Rest perhaps commercial north oil foreign school.,2025-09-03 01:17:38
3667,808,24,5,We officer minute direction blue law listen.,2025-08-13 05:02:24
3668,226,263,1,Effect any white size.,2025-05-13 00:14:38
3669,694,56,1,Worker job course measure production rise.,2025-02-07 10:36:51
3670,719,262,1,Open let enter growth.,2025-04-15 21:09:01
3671,236,218,3,Truth seven design long voice.,2025-08-04 17:02:37
3672,820,212,4,Fire performance my effort.,2025-08-22 18:00:18
3673,324,49,4,Pull area second side.,2025-08-12 13:54:44
3674,423,238,4,Computer consider age also win realize.,2025-07-02 18:53:36
3675,979,339,4,Laugh me skin them there society field.,2025-01-16 03:54:57
3676,362,369,3,Reach ok itself focus system.,2025-05-28 16:41:48
3677,529,292,4,Gun trip evidence describe.,2025-02-26 11:40:26
3678,549,417,2,Easy science provide our may small.,2025-08-16 22:38:36
3679,10,130,2,Just receive car star.,2025-02-14 13:08:59
3680,718,182,5,Happen eye west will.,2025-04-28 16:42:31
3681,853,131,5,Thought window play participant.,2025-05-08 07:28:10
3682,270,300,1,Take see present about.,2025-04-20 18:56:58
3683,255,42,2,Else down structure charge.,2025-08-16 16:29:47
3684,295,394,1,Participant daughter eat open kind discover all.,2025-03-23 08:21:28
3685,96,258,5,Seat compare cause.,2025-04-14 07:40:45
3686,409,9,5,Trial look trade mission herself.,2025-08-25 01:38:20
3687,690,59,3,Buy present traditional significant however loss customer.,2025-05-04 20:42:23
3688,767,380,4,Teacher new front morning letter can country.,2025-04-06 18:25:29
3689,841,339,4,Husband approach radio.,2025-01-31 17:52:27
3690,351,237,3,Above be ago between case again heavy.,2025-08-12 11:52:30
3691,78,92,4,Check people body general.,2025-08-12 18:31:27
3692,568,403,2,See enough sell full.,2025-08-15 19:54:03
3693,954,94,5,Carry watch consider go treatment start exist.,2025-03-09 20:59:49
3694,183,432,5,Let push nature open student place develop.,2025-08-15 22:25:31
3695,488,202,3,As serve new whole television.,2025-06-07 14:30:45
3696,322,24,1,Project trouble probably Mr show.,2025-01-29 21:46:22
3697,363,43,2,Vote ago factor stock stuff must.,2025-07-11 08:26:36
3698,224,214,3,Board writer data education understand million night.,2025-07-20 01:38:55
3699,916,449,4,Method position choose.,2025-03-31 19:47:13
3700,588,361,3,Today paper finally everything.,2025-06-11 21:34:45
3701,276,153,1,Dinner begin never huge.,2025-04-18 23:35:12
3702,188,161,5,Federal also doctor community better large.,2025-08-31 21:36:59
3703,970,301,5,Chance my consumer us.,2025-02-03 06:08:32
3704,765,371,5,Community throw during view market.,2025-02-19 03:57:04
3705,700,233,5,Seven history international.,2025-08-06 02:37:11
3706,953,388,5,All dog large some.,2025-06-13 18:14:35
3707,932,344,4,Sure feeling stage someone under identify.,2025-02-25 14:40:19
3708,195,231,3,Him reason gun consider magazine movement.,2025-08-03 14:32:01
3709,511,320,3,Increase head bag live toward certain.,2025-08-14 16:28:39
3710,755,414,4,Four eye beat center.,2025-02-19 16:07:13
3711,205,136,3,Federal end kind record effort describe according leader.,2025-03-30 15:34:20
3712,241,175,2,Push film race test sense bag structure police.,2025-07-29 07:30:09
3713,754,495,2,Tv hair call huge similar indeed appear.,2025-06-26 14:49:14
3714,248,471,1,Part list share if.,2025-08-07 00:38:49
3715,894,447,2,On offer million kitchen role.,2025-02-28 02:00:33
3716,272,415,4,Clear candidate every contain.,2025-01-29 16:19:08
3717,212,96,5,Southern truth future force pressure.,2025-09-06 12:23:50
3718,235,109,3,During team military school.,2025-04-06 03:05:18
3719,208,95,5,Both early popular in every especially.,2025-01-31 14:32:27
3720,855,41,5,Several at listen even.,2025-02-06 06:31:11
3721,256,383,3,Wide quite focus newspaper.,2025-02-28 23:28:17
3722,857,310,1,Soon tough cost always less president add price.,2025-04-24 01:12:54
3723,634,133,3,Too be hit heart there past expect start.,2025-03-05 17:38:16
3724,365,447,3,Election very four let wall her.,2025-08-12 20:35:13
3725,160,345,2,Test bank accept must marriage thus teacher product.,2025-03-12 20:33:52
3726,798,55,1,Through daughter research leave professor onto remember.,2025-04-22 11:51:47
3727,110,223,3,System available card dream challenge require.,2025-02-21 03:44:55
3728,123,274,3,Our myself you within less.,2025-05-10 18:13:51
3729,943,10,4,School off account.,2025-03-05 00:13:48
3730,81,3,4,Term lawyer key theory in nature fund.,2025-06-13 13:14:20
3731,693,203,2,Population without soon follow before improve.,2025-01-18 09:33:17
3732,979,60,2,Wonder ok behavior own.,2025-09-03 06:20:44
3733,680,7,3,Point past mission appear food crime.,2025-01-10 23:41:47
3734,505,88,3,Do year tend red air.,2025-06-28 14:08:59
3735,629,336,5,Church effort something answer opportunity.,2025-03-27 15:56:09
3736,7,245,1,Produce threat institution dark.,2025-01-19 20:54:44
3737,783,236,2,Eight end space woman.,2025-03-20 17:53:10
3738,878,355,3,Open operation ten early nation already will.,2025-01-11 19:59:39
3739,555,208,2,While pull bank leader list occur play.,2025-08-12 17:14:00
3740,981,445,1,Order collection add already teacher land former.,2025-02-15 00:57:54
3741,44,337,2,He eat past hundred sport thing reason decision.,2025-04-03 23:22:08
3742,869,495,5,Alone and newspaper pick western.,2025-06-05 19:34:21
3743,494,382,5,Financial sport so leg air season stop.,2025-03-01 19:30:41
3744,381,309,2,Deep eat main idea.,2025-01-03 05:17:37
3745,636,372,1,Down wrong he.,2025-07-30 17:30:37
3746,323,250,5,Wrong speak try or know join father.,2025-04-01 15:01:13
3747,505,156,1,Save seek police.,2025-02-18 07:29:16
3748,920,317,5,Little information over while school.,2025-06-25 01:31:48
3749,903,417,5,Entire Congress sign hotel.,2025-08-06 12:28:06
3750,919,499,2,People ever argue say two arrive star sing.,2025-06-23 18:20:24
3751,589,316,1,Study professional organization address.,2025-06-10 13:59:33
3752,890,185,4,Defense hair wonder cause buy another.,2025-01-10 21:26:54
3753,282,354,1,Art argue kind stay responsibility them.,2025-04-08 09:36:26
3754,503,345,3,Look play raise current very time state.,2025-07-24 13:06:38
3755,188,494,2,Issue others because summer knowledge cover.,2025-02-27 20:11:08
3756,783,354,3,Kitchen environmental ball involve politics available before account.,2025-08-30 11:54:41
3757,938,346,5,Difficult onto test yes wonder entire study.,2025-08-21 05:56:27
3758,524,203,4,Everybody audience drug effect beat life.,2025-03-21 17:32:19
3759,287,412,4,Outside child professional however.,2025-08-18 22:05:30
3760,408,155,5,Defense any officer technology newspaper smile cause.,2025-06-24 06:18:13
3761,228,45,2,Four professional source happy either operation lot computer.,2025-05-26 11:47:02
3762,769,65,4,Somebody none rate really ready new space baby.,2025-09-03 10:57:41
3763,591,70,3,Pay important physical who often social.,2025-03-22 16:28:36
3764,132,8,1,As final statement industry.,2025-01-20 20:26:34
3765,56,98,1,Development way training bit speech respond.,2025-04-12 06:01:02
3766,539,58,4,Article commercial alone our everything.,2025-07-06 23:45:34
3767,819,418,4,Medical Republican suffer.,2025-02-05 10:14:15
3768,434,9,4,Structure country window soldier.,2025-02-02 15:23:14
3769,490,357,3,Child production quite organization peace.,2025-04-12 15:27:42
3770,963,497,1,Language part hour whose truth.,2025-03-09 11:46:04
3771,554,97,2,Modern both church rich.,2025-08-01 08:13:23
3772,34,440,3,Many else blood accept national not.,2025-03-28 21:31:14
3773,515,14,1,Suggest candidate would protect threat.,2025-08-27 03:22:29
3774,356,108,3,Lawyer light former health affect window consider.,2025-07-03 06:33:02
3775,404,247,1,Nothing phone travel involve.,2025-05-11 06:20:37
3776,882,333,2,Money exist risk conference drug century cost.,2025-06-09 15:32:58
3777,703,75,1,Prevent act surface both option early instead.,2025-07-09 16:20:28
3778,795,333,3,Product feel house visit five.,2025-07-08 07:30:16
3779,179,124,2,See continue behavior development her lawyer past.,2025-07-14 06:56:22
3780,469,224,5,Leg stay teacher bed.,2025-07-21 08:09:55
3781,1000,432,3,Food into claim news act us.,2025-03-19 12:45:38
3782,124,321,3,Senior cell east different fall owner.,2025-02-01 08:19:58
3783,716,440,4,Total little including account hotel education light.,2025-04-13 15:14:59
3784,531,405,5,Pm budget sometimes.,2025-06-12 21:52:54
3785,472,276,1,In and especially commercial fish.,2025-04-26 11:58:33
3786,324,98,3,Trouble heart year.,2025-01-28 04:41:02
3787,706,45,1,Cost certain majority scientist challenge it body my.,2025-08-10 11:18:37
3788,9,155,4,Pick according voice agreement artist.,2025-02-19 15:19:52
3789,13,395,1,Sound garden simple card watch.,2025-06-28 23:54:01
3790,691,238,5,Them bill close open series investment civil.,2025-02-18 14:50:57
3791,216,76,3,Person report night program far describe.,2025-05-10 01:37:06
3792,389,243,2,Challenge rich entire scene gun.,2025-01-26 09:01:13
3793,595,217,5,Find reason information simple.,2025-08-28 11:06:03
3794,104,12,1,Program whether decision financial soldier.,2025-01-05 16:06:43
3795,334,60,1,Early treatment operation boy.,2025-04-08 17:06:48
3796,371,86,2,Ready whole step every pick example some degree.,2025-03-23 05:44:44
3797,628,463,2,Cut degree watch expect perhaps.,2025-01-30 11:35:22
3798,883,79,5,Cost type star idea responsibility ready these.,2025-03-28 00:57:21
3799,266,379,4,Own capital pay story.,2025-02-05 23:10:42
3800,192,360,2,Action structure themselves cover Mrs.,2025-04-06 04:04:40
3801,562,228,2,Stage sign hand field recognize because soldier wall.,2025-08-10 21:19:37
3802,270,494,3,Risk ask involve share offer often series.,2025-07-21 07:05:05
3803,243,249,4,Around its leader fear.,2025-04-04 04:44:01
3804,276,242,2,First relate camera production.,2025-01-13 00:02:28
3805,483,11,4,Continue blood day other when speech meeting final.,2025-02-05 09:19:38
3806,982,441,2,Role contain cold ready brother.,2025-04-07 10:23:49
3807,628,231,4,Very bank heart provide good wonder.,2025-01-19 10:20:42
3808,352,300,3,Fire number game central.,2025-01-27 05:06:31
3809,375,125,2,Defense wait himself fact.,2025-07-13 18:01:01
3810,189,104,2,Imagine take family nearly.,2025-01-25 19:58:40
3811,511,151,1,Per director prevent.,2025-03-30 09:20:34
3812,435,292,5,Still final sister law check business.,2025-04-04 15:43:39
3813,216,425,2,Cell task my director class husband as.,2025-02-18 05:46:08
3814,430,427,1,Against despite positive all consumer employee.,2025-04-20 16:30:54
3815,718,201,4,Relationship suddenly thus quickly child event vote.,2025-08-10 05:16:41
3816,771,27,1,Follow various speak operation work where.,2025-08-10 22:05:06
3817,382,171,4,Answer establish artist thank fight letter become.,2025-04-10 20:00:01
3818,374,5,5,Almost I like hand gas.,2025-02-10 04:22:32
3819,875,53,5,Section lot make traditional.,2025-01-31 05:21:15
3820,411,323,2,Action fall drop force.,2025-05-31 21:34:10
3821,287,434,2,His face foreign answer.,2025-06-21 12:56:01
3822,462,366,1,Guy herself rule first option.,2025-03-26 04:02:19
3823,185,222,4,Student instead letter old security not such.,2025-04-15 05:12:03
3824,586,213,3,Before least among bit particular factor age.,2025-08-21 22:55:36
3825,135,435,5,Operation north pull research eight.,2025-06-28 02:48:39
3826,590,254,4,Wide someone skin form organization read suffer.,2025-03-22 04:21:46
3827,703,378,5,Market then civil sell blood thought.,2025-06-27 20:20:17
3828,235,297,2,Executive national out western water.,2025-06-10 03:26:40
3829,834,306,3,Guy though major same.,2025-01-03 02:46:17
3830,103,375,4,Institution top few career major million.,2025-05-03 04:44:05
3831,739,284,5,Company around sister daughter boy.,2025-03-14 08:45:43
3832,277,149,2,Later teacher animal as east government.,2025-04-24 16:24:22
3833,824,19,3,Work feeling question.,2025-06-09 09:19:58
3834,242,250,2,There effort all daughter among idea.,2025-05-19 15:42:49
3835,569,205,3,Play world from result add only shoulder.,2025-05-05 12:52:49
3836,443,249,4,Happy well glass action yard tend.,2025-01-08 05:49:41
3837,877,263,4,Report practice community choice ability station.,2025-06-04 16:43:11
3838,391,303,4,Laugh picture none.,2025-06-08 09:00:58
3839,201,372,5,Way make free data.,2025-02-22 15:12:47
3840,150,314,3,Movement stage opportunity doctor.,2025-04-29 23:56:45
3841,820,479,5,Young that nice.,2025-04-09 16:21:22
3842,983,348,4,Charge report let tough particularly wait.,2025-07-20 04:33:04
3843,757,464,3,Build provide modern call wonder event.,2025-01-17 00:04:49
3844,154,419,1,Likely hair bill affect.,2025-08-17 12:11:06
3845,485,445,2,Step fund hard.,2025-08-15 16:51:07
3846,826,250,1,Congress husband test cost.,2025-05-18 18:33:19
3847,10,119,3,Bag store production edge together.,2025-05-13 21:07:15
3848,181,366,4,Chair page wait.,2025-04-23 20:54:08
3849,432,32,4,Believe offer production win artist vote short.,2025-05-17 20:47:46
3850,512,271,3,Adult try trade teacher drive material care newspaper.,2025-02-18 08:32:14
3851,138,10,2,Term walk season miss war Mr.,2025-04-15 21:01:36
3852,915,217,4,Raise ground me have.,2025-03-03 09:40:10
3853,870,296,1,Interview citizen law war smile.,2025-08-31 22:09:16
3854,646,162,2,Everybody student after.,2025-03-22 19:35:09
3855,530,284,4,Meeting important investment and have.,2025-03-10 15:54:27
3856,547,33,3,Well before into how cost television catch.,2025-07-31 05:26:19
3857,738,138,1,Edge throughout travel above no rock ball case.,2025-07-02 03:56:21
3858,324,458,3,Both expert modern himself represent song director marriage.,2025-08-01 01:16:58
3859,805,332,4,Address happy popular piece easy.,2025-02-20 00:51:12
3860,499,214,2,Must yard discover as interesting politics history run.,2025-03-03 03:01:42
3861,308,456,4,Theory government popular red father truth summer performance.,2025-06-10 13:40:57
3862,257,243,4,Imagine fish institution with different.,2025-05-09 23:20:59
3863,576,60,5,Born also citizen feeling maybe performance.,2025-03-30 19:57:06
3864,880,254,4,Rise cut check knowledge I read sit everybody.,2025-05-10 05:41:09
3865,582,319,2,There must miss matter remember.,2025-01-02 02:30:43
3866,49,481,1,Off care game result every several history.,2025-02-23 19:19:25
3867,408,331,3,Everyone view range again occur apply you.,2025-06-03 00:43:28
3868,102,178,3,Oil research design indeed type different another.,2025-07-29 03:50:54
3869,708,230,5,Where price investment stock similar itself so.,2025-05-26 04:37:50
3870,168,358,2,Behind couple stand sign serve family.,2025-03-27 14:57:40
3871,62,224,4,Learn want civil those art.,2025-05-12 09:29:10
3872,221,11,1,Build toward throw much do year.,2025-03-31 23:10:57
3873,834,83,5,Off plan line detail.,2025-04-25 05:04:41
3874,261,148,3,Because baby recent.,2025-07-25 23:44:00
3875,488,372,3,Piece item thousand sister look per.,2025-02-13 19:57:31
3876,860,99,3,Human physical forward.,2025-05-25 10:38:22
3877,645,241,4,Never change anything I among.,2025-06-12 16:37:14
3878,99,177,4,Picture two someone boy social rest you.,2025-05-05 11:23:07
3879,461,225,4,We late attention central.,2025-04-20 16:54:08
3880,763,119,4,Trade why occur they article plant.,2025-06-10 07:45:14
3881,343,260,4,Spring than coach management large away entire.,2025-01-07 21:44:15
3882,267,113,3,Chair who seem or car leg former Democrat.,2025-07-05 15:48:38
3883,370,301,1,Affect cover feeling year.,2025-02-26 12:33:00
3884,369,466,3,Nice any side growth simple.,2025-02-28 01:30:39
3885,574,351,4,Its various consumer long.,2025-06-01 10:25:07
3886,571,174,2,Matter kid magazine agreement bit west.,2025-06-19 05:42:55
3887,955,472,3,Common western kind range us policy.,2025-01-03 07:29:29
3888,830,309,1,Whom field fine occur.,2025-08-14 18:44:47
3889,264,437,3,Still quickly mother affect special.,2025-08-29 17:15:42
3890,353,432,4,Mr Mrs card key weight store.,2025-03-15 13:30:29
3891,21,367,4,Moment culture national reach course.,2025-05-15 18:20:22
3892,422,337,2,Also government after big seat.,2025-01-18 09:22:31
3893,125,240,5,Camera Congress security contain writer view.,2025-03-25 12:19:42
3894,360,68,2,Suggest consumer control policy continue much walk.,2025-08-12 03:58:09
3895,889,453,5,Plan allow half.,2025-03-02 06:23:39
3896,696,151,2,Key chance west different along too ok.,2025-01-07 20:04:30
3897,987,371,1,Artist among meet former candidate their word.,2025-03-24 20:19:40
3898,621,365,5,Artist something behind second budget cut almost.,2025-06-05 22:50:58
3899,204,200,5,Indeed early responsibility by analysis table.,2025-05-20 00:37:27
3900,591,492,3,Interesting weight gas change.,2025-03-11 13:05:12
3901,590,214,2,Significant year card culture might.,2025-06-08 12:33:23
3902,666,427,5,Relate soldier real strategy rest leave.,2025-01-06 07:25:20
3903,665,482,5,Worker job now scientist continue back development.,2025-07-11 09:47:41
3904,552,345,1,Knowledge pick down bank listen.,2025-01-06 09:06:00
3905,179,335,1,In behavior imagine.,2025-08-26 15:02:40
3906,800,377,4,Tough top why country sing religious movement type.,2025-02-05 06:39:09
3907,292,185,1,Environment plan write Republican anyone professor chance.,2025-05-03 09:35:09
3908,364,408,3,Turn develop floor factor play size.,2025-01-17 15:11:18
3909,333,242,3,My lead score.,2025-02-18 22:47:57
3910,690,410,5,Difficult board grow floor force.,2025-07-29 14:03:10
3911,523,498,1,Go run time drop success girl child.,2025-03-04 19:40:46
3912,500,433,1,In process detail miss industry.,2025-05-10 16:08:28
3913,794,83,5,Song key nation often painting month.,2025-04-15 01:18:40
3914,755,319,2,Who tell list wife dark high.,2025-07-04 14:09:49
3915,458,107,3,Decade general behavior station.,2025-04-15 11:09:54
3916,911,145,5,Within two sense interview scene car power shoulder.,2025-06-02 00:18:51
3917,81,354,2,Follow capital give free.,2025-07-04 06:41:49
3918,391,384,2,Fact fight television as sound.,2025-07-29 00:57:13
3919,629,45,5,Audience close picture well response.,2025-06-08 17:16:38
3920,294,342,4,Radio build Mrs recently only.,2025-04-27 01:31:14
3921,475,248,2,Forward woman never member alone several.,2025-06-23 08:25:02
3922,647,67,3,Song middle throughout within.,2025-05-13 20:09:16
3923,980,89,2,Discussion guess meeting treatment professor bill ready.,2025-07-04 14:06:23
3924,149,103,3,Clear feel center site community water.,2025-08-18 23:43:56
3925,890,81,3,By bank race tend.,2025-02-10 15:46:16
3926,172,311,4,Teacher national others oil whole seat try.,2025-07-22 23:15:18
3927,656,252,2,Education fact try soon deal read.,2025-08-25 17:24:53
3928,828,52,5,Total begin focus begin stop new dream.,2025-07-02 04:47:01
3929,951,407,2,Can answer involve bring success.,2025-04-27 00:55:19
3930,346,213,1,About get view.,2025-03-04 17:13:51
3931,432,483,1,Require but talk close school save.,2025-08-21 10:53:57
3932,647,253,1,Record develop involve none water with.,2025-08-13 08:14:40
3933,628,156,5,Someone still early skin despite physical carry.,2025-02-02 14:42:53
3934,586,121,1,Its opportunity current staff.,2025-01-24 10:12:39
3935,415,108,5,Think above knowledge that.,2025-05-25 12:20:08
3936,870,286,4,Mission suddenly guy approach world employee entire save.,2025-03-30 13:20:31
3937,929,25,4,Author pass wide way government middle.,2025-06-29 05:01:03
3938,74,10,1,Born bit security network hundred.,2025-01-07 23:18:13
3939,82,184,2,Win eight scientist any stay.,2025-06-19 21:30:47
3940,166,452,3,Decide agency become effect meeting wonder.,2025-05-26 14:47:39
3941,352,134,3,This adult boy court throw dark back.,2025-02-23 21:23:21
3942,234,183,1,Everybody myself brother mind.,2025-05-04 18:42:03
3943,322,347,2,Tree current money sport.,2025-06-04 18:25:06
3944,325,82,2,Once lose heart likely nation fine.,2025-05-16 23:00:57
3945,669,90,1,Always scene look western go.,2025-01-06 23:09:18
3946,299,424,3,Sea during customer.,2025-08-27 10:19:57
3947,728,441,1,Sound energy democratic thus.,2025-06-16 22:43:07
3948,274,458,4,Get eat surface yet sit record.,2025-01-06 11:44:07
3949,620,258,4,Room business build certainly walk listen within.,2025-03-07 00:22:53
3950,661,17,2,Rock offer around.,2025-09-02 21:49:35
3951,405,414,3,Language thought someone in.,2025-07-30 12:39:14
3952,278,33,1,Car lead shake decade among.,2025-04-23 00:06:31
3953,909,173,1,Themselves north various important foreign actually however until.,2025-05-02 11:03:08
3954,456,221,1,Parent indeed partner song entire.,2025-04-17 02:41:08
3955,800,59,5,Politics exactly into per.,2025-03-07 12:54:48
3956,884,317,4,Community which writer probably which pass.,2025-07-28 14:21:40
3957,962,117,1,Feeling benefit message.,2025-05-12 05:29:25
3958,372,62,1,Where enter response blood international.,2025-06-24 22:19:24
3959,766,288,5,Know style discussion peace strategy president.,2025-02-20 18:18:18
3960,602,115,5,Black establish special offer specific political.,2025-05-09 19:46:37
3961,534,250,2,Kitchen most work pull feeling management policy its.,2025-04-13 08:50:13
3962,989,133,1,Understand great least join friend compare know safe.,2025-08-06 15:25:01
3963,462,175,5,Film any score itself four bank.,2025-04-08 17:42:20
3964,424,402,4,Girl guess follow able responsibility recently benefit.,2025-02-19 03:36:04
3965,172,182,2,Woman card break suddenly.,2025-02-26 21:01:32
3966,189,394,5,Win increase young until dream.,2025-08-16 06:32:40
3967,875,24,3,Partner participant crime.,2025-06-22 08:38:49
3968,24,395,3,Reality those right suffer career.,2025-02-23 15:26:17
3969,129,450,4,Lot choice huge answer response about.,2025-03-14 05:42:13
3970,746,286,5,Participant share oil old agreement become magazine.,2025-03-01 15:28:02
3971,241,137,1,Easy defense then measure them thought people.,2025-05-06 05:56:47
3972,678,459,3,Hand buy that.,2025-04-04 12:23:10
3973,258,78,3,Mother expect likely.,2025-02-20 19:05:43
3974,964,437,4,Ability just score project.,2025-07-18 00:00:08
3975,762,354,2,Low read and agency.,2025-07-17 06:57:16
3976,718,448,1,Professor hundred decade establish learn.,2025-01-18 19:35:23
3977,768,264,3,His board contain daughter site support partner who.,2025-08-04 14:40:52
3978,82,310,5,Camera now marriage possible.,2025-07-26 12:59:26
3979,216,343,4,Treatment nor suggest need.,2025-04-20 17:43:46
3980,171,54,4,Hair dog note senior get when.,2025-06-26 12:12:40
3981,407,362,3,College population and office.,2025-01-12 01:55:18
3982,106,26,4,Maintain east effect yes.,2025-06-16 20:19:43
3983,98,475,1,Live effect production arm administration guess.,2025-06-02 12:27:18
3984,66,485,2,Start painting dog modern.,2025-01-12 00:55:18
3985,960,225,4,Ready put according store level seek.,2025-03-26 05:53:42
