review_id,product_id,user_id,rating,comment,created_at
2184,109,492,2,Tend leg movement stop deep believe.,2025-04-09 22:57:52
2185,510,303,4,Do theory thank down so example.,2025-05-01 08:27:56
2186,204,388,2,Trouble production material item scientist.,2025-08-16 13:24:18
2187,624,193,4,Cut chair lawyer man.,2025-07-22 01:00:25
2188,205,46,3,Design understand different.,2025-02-10 12:49:30
2189,797,4,1,Sense hard including end very hotel.,2025-01-14 21:34:51
2190,270,210,4,More protect newspaper show major.,2025-03-19 20:31:45
2191,852,328,3,Yes always current call particular candidate adult.,2025-05-12 13:04:43
2192,536,469,5,Leader stock say yourself road practice.,2025-02-03 23:39:13
2193,997,140,1,Son house tough capital into data have.,2025-08-03 11:36:45
2194,207,213,4,Expert hope establish build thus garden ask.,2025-05-12 13:13:19
2195,367,90,2,Nature too develop administration receive fire seat.,2025-05-25 13:46:04
2196,721,285,4,Including response clear pass.,2025-01-05 06:04:27
2197,420,237,5,Floor along successful trip form article.,2025-04-01 22:22:27
2198,303,364,1,Film able town believe thought none deal.,2025-06-26 08:41:44
2199,165,291,1,Century nor professor.,2025-09-05 23:11:51
2200,41,387,2,If recent son campaign house something green.,2025-06-25 20:58:10
2201,562,469,2,Leave grow course table relate challenge.,2025-07-16 05:10:53
2202,509,71,4,Own fast husband kid.,2025-04-05 06:49:05
2203,933,103,5,National eight short who beautiful join purpose.,2025-02-23 06:32:37
2204,213,96,2,Establish them catch laugh leave.,2025-02-06 14:29:49
2205,705,427,5,Local represent color middle wall.,2025-03-23 19:30:09
2206,956,196,4,Trade space fear determine deal development.,2025-07-04 13:15:06
2207,493,149,2,Control whether offer Congress part early.,2025-06-21 03:36:30
2208,339,284,3,Direction company summer site wonder hot want.,2025-06-24 03:48:19
2209,241,252,2,Blue evidence care too.,2025-04-12 10:19:19
2210,3,22,2,Add bill up artist form player student find.,2025-01-03 10:00:02
2211,14,422,5,Court forget anyone their list.,2025-04-05 05:29:56
2212,688,424,1,Section special both animal economy.,2025-03-25 08:10:52
2213,92,155,3,War group responsibility expert.,2025-07-30 13:18:48
2214,929,428,3,That crime staff it main interest.,2025-06-23 12:21:24
2215,114,300,1,Long across throughout near yes probably.,2025-08-19 18:42:47
2216,856,156,3,You floor tax last.,2025-07-17 00:53:18
2217,588,253,3,Rock individual task call now require scene.,2025-05-18 13:11:34
2218,686,287,5,Total collection although into sit.,2025-04-06 04:53:41
2219,506,379,1,Tough enough space play much.,2025-04-25 13:22:08
2220,153,238,4,Join north year size whether knowledge allow.,2025-01-02 01:29:14
2221,973,115,4,Ground last occur point decision worker.,2025-03-14 09:38:36
2222,93,14,4,Recognize these answer course billion.,2025-06-02 07:18:24
2223,799,406,4,Lead paper important road pull action herself.,2025-05-15 17:41:15
2224,524,2,3,Leader prepare peace decade.,2025-08-05 03:08:19
2225,77,79,3,Road area along result activity sport explain.,2025-02-21 11:10:21
2226,741,135,5,Yourself above pass recent sea.,2025-04-12 01:36:12
2227,741,154,4,Record watch white her what respond mean.,2025-03-24 17:53:10
2228,104,490,5,Senior although join.,2025-08-07 13:23:11
2229,927,328,3,Six add clearly TV wait.,2025-02-21 05:46:45
2230,263,428,1,Republican professor data really once.,2025-02-19 12:07:36
2231,660,326,2,Ready environment perhaps necessary similar.,2025-02-09 20:55:52
2232,237,242,4,Environment stage alone wonder reflect seven condition.,2025-01-06 07:04:37
2233,468,64,4,Most author street know action fish staff.,2025-08-23 21:44:48
2234,304,335,3,Capital institution mention language run exactly paper.,2025-06-23 17:25:38
2235,271,341,2,Spring down attack leave.,2025-04-20 20:13:30
2236,476,458,5,Possible experience class yeah analysis.,2025-01-27 01:47:07
2237,52,148,5,Woman shoulder return democratic.,2025-08-06 09:29:35
2238,103,214,2,Discover that senior whole economy.,2025-05-24 00:47:41
2239,833,92,5,Activity whole determine sometimes front store will.,2025-03-20 17:20:01
2240,179,252,4,Article within issue set meeting more.,2025-07-29 17:38:30
2241,896,465,4,Brother good section development tax again.,2025-08-18 12:52:20
2242,41,353,3,Authority discuss almost brother human.,2025-09-01 22:31:29
2243,873,331,4,Mission inside answer area American any.,2025-07-10 05:32:42
2244,298,126,3,Southern window condition room maybe.,2025-01-09 22:32:03
2245,369,15,5,Party else serve shake most thank.,2025-07-22 21:13:02
2246,821,62,1,Require treat turn statement amount staff.,2025-05-15 01:16:16
2247,694,392,1,Affect meet to as call space.,2025-08-03 09:37:30
2248,321,142,1,Skin will best prevent business practice debate majority.,2025-07-09 09:28:09
2249,437,253,1,Any stand magazine compare.,2025-01-22 11:56:08
2250,757,497,1,Effort partner seven wife.,2025-03-18 16:04:33
2251,119,35,5,Suddenly history station several magazine book.,2025-05-17 05:47:37
2252,98,307,4,Young south between him sea.,2025-01-12 19:36:27
2253,872,382,1,Call every fire simple alone fish beyond skill.,2025-01-26 08:57:39
2254,777,186,4,Fast method southern outside anything couple situation.,2025-03-13 06:49:43
2255,912,298,5,Sister sense care public trouble age take.,2025-04-25 00:49:37
2256,47,247,5,Serve more between senior might able nation.,2025-04-16 12:42:10
2257,10,290,1,Same them almost apply story throughout friend.,2025-08-25 21:55:49
2258,873,224,4,Move nor plant page pressure pick avoid.,2025-03-29 00:05:06
2259,142,445,5,Order machine ago then new.,2025-04-13 14:11:35
2260,680,133,5,Positive huge late seven usually daughter.,2025-03-28 14:19:43
2261,663,322,1,Religious social general ahead what.,2025-07-22 13:17:19
2262,175,352,3,Wide happy cultural least I newspaper.,2025-05-02 14:48:31
2263,337,244,4,Character will information.,2025-01-23 22:07:05
2264,367,499,2,Though amount role middle.,2025-09-01 06:58:49
2265,916,356,2,Job recognize out especially adult long pull.,2025-05-14 09:54:01
2266,449,419,4,Perhaps employee take money any.,2025-03-04 18:38:38
2267,979,62,5,Amount former later positive need indicate board accept.,2025-03-18 11:39:55
2268,637,192,4,Under grow think include treatment person.,2025-03-08 16:30:02
2269,275,263,1,Service walk bank white.,2025-01-10 20:22:56
2270,900,376,2,Lay grow TV within now.,2025-08-03 06:08:21
2271,751,295,4,Modern fact without idea.,2025-06-15 07:28:02
2272,96,9,1,Discover whole cause lead between will especially.,2025-04-17 16:34:11
2273,382,433,3,Blue everybody almost fact name hold.,2025-03-18 07:27:23
2274,835,133,4,Place there that building look.,2025-09-03 20:24:07
2275,351,84,4,Direction these as film world another trade me.,2025-02-22 12:25:16
2276,188,298,4,Read husband cost address network.,2025-08-05 03:44:08
2277,117,30,1,Human seek a local six whom seek most.,2025-03-02 04:53:42
2278,411,75,3,Explain must more lead hot.,2025-02-26 16:23:33
2279,410,164,2,Finish left church pull yourself.,2025-06-28 09:42:04
2280,986,237,5,Toward employee method threat imagine.,2025-01-18 05:52:52
2281,468,450,3,Travel heart pressure know suggest.,2025-08-17 15:19:58
2282,279,355,3,Usually free ok amount today little.,2025-07-20 03:49:29
2283,856,70,3,Most future both full style.,2025-06-22 00:24:05
2284,395,183,3,Beat play a.,2025-04-06 07:04:24
2285,707,84,4,On show where purpose everybody.,2025-07-31 20:28:29
2286,872,28,2,Though experience total value key least.,2025-02-12 03:11:02
2287,490,140,1,Discussion stuff still western list local watch.,2025-07-21 10:00:27
2288,820,185,4,Effect her wife site election.,2025-04-28 10:33:37
2289,432,215,1,Section minute close not.,2025-05-14 19:22:35
2290,665,326,1,Form position land.,2025-04-17 07:51:55
2291,908,467,1,Sense always watch soldier along wide.,2025-07-13 22:58:44
2292,817,490,2,Top black key nature owner.,2025-08-18 03:07:53
2293,171,183,3,Cold shake computer record book.,2025-08-17 06:57:51
2294,116,25,5,Him behind doctor increase.,2025-08-08 20:35:07
2295,136,149,5,All charge use material than reveal measure box.,2025-06-09 21:45:01
2296,713,150,3,Heart course whatever scene standard available prepare first.,2025-08-10 04:03:45
2297,744,272,3,Collection house create close great sign necessary.,2025-07-18 21:43:26
2298,61,328,2,Another research thank charge to make continue.,2025-01-26 03:04:29
2299,966,480,5,Someone win another PM though daughter through.,2025-03-12 07:10:03
2300,865,40,4,Official authority yard control produce old officer candidate.,2025-05-22 13:50:07
2301,164,264,2,Grow world forward art visit moment.,2025-02-16 01:06:56
2302,107,100,5,Trip ball activity more same.,2025-04-08 13:59:32
2303,427,393,4,Board heavy inside only teach carry.,2025-09-06 08:48:27
2304,934,322,2,Too impact that piece smile report unit.,2025-05-17 11:07:12
2305,605,94,5,Too size small this.,2025-07-04 20:33:12
2306,495,392,4,She analysis field carry return.,2025-06-02 10:03:27
2307,822,49,1,Remain local system part Mr figure human.,2025-05-22 16:41:28
2308,583,307,5,Approach economy tax before national reflect later.,2025-06-21 15:17:22
2309,695,386,4,If large write family Democrat friend share.,2025-06-07 21:01:18
2310,449,86,2,Treatment family car food.,2025-05-06 13:16:29
2311,186,279,4,Side service day mouth interview use.,2025-05-09 08:55:18
2312,626,166,2,Name cover suffer ready amount.,2025-08-23 12:09:54
2313,389,447,4,Everything still cell others treat shoulder.,2025-09-02 08:59:17
2314,798,162,3,Site administration beautiful food fund experience husband.,2025-02-04 09:00:40
2315,368,424,5,News deal practice cause personal.,2025-03-06 04:14:53
2316,627,433,2,Skin last PM spring without use.,2025-09-03 09:28:16
2317,30,351,4,Follow will size ten.,2025-08-02 23:17:05
2318,884,410,2,With more federal though and town sport standard.,2025-06-09 16:03:10
2319,701,155,1,Thank fish suffer individual.,2025-08-27 12:48:12
2320,902,139,2,Assume behavior free stage.,2025-04-09 04:57:33
2321,859,351,5,Off happen today often.,2025-05-31 14:26:43
2322,745,358,1,People since expect social.,2025-06-29 19:56:34
2323,997,353,5,Foreign apply factor difficult mother clear.,2025-08-04 21:08:22
2324,914,186,4,Character close behavior election.,2025-07-09 17:06:28
2325,134,50,3,Smile enter over effect argue.,2025-02-05 22:02:38
2326,495,274,5,Sort include letter.,2025-05-13 03:04:18
2327,943,297,2,Speech time executive two finally firm that.,2025-06-12 07:39:34
2328,500,181,3,Stock heavy woman exactly kitchen attention of specific.,2025-07-17 20:21:52
2329,116,422,2,Suddenly second decide.,2025-06-19 17:03:18
2330,909,74,1,Wonder red soldier suffer member really.,2025-08-14 01:03:02
2331,422,7,1,Effect lead require take this.,2025-09-05 11:36:58
2332,452,71,1,Ask themselves control help report.,2025-06-13 08:23:42
2333,48,266,4,Newspaper lawyer rather at security will.,2025-08-29 11:58:34
2334,65,145,1,Him herself policy trial.,2025-02-03 02:51:01
2335,268,191,5,Lead station region general do hand.,2025-02-15 12:14:31
2336,671,399,2,Worker care your score door effort.,2025-07-20 10:38:18
2337,322,249,1,Four think people at hold past unit.,2025-08-13 12:47:03
2338,13,211,5,Level old skill range.,2025-04-17 20:47:32
2339,722,175,5,Prepare structure language.,2025-09-05 01:53:23
2340,890,472,1,Seek guy book social top bill teacher difference.,2025-06-14 15:30:01
2341,695,467,5,World painting environment real stay.,2025-02-19 07:44:36
2342,538,84,4,Ten buy low some too degree thought.,2025-03-01 03:55:58
2343,786,53,1,Service health ask religious national.,2025-06-27 10:21:02
2344,762,112,2,In discussion name if ago through statement economic.,2025-04-20 09:09:10
2345,591,80,4,Education keep move talk her center myself amount.,2025-04-02 18:30:50
2346,742,258,3,State too trip not fill night cover.,2025-01-08 11:50:39
2347,579,114,2,Quickly these remain lawyer land.,2025-08-19 02:22:04
2348,230,426,2,Point inside fly if traditional town key.,2025-08-20 00:05:56
2349,979,97,2,Air enjoy sport join.,2025-04-11 01:16:59
2350,686,408,3,Company field as single audience large.,2025-02-10 23:11:42
2351,895,460,2,No guy future strategy the management.,2025-08-23 10:08:37
2352,347,287,5,Serious treat center over big responsibility.,2025-04-09 08:22:52
2353,532,315,2,Challenge evidence training else water box.,2025-02-08 07:38:20
2354,536,354,4,National beyond single carry tend change produce.,2025-04-01 02:46:14
2355,705,426,3,Population five southern even season per drive.,2025-08-14 04:41:03
2356,718,488,1,Training build already brother.,2025-04-05 15:11:14
2357,634,270,3,Senior theory recently generation think truth avoid.,2025-04-12 13:32:33
2358,98,434,1,Real eight listen individual.,2025-08-23 14:44:08
2359,444,273,2,Everything already can avoid.,2025-05-22 23:29:10
2360,678,365,1,Executive learn from.,2025-02-12 02:55:18
2361,745,283,5,Move war want wide color section often.,2025-05-26 13:23:09
2362,255,360,1,Weight walk would improve director so.,2025-01-18 14:24:51
2363,494,388,1,Argue would pay past.,2025-03-16 16:55:54
2364,355,411,4,Just floor operation national season option.,2025-01-18 20:06:27
2365,680,59,5,Loss policy give culture section since price candidate.,2025-07-11 19:47:54
2366,693,214,1,About thought air read address discover.,2025-03-30 03:25:08
2367,657,236,1,War watch she fill.,2025-04-28 19:12:35
2368,395,470,2,Five billion stuff father budget food miss.,2025-02-17 20:43:53
2369,153,40,3,Perhaps system nice middle move direction.,2025-04-22 07:43:31
2370,860,60,3,Seem me person media fact hand clear series.,2025-07-10 12:11:07
2371,847,420,2,Cup democratic little tell nice.,2025-07-09 12:05:27
2372,572,68,1,Begin plant party movie fear.,2025-02-16 08:54:00
2373,914,473,1,Rate nice power where win.,2025-06-09 07:32:32
2374,628,9,4,Player social rest anyone task a beat.,2025-03-25 18:03:08
2375,56,246,3,Improve few husband sing southern.,2025-05-12 18:37:36
2376,12,179,2,Anyone particular require area can rise.,2025-06-09 06:08:44
2377,659,160,4,Sort pass card approach response million son poor.,2025-04-12 20:45:21
2378,957,354,1,Stand piece measure administration.,2025-08-25 03:17:21
2379,161,186,4,Late hair score happen pretty effect realize.,2025-02-20 12:52:11
2380,518,72,1,Audience nothing have according feeling former have.,2025-03-08 03:49:26
2381,870,419,4,Beautiful term a free degree notice born.,2025-06-14 17:25:55
2382,481,227,1,Deal either year family summer article response question.,2025-05-04 13:25:24
2383,873,456,4,Establish wrong college television debate.,2025-04-07 21:18:14
2384,508,306,1,Painting include south tree.,2025-01-05 21:03:28
2385,891,268,2,Student appear local power add reveal score.,2025-07-01 01:08:58
2386,170,391,4,Difficult assume similar two much politics.,2025-03-30 17:12:46
2387,77,497,4,Them state receive leader young specific.,2025-04-19 00:38:07
2388,770,176,3,Whether husband check material store us smile.,2025-07-15 12:32:16
2389,504,89,4,All water enough stage.,2025-01-05 09:06:30
2390,329,364,2,Article dog stage fish.,2025-03-22 14:05:31
2391,247,156,2,Seven husband agency agreement.,2025-07-09 14:01:17
2392,339,15,3,Under hand or draw.,2025-07-29 17:55:48
2393,994,382,1,Customer forward cold any.,2025-06-23 16:06:03
2394,285,418,2,Foreign begin less just edge.,2025-06-29 08:03:09
2395,52,61,5,Even there wrong middle course.,2025-02-09 22:22:34
2396,520,114,5,Hit city reach character.,2025-08-12 14:31:45
2397,229,66,1,Building foreign how college by either simply.,2025-03-10 05:50:52
2398,564,439,1,Building through brother.,2025-07-22 01:41:49
2399,659,356,3,Road talk pay image hear keep.,2025-08-02 04:03:14
2400,388,73,3,Price present activity call necessary effort exist.,2025-02-13 20:57:34
2401,413,353,4,Care across next PM real factor friend artist.,2025-08-23 01:27:28
2402,837,117,5,Sure hotel claim democratic our air agreement consumer.,2025-02-02 19:34:42
2403,241,158,5,Wear must bad several night crime way.,2025-04-28 15:26:17
2404,81,65,5,Fire right network number assume rather.,2025-05-05 04:26:50
2405,471,108,1,Suffer continue term though kitchen serious.,2025-07-23 23:56:44
2406,455,67,2,Good front instead skill new opportunity offer.,2025-03-01 23:16:24
2407,821,41,5,Pay lay enjoy.,2025-05-20 09:23:08
2408,587,218,3,No usually usually baby.,2025-04-19 17:35:30
2409,459,354,1,Occur there character board now bank radio.,2025-01-30 18:04:46
2410,91,391,2,Such that image.,2025-01-15 01:39:50
2411,878,402,5,Election fish actually consumer hospital always main.,2025-09-03 00:20:39
2412,511,58,1,Middle good each part.,2025-01-02 13:00:11
2413,458,40,5,Wear appear hundred successful game.,2025-08-14 02:45:44
2414,324,10,1,Toward especially door almost center performance.,2025-04-27 23:06:44
2415,122,397,5,Society will reason resource player notice.,2025-02-03 10:22:35
2416,510,248,5,Simple myself writer along successful friend.,2025-04-02 06:01:49
2417,764,388,2,Southern senior another be loss style.,2025-08-01 03:47:42
2418,670,221,2,Cultural wonder subject strong computer approach surface.,2025-01-19 23:55:50
2419,19,22,3,Include item two play white.,2025-04-13 10:15:32
2420,106,101,1,Remain movement know.,2025-04-12 03:57:39
2421,414,56,2,Live lose coach of fight smile rest almost.,2025-01-22 23:09:28
2422,423,17,1,Maintain sense weight particularly including at.,2025-05-04 20:54:25
2423,37,407,3,Trade during television.,2025-07-26 06:44:07
2424,571,338,2,Threat heart population.,2025-07-18 16:16:14
2425,563,263,2,Same eye evening population difficult how.,2025-02-13 22:01:39
2426,1,304,1,Bit hospital his sense standard education never.,2025-01-31 13:55:33
2427,846,31,2,Recently customer close line ok go fund.,2025-03-25 14:24:52
2428,94,241,3,Others per him probably finally would too.,2025-01-17 04:24:40
2429,811,61,3,Night increase minute quite name office consider.,2025-05-08 06:28:37
2430,619,466,4,Radio image pay response.,2025-07-14 16:00:15
2431,987,130,2,Partner loss student management bank account hot.,2025-06-01 06:14:37
2432,634,23,1,Reduce show thought concern away result.,2025-06-19 02:13:15
2433,653,34,3,Relationship power sure draw serve exist direction.,2025-04-12 11:49:50
2434,312,155,5,Contain always born church.,2025-05-11 21:01:13
2435,912,342,3,Operation myself more early throughout girl north middle.,2025-03-12 05:53:23
2436,521,6,4,Field quickly cut baby heart through.,2025-04-06 15:58:45
2437,576,387,4,Enjoy sound language mission including pass at.,2025-02-07 17:04:33
2438,212,50,4,Stop past blood tree open base.,2025-08-30 12:11:13
2439,671,401,5,Floor question pull industry trip audience message.,2025-05-13 18:21:45
2440,688,64,4,Everyone laugh central order set military.,2025-01-04 01:31:43
2441,468,472,2,We voice fall respond ready.,2025-03-07 05:30:24
2442,974,309,3,Range term else paper risk in detail.,2025-03-25 20:06:43
2443,350,106,2,Member response international across situation open.,2025-07-02 09:32:51
2444,373,301,2,Draw little media business TV child.,2025-07-16 07:20:25
2445,846,462,3,Hot car already food more plan.,2025-07-22 05:47:03
2446,56,103,4,Behavior station cause city from of.,2025-06-11 12:34:37
2447,837,95,1,Difficult anything Democrat product second.,2025-07-10 10:19:32
2448,229,344,5,Evening serve thank some.,2025-07-20 16:42:48
2449,865,180,5,Age hotel large ready receive.,2025-07-27 06:01:49
2450,466,15,3,Name American pay win night subject north cultural.,2025-03-02 20:09:14
2451,340,47,2,Garden challenge course rest stock.,2025-06-16 04:49:48
2452,574,75,2,Police soon resource about.,2025-08-27 21:03:10
2453,786,434,4,Answer suddenly have.,2025-07-13 15:40:53
2454,635,383,4,Rate once out fall tonight them save.,2025-06-03 16:10:46
2455,615,483,4,Accept station here may alone.,2025-04-25 08:27:18
2456,485,143,4,Federal shoulder everything break.,2025-07-02 01:09:37
2457,734,486,5,Up organization democratic section off.,2025-03-03 16:47:11
2458,673,297,3,Discuss serve church lawyer.,2025-05-28 13:40:58
2459,373,179,3,Pm know condition beyond.,2025-08-25 04:07:06
2460,734,181,5,Cold along industry oil decade performance speech.,2025-08-05 10:15:02
2461,464,83,1,Nor condition soldier high need.,2025-06-09 02:36:28
2462,117,438,5,Economy police discuss join.,2025-07-02 03:24:36
2463,100,257,4,Food yard store yes.,2025-03-17 22:00:43
2464,778,400,4,Manager feeling which red open.,2025-04-22 09:52:55
2465,675,374,2,Out share power now.,2025-07-04 13:05:58
2466,228,314,5,Our baby whether shake same.,2025-08-28 12:48:29
2467,3,124,3,Our their born finally perform.,2025-06-17 07:30:39
2468,350,259,3,Season event pattern but interview fund.,2025-06-20 21:21:14
2469,364,292,1,Price smile she positive environmental general there live.,2025-08-09 23:50:42
2470,850,35,4,About recognize billion clearly.,2025-03-30 17:20:39
2471,649,51,2,Popular occur away hot wind use.,2025-02-17 07:30:52
2472,988,420,1,Sort sea may discuss mission sea.,2025-01-28 06:04:48
2473,820,297,5,Strategy hour rest reason simply foot land.,2025-06-02 20:16:15
2474,299,391,3,Best perform strategy example crime beyond.,2025-08-01 06:17:43
2475,561,8,5,Reach wrong value.,2025-04-15 07:11:54
2476,535,271,4,Energy just soon.,2025-08-11 18:39:04
2477,383,112,3,Your fine success surface production.,2025-01-24 14:36:34
2478,719,367,5,Career television usually.,2025-06-27 03:23:24
2479,109,99,5,Environment approach marriage market article forget.,2025-06-04 01:53:12
2480,47,494,3,Magazine us next some business perform.,2025-01-03 23:27:24
2481,919,145,4,Collection action appear service man quite value.,2025-05-06 03:37:21
2482,169,88,1,Development already mention speak list democratic section.,2025-01-15 10:17:34
2483,505,462,1,Star large board.,2025-07-27 08:50:29
2484,144,387,2,Several present community agency direction.,2025-02-20 19:35:48
2485,842,276,3,Increase break bring during different ok.,2025-08-14 18:17:10
2486,735,3,4,Buy west simple do.,2025-06-13 01:05:45
2487,761,499,2,Third she board.,2025-08-04 07:19:31
2488,739,372,3,Listen away decide reveal class parent need.,2025-06-13 05:21:21
2489,420,51,2,Per only after thought event general support guess.,2025-06-02 18:06:15
2490,110,474,1,Suggest Republican game control style.,2025-06-17 21:39:46
2491,261,110,2,Charge finish somebody song.,2025-01-06 08:40:06
2492,626,472,3,Less economic usually analysis bag.,2025-04-30 23:39:01
2493,201,259,3,Remember side eat trade.,2025-02-18 01:42:15
2494,193,436,2,Shake participant budget mention.,2025-04-08 17:22:33
2495,124,363,3,Either event hand employee seven.,2025-07-17 23:26:13
2496,953,244,1,Impact lose guy career.,2025-07-30 09:11:57
2497,873,188,1,Little technology travel car another green need.,2025-05-21 19:00:52
2498,403,358,3,Sure state future give friend movie many.,2025-02-21 17:37:41
2499,221,302,1,Participant media establish simply.,2025-01-12 02:33:35
2500,469,95,3,Majority information wind act consider use.,2025-01-13 07:03:46
2501,845,226,2,You without door on.,2025-06-03 11:51:36
2502,801,345,4,Mother teacher need attention.,2025-05-17 20:10:08
2503,196,491,5,Enjoy along night law will follow address.,2025-04-18 19:36:17
2504,734,55,3,Tough break ready cause.,2025-07-15 04:28:55
2505,347,93,2,Everything sometimes maybe identify quickly value.,2025-03-22 13:16:59
2506,111,428,5,Item month shake ok foreign despite memory.,2025-02-11 04:16:57
2507,776,182,1,American day around small.,2025-03-26 04:18:47
2508,425,195,4,A population list benefit five impact.,2025-02-10 16:28:56
2509,48,218,3,Present room tree exactly open around become.,2025-01-05 19:02:07
2510,949,110,5,Person process individual sport care cell.,2025-05-03 20:52:35
2511,649,264,2,Build stuff truth sort particularly.,2025-02-19 19:16:00
2512,858,117,5,Country southern girl especially our start.,2025-03-06 08:02:34
2513,689,209,2,Individual chair energy.,2025-04-07 04:41:34
2514,603,58,1,Student ready together allow story.,2025-05-29 01:42:15
2515,127,390,5,Cold provide last coach.,2025-07-02 09:27:20
2516,791,161,3,Section audience yeah theory water fund herself.,2025-06-27 17:50:17
2517,914,64,5,Staff thousand per million letter determine final.,2025-08-02 16:25:46
2518,462,239,1,Message thought center doctor even side happen able.,2025-06-28 11:58:51
2519,469,57,5,Whose company boy institution.,2025-06-23 04:09:37
2520,675,267,4,Be Mrs nearly.,2025-05-09 23:22:11
2521,604,70,4,Community represent suffer should.,2025-02-16 08:50:43
2522,980,254,3,Approach program tough former senior skill.,2025-08-26 10:40:12
2523,517,391,3,Month have without move shake.,2025-03-23 05:55:07
2524,138,185,2,Few draw paper near energy side.,2025-01-15 08:55:07
2525,987,361,2,Cup safe only especially project.,2025-07-18 13:49:15
2526,511,148,1,Me other myself final already front.,2025-02-20 07:35:23
2527,5,286,4,Investment your allow minute Democrat.,2025-02-28 18:13:59
2528,544,370,4,Resource role successful size likely.,2025-02-12 00:30:21
2529,754,21,1,Role choice from camera student seek view amount.,2025-05-24 16:38:59
2530,50,43,3,Continue interest example.,2025-08-01 18:34:23
2531,567,168,4,Field class knowledge including woman.,2025-05-05 06:51:27
2532,958,253,1,Every always risk wife nor card.,2025-04-25 06:08:14
2533,444,60,1,Standard involve dog seat tough across.,2025-04-13 13:06:32
2534,859,198,4,Energy conference physical defense.,2025-07-23 23:01:09
2535,600,146,2,Trip water its despite rock care during huge.,2025-08-23 21:37:43
2536,495,234,5,Commercial call represent house.,2025-08-25 03:55:30
2537,947,308,3,Ok at several.,2025-05-16 23:52:01
2538,521,377,5,Weight check inside statement only ago.,2025-01-18 18:21:15
2539,800,160,4,Myself owner safe instead build third allow recent.,2025-06-14 00:26:03
2540,944,352,2,Leg movement candidate push.,2025-02-19 09:08:29
2541,933,500,5,Whatever especially plant my fill simply wish.,2025-07-01 02:16:33
