review_id,product_id,user_id,rating,comment,created_at
1097,940,350,5,Watch serve dream daughter treatment join agency.,2025-05-20 03:10:02
1098,833,362,5,Police today last control cause game policy.,2025-04-16 17:19:57
1099,77,200,1,Former five ahead analysis ground issue take.,2025-08-04 17:14:18
1100,23,243,2,Decade green entire answer note authority blue.,2025-04-08 08:12:47
1101,67,135,1,Treatment sister American population over.,2025-03-26 23:15:29
1102,203,75,2,Yet political ready.,2025-07-24 02:48:24
1103,925,272,5,Place arm beyond improve.,2025-06-02 21:21:31
1104,662,446,2,Increase into run wind back.,2025-05-23 05:05:56
1105,455,223,1,Knowledge best watch animal maintain.,2025-04-20 17:08:49
1106,829,7,5,Run price factor heavy race.,2025-04-14 19:59:04
1107,132,148,4,Start or write course.,2025-08-11 14:08:26
1108,95,475,3,Their add concern above suffer recognize.,2025-04-21 14:46:13
1109,927,409,1,Go enjoy smile.,2025-09-04 08:06:13
1110,868,230,1,Yeah against enjoy contain do manager.,2025-09-03 14:51:26
1111,850,196,2,Lead toward world list.,2025-05-09 05:31:19
1112,829,348,5,Tend writer report often happen.,2025-04-21 19:50:37
1113,340,162,2,News light major dream either pretty.,2025-06-26 10:30:12
1114,126,493,2,Think similar theory factor plan.,2025-08-22 04:28:07
1115,44,272,1,Sing debate drop responsibility group.,2025-05-04 03:37:58
1116,965,350,5,Thought upon energy pass staff so alone.,2025-07-29 04:32:45
1117,473,490,3,Close environment thousand Republican.,2025-08-21 22:11:30
1118,52,22,1,Commercial bit staff town prevent.,2025-05-01 04:29:18
1119,173,50,1,Expect there financial particular strong animal.,2025-03-22 06:18:39
1120,947,470,1,Him upon long federal similar everyone wear.,2025-05-01 18:20:49
1121,588,273,5,Watch degree star at test.,2025-04-06 13:44:14
1122,444,327,3,Speech include than identify hope less.,2025-02-06 01:15:00
1123,842,182,3,Better anyone stage into Democrat point box town.,2025-07-23 08:47:34
1124,742,490,5,Road available these after.,2025-03-20 21:08:49
1125,405,433,2,Upon start situation show order significant her.,2025-07-30 13:03:17
1126,509,222,4,Form small traditional eye generation seat gun.,2025-06-19 08:28:38
1127,31,313,1,Off there stage throw reach thought stage.,2025-02-11 13:10:36
1128,392,471,2,Mouth plan property around commercial.,2025-03-15 18:01:39
1129,700,334,3,Sing baby sea probably issue treatment.,2025-07-13 18:03:11
1130,437,440,1,Color defense total notice.,2025-02-10 16:28:19
1131,177,140,5,Buy several six economy.,2025-06-30 10:25:27
1132,363,172,3,Anyone price threat finally PM bad.,2025-05-02 09:11:31
1133,220,139,5,Partner west foot least forward.,2025-01-15 04:02:44
1134,931,137,4,Rock add him into.,2025-01-19 05:56:12
1135,192,411,2,Case speak hand capital.,2025-08-28 00:22:53
1136,282,51,5,Item now bag big few success real.,2025-01-30 05:31:24
1137,287,131,4,Yet rise couple.,2025-01-13 15:29:09
1138,457,336,3,State general one beyond.,2025-05-18 22:34:06
1139,905,300,5,Those so help front.,2025-03-14 22:42:06
1140,153,201,3,Different improve final PM.,2025-07-23 23:52:59
1141,36,237,5,Reveal chair arrive attack fall.,2025-07-14 11:14:07
1142,629,396,5,Some tonight old sure whatever center personal.,2025-06-26 23:31:08
1143,635,346,5,Quickly will large.,2025-01-02 12:15:04
1144,632,384,2,List part newspaper perhaps return simple probably.,2025-08-18 02:41:19
1145,252,124,1,Stop guy month less identify.,2025-02-10 01:18:05
1146,663,376,1,Property church operation unit.,2025-06-23 06:06:01
1147,303,345,2,Operation already common interest act.,2025-06-29 10:36:18
1148,511,302,1,Inside news reach foot.,2025-07-18 13:45:14
1149,422,395,2,Up Mr in population.,2025-02-03 12:48:23
1150,904,100,2,Phone north forget like door.,2025-09-04 12:42:23
1151,564,267,3,Production go imagine him lead already.,2025-07-24 01:36:42
1152,491,173,2,Agree person chair apply.,2025-05-22 13:50:47
1153,63,347,2,Us treatment central hotel indicate.,2025-05-02 12:50:45
1154,90,354,5,Respond board why explain for.,2025-02-13 10:15:09
1155,287,93,5,Mrs throughout future.,2025-01-13 23:17:36
1156,393,161,2,Watch social great another western mention field.,2025-05-07 03:16:51
1157,141,281,5,War service although billion statement smile rock.,2025-03-08 05:53:29
1158,430,6,3,Upon specific mention type.,2025-06-14 22:00:51
1159,205,345,3,Major color born put sense.,2025-08-09 08:38:53
1160,659,5,2,Actually mother town together author million.,2025-02-23 23:43:35
1161,906,426,5,Owner campaign where century.,2025-07-13 05:27:46
1162,817,35,4,Trip anyone whatever.,2025-08-10 20:33:46
1163,539,7,1,Floor message bed fly have interest lay son.,2025-02-22 13:01:32
1164,256,211,5,Investment serve affect behind know office box.,2025-05-09 06:12:14
1165,646,51,3,Everybody probably evidence exactly station owner civil.,2025-04-10 04:40:12
1166,822,269,3,Fish your group each political Mr.,2025-07-06 22:38:06
1167,557,54,4,Outside include know culture.,2025-07-09 01:47:18
1168,814,351,2,Under energy represent anyone.,2025-05-10 18:12:57
1169,20,229,4,Traditional thing paper someone return national by job.,2025-08-30 21:25:27
1170,392,180,4,Couple performance front happy.,2025-05-11 18:07:39
1171,801,113,1,Up owner move expect station information.,2025-03-31 16:10:33
1172,731,372,3,Build boy shoulder bank film material.,2025-01-18 00:16:34
1173,368,146,4,Short consider hope feeling actually than baby my.,2025-03-06 20:01:41
1174,492,129,2,Medical feel agree true its.,2025-08-24 04:36:02
1175,558,99,5,Sing nor center lawyer upon.,2025-06-06 12:12:56
1176,801,18,2,Eye thousand street listen professional another.,2025-07-06 06:50:43
1177,497,13,1,Listen million image administration return.,2025-06-24 00:20:06
1178,353,318,3,Edge win life.,2025-07-18 12:08:37
1179,935,48,2,Commercial medical begin laugh I medical until.,2025-09-03 22:59:55
1180,580,30,3,Game any quite strong.,2025-03-04 18:02:18
1181,515,481,5,Participant its field my begin thing.,2025-05-16 06:51:02
1182,330,305,5,Fact point course.,2025-02-15 11:11:31
1183,398,337,5,Then rise hundred guess would region main discuss.,2025-04-30 08:08:24
1184,277,458,2,Support buy series task such.,2025-09-01 22:19:29
1185,185,428,4,Style whom full major catch example.,2025-05-10 06:45:53
1186,27,112,2,Staff positive pressure.,2025-01-09 15:32:09
1187,327,487,3,City ask situation soldier military.,2025-07-26 01:38:24
1188,612,307,4,Ball woman yard our.,2025-06-22 06:34:54
1189,225,327,4,Stay president student enough after for.,2025-02-02 11:35:17
1190,31,63,1,Cause send ask eight.,2025-03-30 06:19:54
1191,918,363,5,Few prevent material morning ago both result.,2025-03-17 09:33:46
1192,831,491,2,Take fast alone how south peace.,2025-02-26 04:39:15
1193,798,62,1,Direction picture especially range back action might.,2025-08-31 20:11:11
1194,288,45,3,Tonight result late soldier prove.,2025-06-23 04:52:23
1195,60,439,1,Drive stand they work matter whole help.,2025-07-14 17:51:23
1196,829,310,5,Daughter us something.,2025-04-16 09:31:42
1197,484,67,1,Share myself information fall.,2025-06-15 23:47:54
1198,543,193,5,Case present machine while no eat around.,2025-03-30 16:56:34
1199,367,337,4,Account suddenly manage model charge.,2025-04-18 00:04:14
1200,786,392,1,Yeah stay chair Republican full prepare.,2025-07-28 12:05:50
1201,599,461,3,Understand article successful play bar.,2025-02-09 09:04:12
1202,239,332,1,Tax gun only chance also.,2025-02-08 14:41:22
1203,998,290,3,Street skill to project community.,2025-06-22 00:54:54
1204,164,412,3,Practice person method person across idea.,2025-07-18 02:06:29
1205,103,496,3,Stuff anything factor employee.,2025-09-03 22:40:37
1206,254,95,2,Range help participant leave.,2025-01-04 11:16:25
1207,673,459,2,Line although computer even probably born.,2025-04-07 17:47:07
1208,247,57,3,So personal begin.,2025-03-07 00:04:19
1209,273,357,1,Look green treat much argue.,2025-01-18 08:03:47
1210,547,95,1,Idea PM the able nation do shoulder.,2025-01-05 18:43:30
1211,836,130,4,Activity thousand new American.,2025-08-30 06:04:19
1212,811,151,2,State religious rise opportunity else experience.,2025-04-07 07:35:00
1213,940,240,4,View account peace always expect race couple.,2025-03-27 20:08:33
1214,755,339,1,Could wind purpose sign government pattern.,2025-03-09 02:18:30
1215,58,480,1,Mind difficult give they employee model.,2025-05-27 22:56:33
1216,783,39,2,Doctor involve poor why become instead.,2025-07-21 14:58:11
1217,971,328,5,Any notice so worry market reflect.,2025-08-08 23:28:19
1218,225,233,3,Again face money thus first face free place.,2025-06-16 20:29:41
1219,590,473,5,Top fact available economic.,2025-02-04 12:56:57
1220,867,142,4,Behavior laugh wife such indeed community.,2025-03-10 19:48:05
1221,817,394,1,Sing chair hour the sing where environment bed.,2025-08-25 11:39:09
1222,398,219,5,Middle simple week size of until design.,2025-01-04 13:16:37
1223,364,355,3,Able bit ten story debate argue former.,2025-03-12 15:11:06
1224,958,463,5,Arrive foreign minute explain.,2025-04-02 17:27:53
1225,860,342,3,Section anyone owner rather cold.,2025-02-12 19:56:20
1226,866,395,5,Prove interesting stay ground story.,2025-05-16 01:24:45
1227,178,395,3,Long sort various speech.,2025-07-12 05:02:14
1228,181,166,5,Cost need head course cut treatment.,2025-01-13 21:13:48
1229,243,132,1,Voice necessary free certain work pass avoid.,2025-04-24 17:42:47
1230,607,83,1,Leave probably role then.,2025-08-17 12:13:17
1231,326,400,2,Technology admit take successful past pay thus figure.,2025-01-17 21:53:37
1232,826,38,3,Model speech someone pressure too sell nature.,2025-07-22 04:38:35
1233,756,142,4,Job drive century wind food here live.,2025-04-23 00:20:11
1234,715,398,2,Indicate investment memory why close wait.,2025-01-02 08:32:13
1235,368,32,3,Traditional campaign bring win his activity.,2025-05-29 11:55:30
1236,936,196,5,Better different black citizen more various.,2025-08-14 00:58:23
1237,606,199,5,Offer themselves crime stand couple clear.,2025-02-07 02:18:03
1238,29,171,5,Base word sometimes green fact citizen.,2025-08-31 23:26:14
1239,721,31,4,Must during shoulder well teach identify run.,2025-06-21 08:36:20
1240,718,133,4,Fact attorney over risk ok box.,2025-07-29 20:10:57
1241,361,490,5,Training wear necessary unit every.,2025-06-19 01:41:55
1242,971,417,2,Executive maintain run not election arm why.,2025-04-02 13:03:47
1243,582,136,3,List whether leave least according treatment.,2025-01-28 06:22:06
1244,578,92,1,Away news plant head child man.,2025-02-10 10:35:49
1245,146,226,5,Shake actually during alone.,2025-03-22 00:24:17
1246,577,36,2,Though camera close well.,2025-07-29 16:50:50
1247,972,252,2,Different television whose involve despite.,2025-06-20 13:39:24
1248,193,476,2,Government it lay perform term detail certainly.,2025-03-03 06:01:53
1249,857,103,4,Of talk career develop picture well into have.,2025-05-06 14:34:47
1250,830,313,5,Phone education large success speech bed involve treat.,2025-03-09 16:29:15
1251,903,202,3,How foot personal agreement capital baby.,2025-05-25 06:38:38
1252,994,92,1,Thank bring name heart all.,2025-05-05 12:42:23
1253,505,331,3,Strong care market.,2025-02-24 01:02:59
1254,556,252,2,Visit him interest produce represent.,2025-02-17 04:18:29
1255,317,56,5,Husband capital public guess threat despite star.,2025-05-12 12:32:25
1256,180,74,4,Science until happen week interview leader others.,2025-05-24 07:18:25
1257,503,277,4,Wish wear discuss during piece.,2025-04-17 07:24:58
1258,39,394,2,Country eight family fact safe western play agreement.,2025-03-05 05:56:53
1259,93,221,4,Realize clear building region reveal claim as respond.,2025-06-28 13:11:19
1260,58,112,3,Feel magazine commercial eye entire prepare.,2025-06-19 15:27:48
1261,239,315,4,Play them economy open senior success smile yet.,2025-08-24 04:01:40
1262,617,330,5,Likely common nearly sit choice.,2025-04-09 07:49:01
1263,225,55,3,Lawyer water and inside whose sing law.,2025-01-01 21:42:57
1264,21,468,3,Ground find arrive term spend friend significant she.,2025-04-29 22:33:34
1265,540,227,4,Bed hand dog condition girl avoid.,2025-04-14 11:33:28
1266,490,367,5,Girl picture message though describe research economic morning.,2025-01-06 19:05:58
1267,1,133,2,They page around home professor.,2025-06-11 14:26:25
1268,340,53,3,Executive fear left choose nor would.,2025-06-14 10:23:48
1269,940,18,1,Clear thought cultural.,2025-01-22 20:22:36
1270,629,38,3,Audience subject whatever building represent that.,2025-06-30 20:32:54
1271,207,37,4,Race agency system science.,2025-04-21 09:17:54
1272,826,293,3,Performance debate various current once else popular.,2025-05-05 19:39:22
1273,134,373,1,Participant common surface job authority.,2025-08-15 11:30:45
1274,349,129,1,Establish eight truth write be article player.,2025-09-03 23:17:57
1275,735,398,1,Instead phone key address begin own.,2025-05-12 18:25:10
1276,182,229,2,Draw poor partner listen free.,2025-04-22 04:16:26
1277,941,10,1,Court choice good window herself system.,2025-02-15 01:20:50
1278,822,460,2,Pay note speak necessary.,2025-01-13 18:51:56
1279,865,255,5,Respond scene trade development else.,2025-03-08 21:12:36
1280,890,77,1,Arrive west Democrat arm option.,2025-07-07 09:45:40
1281,332,335,1,Manage place politics bed.,2025-02-03 21:20:34
1282,61,328,3,For nor third approach order between evidence.,2025-02-16 05:48:03
1283,23,1,5,Campaign bar power daughter.,2025-03-26 08:29:44
1284,152,478,4,Improve also board carry student plant information often.,2025-01-12 05:06:27
1285,601,20,1,Each machine training do top really minute.,2025-08-12 18:01:59
1286,722,341,4,Law sing development relate list road.,2025-07-01 18:50:45
1287,940,200,5,Threat offer ground later.,2025-03-25 06:07:10
1288,146,137,2,The total exactly between certain election those real.,2025-04-21 22:21:48
1289,793,78,4,Phone serve on design heart.,2025-04-24 00:36:17
1290,114,359,4,Conference recent morning while a century available.,2025-08-31 23:54:55
1291,867,169,5,Foot rock billion benefit want great.,2025-03-16 09:59:45
1292,539,464,5,Never relationship reduce west.,2025-03-28 13:25:15
1293,882,201,1,What door six development organization.,2025-06-17 01:11:16
1294,374,295,4,Language case ask fine take make give right.,2025-08-25 00:06:35
1295,984,2,1,Off place social notice social particular.,2025-04-20 08:15:41
1296,75,264,5,Time suffer wait theory behind reason statement finally.,2025-03-04 23:49:58
1297,383,363,2,Heart onto today yard matter push billion war.,2025-03-09 02:31:14
1298,722,482,1,Month born partner.,2025-02-19 00:17:03
1299,965,395,4,Issue continue similar machine prove.,2025-08-28 03:36:40
1300,679,252,5,Can war show in two make.,2025-08-10 16:05:11
1301,406,245,3,Send bit hair figure across face reduce.,2025-04-24 14:00:33
1302,601,224,2,Shoulder wall phone give.,2025-01-11 00:41:46
1303,104,207,5,Personal if collection adult.,2025-05-31 11:17:14
1304,345,433,5,Hundred especially loss many available stand company.,2025-04-03 23:01:01
1305,310,373,1,Control consumer line.,2025-04-22 21:44:52
1306,331,400,5,Week pretty adult on yet.,2025-04-01 12:31:44
1307,140,416,4,Money nature she more class student win hard.,2025-07-06 07:36:00
1308,1000,403,2,Of scientist thought live even stand strong.,2025-08-31 02:39:44
1309,162,36,5,Trial type and a.,2025-01-25 02:46:09
1310,750,277,2,Memory science sport official offer security.,2025-04-09 21:16:43
1311,972,116,2,Foot wife natural leave try weight.,2025-04-22 16:40:29
1312,448,2,1,Out race commercial without body voice goal.,2025-07-09 15:59:01
1313,811,197,3,Should fight sense tell after American.,2025-03-01 22:57:18
1314,655,489,2,Partner recent of modern.,2025-07-23 08:40:01
1315,984,353,5,Seat avoid decade employee water down attention.,2025-06-07 16:15:11
1316,499,419,3,Real herself here.,2025-08-28 01:41:36
1317,665,400,1,Same campaign because ready.,2025-01-27 13:08:32
1318,325,247,4,Our office believe gas difficult window.,2025-03-07 20:38:38
1319,179,63,4,Management author whom successful billion course federal.,2025-05-26 02:09:25
1320,725,291,4,Reach southern difficult good tree pressure our.,2025-06-18 03:48:10
1321,992,275,2,Later simply conference item.,2025-06-22 09:02:32
1322,576,479,3,Right school bag employee officer dinner them hand.,2025-01-16 22:06:15
1323,711,184,1,Why view song bit decision.,2025-04-14 18:01:03
1324,911,171,3,Away idea land boy century bag.,2025-04-25 22:02:29
1325,952,350,2,Any choose range food form what.,2025-06-27 09:19:41
1326,629,156,5,Herself value thought impact fish.,2025-06-14 05:28:20
1327,806,206,1,Successful but magazine the company.,2025-07-25 09:07:55
1328,366,29,3,Record book act store free side student.,2025-03-03 14:31:13
1329,229,324,3,Pattern population discussion away.,2025-03-15 04:16:24
1330,682,491,4,Turn church wonder account fine despite.,2025-01-23 15:57:39
1331,604,332,3,Create left yeah lay plan enter give near.,2025-08-07 01:49:29
1332,835,47,3,Structure president provide include tend ask avoid.,2025-02-23 03:06:11
1333,180,188,2,Grow early of player skin hundred property.,2025-05-24 10:55:37
1334,388,274,1,Into rule attack information low crime mean trial.,2025-05-05 13:22:05
1335,315,437,5,Start practice material all marriage picture.,2025-05-12 18:55:43
1336,752,492,4,Ten change success ever who million follow hair.,2025-07-30 07:14:02
1337,706,175,2,Avoid challenge case base major.,2025-08-13 17:31:18
1338,302,42,3,Line such glass crime mission alone.,2025-09-03 04:40:43
1339,131,431,5,Moment baby strategy town.,2025-02-12 11:08:13
1340,182,236,1,Method second fact fear enough though.,2025-01-07 18:11:51
1341,747,390,4,Professional put central want mother.,2025-08-03 22:48:53
1342,2,393,5,Fall only city fill many allow.,2025-06-05 20:52:23
1343,972,149,4,Walk again sense follow power.,2025-06-20 19:51:00
1344,719,332,1,Which away partner writer yourself recognize after.,2025-09-05 23:47:25
1345,972,104,3,Everyone allow fine war customer visit.,2025-06-30 00:36:20
1346,587,91,1,Quality kid go knowledge something.,2025-06-15 13:28:00
1347,401,284,5,System seat pattern put accept window simply full.,2025-02-05 01:22:40
1348,872,21,4,Material success religious get example across push.,2025-02-22 15:29:43
1349,790,496,3,Eat candidate bed debate probably old.,2025-08-28 16:27:23
1350,989,197,3,List provide standard yard end.,2025-07-07 20:29:23
1351,582,339,3,Thousand science dark.,2025-04-08 16:04:56
1352,34,98,1,Heart others several hour enter expect.,2025-09-05 06:45:39
1353,187,154,1,Century state never cost teacher treatment.,2025-03-03 06:58:09
1354,617,357,3,Sell shoulder adult station.,2025-05-27 01:34:04
1355,326,200,2,All enough deep source season.,2025-03-19 11:17:20
1356,944,459,4,Staff pick let dog early practice here.,2025-06-15 16:27:05
1357,829,55,3,Consider probably seat serious institution nothing.,2025-09-02 15:46:25
1358,991,323,1,Performance yard book coach out.,2025-07-09 02:36:43
1359,627,353,1,General growth information recently outside dream.,2025-05-27 13:58:12
1360,227,184,4,Business behavior go trial garden purpose protect.,2025-09-05 06:28:28
1361,655,250,4,Lawyer point blood same.,2025-07-02 00:59:58
1362,580,44,2,Fund structure meet middle while.,2025-05-06 04:33:42
1363,107,454,1,Arm role without rise realize thus.,2025-09-05 08:31:08
1364,960,324,5,Man suddenly phone term.,2025-05-01 04:35:59
1365,509,225,5,Image staff room size I lead fall.,2025-03-19 23:00:50
1366,145,377,2,Magazine office peace yourself away individual.,2025-05-16 20:00:26
1367,340,98,4,Series bag especially many manager drive south.,2025-04-06 15:50:52
1368,764,72,1,Article represent direction middle boy.,2025-09-03 08:54:05
1369,80,19,4,Develop wife high suggest.,2025-03-04 03:17:52
1370,244,99,1,Herself crime benefit suggest fear.,2025-05-07 16:04:03
1371,356,13,2,Industry response out ever record box.,2025-08-12 22:54:48
1372,328,369,3,Image organization listen share.,2025-03-14 13:44:41
1373,172,304,2,Piece prevent toward sell east account piece.,2025-02-26 03:38:51
1374,652,123,4,Now ten condition hit senior brother administration.,2025-01-11 16:26:32
1375,907,251,4,Response bag walk although first project threat authority.,2025-06-25 22:59:25
1376,987,200,3,Defense measure crime this.,2025-01-30 04:55:49
1377,91,33,3,Statement number successful key.,2025-04-26 21:21:57
1378,842,406,3,Administration their team wall church measure.,2025-06-19 21:44:40
1379,726,277,4,Happy sense speak form responsibility.,2025-06-06 22:10:20
1380,687,330,2,Thus theory artist large.,2025-07-21 22:50:24
1381,655,158,5,Development name enjoy wear wish.,2025-02-03 00:38:14
1382,747,256,3,Information management nice quickly book.,2025-06-17 17:54:14
1383,908,274,1,Street six have somebody include build.,2025-08-04 23:30:45
1384,344,495,4,Show down place let medical evidence.,2025-09-06 17:28:49
1385,458,428,4,Put west property item win picture offer.,2025-06-25 01:25:13
1386,12,416,2,Yes during me morning.,2025-01-03 19:15:16
1387,272,231,2,Indicate protect like pay important imagine.,2025-06-12 15:47:02
1388,215,495,3,Reduce now treatment able record.,2025-02-22 09:38:35
1389,256,9,4,Until age respond dog think.,2025-05-12 23:36:14
1390,710,19,1,Difficult hundred ok laugh.,2025-07-27 20:14:51
1391,70,174,3,Crime certain direction change paper.,2025-07-24 15:20:50
1392,359,29,2,Political claim control talk decision throw age station.,2025-03-31 17:03:34
1393,263,173,1,Interest improve too onto.,2025-06-07 22:45:39
1394,806,404,2,Discover claim again.,2025-04-22 07:58:16
1395,111,370,3,Six out least could.,2025-05-02 17:36:06
1396,738,22,1,Information care administration red us feeling.,2025-02-16 12:22:34
1397,2,208,2,Remember scientist goal fish necessary.,2025-05-20 00:06:12
1398,50,61,4,Down write result.,2025-07-16 20:00:49
1399,396,109,4,Last painting technology task hair among prepare.,2025-04-08 14:37:31
1400,449,414,3,Recognize might contain condition structure painting.,2025-01-30 13:00:13
1401,751,335,1,Price chair agency not.,2025-08-09 14:43:42
1402,430,342,2,Site stop only able.,2025-05-21 09:03:15
1403,993,268,2,Believe human sort believe purpose.,2025-06-14 19:09:38
1404,171,235,4,Above during test structure.,2025-05-12 02:19:27
1405,906,482,3,Season organization share modern more.,2025-01-27 17:29:01
1406,424,348,1,Left gas strategy suddenly brother happy matter exist.,2025-06-17 10:50:26
1407,505,446,4,Its reflect reach certain garden prove ever seem.,2025-08-12 09:31:16
1408,903,448,4,Alone listen determine type season they certain.,2025-01-04 22:35:38
1409,388,275,5,Need write place media suffer pay read.,2025-01-09 15:37:04
1410,360,77,4,Drug relate keep task least worry.,2025-07-12 21:23:45
1411,560,380,2,Amount social so total try word.,2025-05-18 11:23:06
1412,385,297,3,Moment down begin good.,2025-07-08 14:56:26
1413,104,120,4,Might citizen picture.,2025-06-10 02:54:23
1414,849,474,5,I hard which she analysis near might spring.,2025-05-21 05:24:37
1415,491,37,4,Power away ready dinner.,2025-02-24 05:59:30
1416,808,19,2,Will baby start fish benefit young if.,2025-04-27 02:36:36
1417,885,377,1,Agency network top company.,2025-08-25 18:45:27
1418,592,73,1,Very parent throw that how develop.,2025-05-10 13:19:15
1419,667,251,1,Conference building former indeed employee whether through.,2025-01-07 22:46:43
1420,777,335,2,Road little camera letter name activity up.,2025-03-05 19:20:12
1421,704,10,2,Somebody receive mention site nice executive themselves candidate.,2025-08-28 10:06:48
1422,231,242,3,Ability final administration practice.,2025-04-20 23:19:05
1423,167,465,5,Than recognize space position.,2025-05-23 09:56:54
1424,463,471,1,Yet scientist dinner full which character.,2025-01-02 22:57:04
1425,76,317,2,Garden simply under magazine.,2025-05-09 00:56:30
1426,819,24,1,Free somebody animal prove wind.,2025-08-07 03:44:18
1427,867,125,3,Apply senior likely poor usually.,2025-06-02 04:50:33
1428,35,360,4,Color behavior interest north teacher.,2025-07-06 10:04:40
1429,302,333,5,Central fly large response sea doctor.,2025-02-22 03:08:15
1430,21,67,1,Share sell choice artist town.,2025-05-10 09:50:16
1431,327,8,4,Drive brother card.,2025-02-02 19:02:41
1432,268,89,4,Miss tend physical attorney old.,2025-02-04 23:02:36
1433,975,324,3,Try heavy expect make pull produce shoulder.,2025-02-03 02:12:50
1434,108,26,3,Major anyone enjoy west.,2025-09-01 20:16:09
1435,76,464,4,Challenge place stand theory plan over.,2025-04-14 00:37:44
1436,351,158,1,Lose ever maintain anyone.,2025-01-17 03:14:28
1437,175,421,4,Surface water power.,2025-06-24 10:11:52
1438,910,407,2,Start next his we music ever do.,2025-06-25 10:11:03
1439,385,50,5,Maybe training game must.,2025-06-09 07:20:06
1440,165,234,2,Stop less care hospital book.,2025-08-30 03:18:52
1441,750,313,5,Time kind four actually establish these.,2025-07-01 07:04:10
1442,77,88,2,Help where area term floor ground space.,2025-04-17 18:58:50
1443,561,428,2,Single tell entire case tough above.,2025-03-21 14:24:08
1444,965,303,3,Around exactly deal well its girl.,2025-04-02 14:55:50
1445,920,33,1,Mr become someone certainly return true student.,2025-08-08 13:10:54
1446,96,419,3,Myself candidate group eight modern tough radio.,2025-03-16 15:23:47
1447,347,419,2,Final test build part care will.,2025-07-18 17:34:17
1448,609,55,4,Vote individual garden way.,2025-03-26 18:05:04
1449,629,59,2,Unit amount one traditional wish new.,2025-08-12 13:49:37
1450,915,255,4,Fire significant add inside attorney apply.,2025-08-20 00:48:05
1451,495,305,1,Always dinner buy development around none.,2025-08-27 15:10:55
1452,722,410,5,Almost why glass.,2025-05-16 20:08:48
1453,32,316,5,Role business assume art side his.,2025-06-03 15:59:20
1454,442,113,2,Cut including whatever.,2025-03-30 07:02:27
1455,966,33,2,Pretty statement radio financial how even per.,2025-01-11 02:03:47
1456,670,412,5,Culture political exactly peace.,2025-07-13 00:38:22
